,big_category,small_category,job_name,company_name,salary,work_area,company_type,work_year,education,recruitment_scale,welfare,company_size
220,前端开发,Web前端开发,中级前端咖啡工程师,江苏润和软件股份有限公司,1-1.5万/月,重庆-渝北区,民营公司,3-4年经验,6,招3人,,5000-10000人
221,前端开发,Web前端开发,前端开发工程师（中级）,函钛科技（重庆）有限公司,0.9-1.5万/月,重庆-渝北区,民营公司,5-7年经验,6,招2人,五险一金 绩效奖金 弹性工作 定期体检 专业培训,少于50人
222,前端开发,Web前端开发,前端开发工程师,重庆酷贝科技发展有限公司,6-8千/月,异地招聘,民营公司,3-4年经验,5,招3人,五险一金 员工旅游 定期体检 年终奖金 绩效奖金,50-150人
223,前端开发,Web前端开发,Web前端开发工程师,重庆酷贝科技发展有限公司,0.8-1万/月,重庆-渝北区,民营公司,3-4年经验,5,招2人,五险一金 定期体检 弹性工作 绩效奖金,50-150人
224,前端开发,Web前端开发,前端开发工程师,重庆酷贝科技发展有限公司,0.8-1万/月,重庆-渝北区,民营公司,3-4年经验,5,招5人,五险一金 定期体检 弹性工作 绩效奖金,50-150人
225,前端开发,Web前端开发,Web前端开发工程师,重庆酷贝科技发展有限公司,1-1.5万/月,重庆-渝北区,民营公司,5-7年经验,5,招1人,五险一金 员工旅游 定期体检 绩效奖金,50-150人
226,前端开发,Web前端开发,Java前端开发工程师,重庆酷贝科技发展有限公司,0.8-1万/月,重庆-渝北区,民营公司,3-4年经验,5,招2人,五险一金 定期体检 弹性工作 绩效奖金,50-150人
227,前端开发,Web前端开发,前端开发工程师,重庆博阿图网络有限公司,1-1.5万/月,重庆-南岸区,民营公司,3-4年经验,6,招1人,五险一金 年终奖金 交通补贴 通讯补贴 餐饮补贴,
228,前端开发,Web前端开发,Web前端开发工程师,深圳极联信息技术股份有限公司,1-1.5万/月,重庆,民营公司,5-7年经验,6,招3人,五险一金 绩效奖金 年终奖金 定期体检 补充医疗保险 补充公积金,500-1000人
229,前端开发,Web前端开发,前端工程师,重庆数宜信信用管理有限公司,1-2万/月,重庆-巴南区,民营公司,3-4年经验,6,招2人,五险一金 绩效奖金,50-150人
230,前端开发,Web前端开发,前端工程师,重庆数宜信信用管理有限公司,1-1.5万/月,重庆-巴南区,民营公司,3-4年经验,6,招3人,五险一金 绩效奖金,50-150人
231,前端开发,Web前端开发,前端开发工程师,重庆酷贝科技发展有限公司,6-8千/月,重庆-渝北区,民营公司,2年经验,6,招10人,五险一金 员工旅游 定期体检 年终奖金 绩效奖金,50-150人
232,前端开发,Web前端开发,前端开发工程师（重庆）,同方股份大数据产业本部,0.7-1.5万/月,重庆-渝北区,国企,3-4年经验,6,招5人,五险一金 周末双休 节日福利 带薪年假,150-500人
233,前端开发,Web前端开发,Web高级前端开发工程师,深圳极联信息技术股份有限公司,1-1.5万/月,重庆-渝北区,民营公司,5-7年经验,5,招若干人,弹性工作 五险一金 全勤奖 专业培训 员工旅游 定期体检 餐饮补贴 绩效奖金,500-1000人
234,前端开发,Web前端开发,Web前端开发工程师,深圳极联信息技术股份有限公司,1.1-1.6万/月,重庆-渝北区,民营公司,3-4年经验,5,招1人,五险一金 员工旅游 定期体检 弹性工作 专业培训 年终奖金,500-1000人
235,前端开发,Web前端开发,Web前端高级开发工程师,重庆睿力诚科技有限公司,1.3-2万/月,重庆-渝北区,民营公司,5-7年经验,6,招1人,五险一金 餐饮补贴 交通补贴 专业培训 绩效奖金 年终奖金 股票期权 意外商业险 节日福利 年底双薪,少于50人
236,前端开发,Web前端开发,APP开发工程师,重庆万紫科技有限公司,3.5-7千/月,重庆-南岸区,民营公司,2年经验,5,招2人,周末双休 带薪年假 绩效奖金 年度旅游 购买社保,50-150人
237,前端开发,Web前端开发,Web开发工程师（高级）,空间视创（重庆）科技股份有限公司,0.9-1.5万/月,重庆-渝北区,民营公司,3-4年经验,6,招1人,五险一金 周末双休 其他补贴 餐饮补贴 年终奖金 生日礼金 结婚生子喜金,50-150人
238,前端开发,Web前端开发,网页设计学徒,重庆嘉锦科技有限公司,3.5-6.5千/月,重庆-九龙坡区,民营公司,无需经验,5,招5人,五险一金 交通补贴 餐饮补贴 专业培训 弹性工作,50-150人
239,前端开发,Web前端开发,html5(前端)实习生,重庆嘉锦科技有限公司,3-4.5千/月,重庆-九龙坡区,民营公司,在校生/应届生,5,招3人,带薪年假 周末双休 五险一金 加班补贴 专业培训,
240,前端开发,Web前端开发,web前端开发实习生,北京佳杰云星数据科技有限公司,150元/天,重庆-渝中区,民营公司,在校生/应届生,6,招若干人,,50-150人
241,前端开发,Web前端开发,Java开发实习生,重庆诺怀软件有限公司,1.5-4千/月,重庆,民营公司,在校生/应届生,6,招若干人,,50-150人
242,前端开发,Web前端开发,UI设计师,重庆尉菡科技有限公司,3-4.5千/月,重庆-南岸区,民营公司,在校生/应届生,5,招1人,社保 年终奖金 节假日福利,少于50人
243,前端开发,Web前端开发,Web前端工程师-实习,重庆电政信息科技有限公司,2-6千/月,重庆-渝北区,民营公司,在校生/应届生,5,招若干人,五险一金 交通补贴 餐饮补贴 提供员工宿舍 半年绩效奖金 弹性工作,50-150人
244,前端开发,Web前端开发,Web前端开发实习生（2022届）,重庆市通信产业服务有限公司中冉信息分公司,1.8-2.5千/月,重庆-渝北区,国企,在校生/应届生,6,招15人,,150-500人
245,前端开发,Web前端开发,前端开发实习生,重庆酷贝科技发展有限公司,1.5-2千/月,重庆-渝北区,民营公司,在校生/应届生,,招3人,,50-150人
246,前端开发,Web前端开发,web前端开发见习生,重庆诺怀软件有限公司,100元/天,重庆,民营公司,在校生/应届生,6,招若干人,专业培训 弹性工作,50-150人
247,前端开发,HTML5开发工程师,前端工程师,重庆雨都科技有限公司,1-1.5万/月,重庆-南岸区,民营公司,3-4年经验,6,招3人,餐饮补贴 绩效奖金 年终奖金 五险,少于50人
248,前端开发,HTML5开发工程师,HTML5开发工程师,重庆斐邦科技有限公司,4.5-9.5千/月,重庆-九龙坡区,民营公司,无需经验,5,招2人,五险一金 专业培训 通讯补贴 餐饮补贴 绩效奖金,
249,前端开发,HTML5开发工程师,软件开发助理,重庆嘉锦科技有限公司,3-4.5千/月,重庆-九龙坡区,民营公司,无需经验,5,招4人,五险一金 交通补贴 餐饮补贴 专业培训 弹性工作,50-150人
250,前端开发,HTML5开发工程师,中级前端开发工程师,北京居家科技有限公司,0.8-1.2万/月,重庆-渝北区,民营公司,3-4年经验,5,招2人,五险 年终奖金,50-150人
251,前端开发,HTML5开发工程师,前端开发工程师,重庆云华科技有限公司,4.5-6千/月,重庆-九龙坡区,民营公司,1年经验,5,招1人,五险一金 员工旅游 交通补贴 餐饮补贴 专业培训 出国机会 年终奖金 股票期权 弹性工作 定期体检,50-150人
252,前端开发,HTML5开发工程师,h5前端助理,重庆敏昀科技有限公司,6-8千/月,重庆-渝中区,民营公司,无需经验,5,招2人,交通补贴 五险一金 绩效奖金 年终奖金 弹性工作 定期体检 员工旅游 餐饮补贴 周末双休 包吃,
253,前端开发,HTML5开发工程师,Web前端开发工程师,重庆旦凡科技有限公司,0.7-1.2万/月,重庆-渝北区,民营公司,3-4年经验,5,招4人,五险一金 弹性工作 绩效奖金 带薪年假 节日福利,少于50人
254,前端开发,HTML5开发工程师,web前端高级开发工程师,重庆黑晶科技有限公司,0.8-1.5万/月,重庆-渝中区,民营公司,5-7年经验,5,招2人,,50-150人
255,前端开发,HTML5开发工程师,web前端开发,重庆市深联电子信息有限公司,0.7-1.5万/月,重庆,民营公司,3-4年经验,6,招5人,五险一金 通讯补贴,50-150人
256,前端开发,HTML5开发工程师,前端开发工程师（高级）,重庆数宜信信用管理有限公司,1.5-2万/月,重庆-渝北区,民营公司,5-7年经验,5,招1人,五险一金 绩效奖金,50-150人
257,前端开发,HTML5开发工程师,前端开发工程师,重庆华晟讯科技有限公司,0.6-1.2万/月,重庆-渝北区,民营公司,3-4年经验,6,招1人,五险一金 弹性工作 定期体检 专业培训 年终奖金 绩效奖金 周末双休 带薪年假,50-150人
258,前端开发,HTML5开发工程师,Web前端开发工程师,重庆傲雄在线信息技术有限公司,0.9-1.6万/月,重庆-渝北区,民营公司,2年经验,5,招2人,餐饮补贴 年终奖金 周末双休 五险一金,150-500人
259,前端开发,HTML5开发工程师,前端开发工程师,深圳市麦斯杰网络有限公司,0.8-1.5万/月,重庆-渝北区,民营公司,3-4年经验,6,招若干人,,50-150人
260,前端开发,HTML5开发工程师,前端开发工程师,重庆普天永惠大数据科技有限公司,0.9-1.3万/月,重庆-渝北区,国企,3-4年经验,5,招10人,,50-150人
261,前端开发,HTML5开发工程师,前端开发工程师,重庆万紫科技有限公司,1-1.5万/月,重庆-南岸区,民营公司,3-4年经验,5,招3人,周末双休 带薪年假 五险 绩效奖金 年度旅游 定期体检 提供住宿,50-150人
262,前端开发,HTML5开发工程师,Web前端开发、HTML5开发工程师,重庆创由科技有限公司,1-1.5万/月,重庆-渝北区,民营公司,3-4年经验,6,招1人,五险一金 员工旅游 定期体检 年终奖金 交通补贴 餐饮补贴 通讯补贴 周末双休,50-150人
263,前端开发,HTML5开发工程师,前端开发工程师（重庆）,杭州远传新业科技有限公司,0.6-1万/月,重庆,民营公司,在校生/应届生,6,招20人,,
264,前端开发,HTML5开发工程师,html5(前端)实习生,重庆嘉锦科技有限公司,3-4.5千/月,重庆-九龙坡区,民营公司,在校生/应届生,5,招3人,带薪年假 周末双休 五险一金 加班补贴 专业培训,
265,前端开发,HTML5开发工程师,前端开发学徒,重庆嘉锦科技有限公司,3.5-6.5千/月,重庆-九龙坡区,民营公司,无需经验,5,招若干人,五险一金 交通补贴 餐饮补贴 专业培训 弹性工作,50-150人
266,前端开发,HTML5开发工程师,前端架构师,北京居家科技有限公司,1.4-2万/月,重庆-渝北区,民营公司,5-7年经验,6,招1人,五险 绩效奖金 年终奖金,50-150人
267,前端开发,HTML5开发工程师,前端开发工程师（中级）,重庆数宜信信用管理有限公司,0.8-1.2万/月,重庆-渝北区,民营公司,3-4年经验,5,招1人,五险一金 绩效奖金,50-150人
268,前端开发,HTML5开发工程师,前端开发工程师（初级）,重庆数宜信信用管理有限公司,0.6-1万/月,重庆-渝北区,民营公司,2年经验,5,招1人,五险一金 绩效奖金,50-150人
269,前端开发,HTML5开发工程师,APP开发工程师,重庆万紫科技有限公司,3.5-7千/月,重庆-南岸区,民营公司,2年经验,5,招2人,周末双休 带薪年假 绩效奖金 年度旅游 购买社保,50-150人
