,big_category,small_category,job_name,company_name,salary,work_area,company_type,work_year,education,recruitment_scale,welfare,company_size
112,前端开发,Web前端开发,前端开发工程师,重庆茂日科技发展有限公司,0.8-1.2万/月,重庆,民营公司,2年经验,5,招2人,员工旅游 绩效奖金 年终奖金 五险 专业培训,50-150人
113,前端开发,Web前端开发,前端开发工程师,北京摩卡软件有限公司,6-8千/月,重庆,外资（非欧美）,2年经验,6,招1人,周末双休 带薪年假 五险一金 节日福利 通讯补贴 免费班车 专业培训,500-1000人
114,前端开发,Web前端开发,前端开发工程师,上海艾飞能源科技有限公司,0.8-1.1万/月,重庆,民营公司,3-4年经验,5,招若干人,五险一金 员工旅游 交通补贴 餐饮补贴 通讯补贴 专业培训 年终奖金 定期体检 绩效奖金,150-500人
115,前端开发,Web前端开发,网页前端开发助理,重庆嘉锦科技有限公司,3-4.5千/月,重庆-九龙坡区,民营公司,无需经验,5,招4人,带薪年假 周末双休 五险一金 加班补贴 专业培训,
116,前端开发,Web前端开发,前端开发（uni-app、vue、微信小程序、H5）,重庆万佳电子信息有限责任公司,3-6千/月,重庆,民营公司,2年经验,5,招3人,五险 法定节假日,50-150人
117,前端开发,Web前端开发,Web前端开发工程师,江苏润和软件股份有限公司,1-1.5万/月,重庆-渝北区,民营公司,2年经验,6,招3人,五险一金 交通补贴 餐饮补贴 弹性工作 年终奖金,5000-10000人
118,前端开发,Web前端开发,前端开发工程师,重庆易额科技有限责任公司,6-8千/月,重庆,民营公司,3-4年经验,5,招3人,年终奖金 绩效奖金 专业培训 出差补贴 五险 交通补贴 餐饮补贴 通讯补贴 项目分红,少于50人
119,前端开发,Web前端开发,Web前端开发工程师,云智汇（重庆）高新科技服务有限公司,1.2-2万/月,重庆,上市公司,5-7年经验,5,招1人,五险一金 免费班车 绩效奖金 年终奖金 定期体检 周末双休 加班补助 提成奖金,150-500人
120,前端开发,Web前端开发,前端程序员,重庆新路云视网络科技有限公司,6-8千/月,重庆-江北区,民营公司,1年经验,5,招4人,五险一金 餐饮补贴 绩效奖金 员工旅游 专业培训 住房补贴,50-150人
121,前端开发,Web前端开发,前端开发工程师,上海新朋程数据科技发展有限公司,1-1.5万/月,重庆-渝北区,合资,3-4年经验,6,招1人,五险一金 员工旅游 定期体检 带薪年假 绩效奖金 年终奖金 双休 员工宿舍,150-500人
122,前端开发,Web前端开发,zy0141-前端开发工程师,中盈优创资讯科技有限公司,0.8-1.6万/月,重庆-渝北区,国企,3-4年经验,6,招5人,五险一金 补充医疗保险 餐饮补贴 通讯补贴 定期体检 绩效奖金 生日福利 节日福利,500-1000人
123,前端开发,Web前端开发,Web前端开发工程师,重庆即停科技有限公司,0.7-1万/月,重庆-九龙坡区,民营公司,3-4年经验,5,招3人,五险一金 周末双休 员工旅游 绩效奖金 年终奖金,50-150人
124,前端开发,Web前端开发,Web前端开发工程师,中讯志远（武汉）科技有限公司,1-1.5万/月,重庆-南岸区,民营公司,5-7年经验,5,招5人,年终奖金 五险一金,50-150人
125,前端开发,Web前端开发,Web初级前端开发工程师,重庆比特数图科技有限公司,5-8千/月,重庆-南岸区,民营公司,无需经验,6,招1人,五险一金 餐饮补贴 定期体检 年终奖金 节假日津贴,50-150人
126,前端开发,Web前端开发,前端技术开发工程师,重庆知行宏图科技有限公司,1-1.5万/月,重庆-渝北区,民营公司,无需经验,6,招2人,五险一金 年终奖金 绩效奖金 弹性工作,50-150人
127,前端开发,Web前端开发,前端开发工程师,函钛科技（重庆）有限公司,6-9千/月,重庆-渝北区,民营公司,1年经验,5,招3人,五险一金 绩效奖金 弹性工作 定期体检 专业培训,少于50人
128,前端开发,Web前端开发,Web前端开发工程师,瑞加科技（广州）有限公司,0.9-1.5万/月,重庆-渝北区,民营公司,5-7年经验,6,招1人,五险一金 餐饮补贴 通讯补贴 定期体检 交通补贴,少于50人
129,前端开发,Web前端开发,高级前端开发工程师,时代云英（重庆）科技有限公司,1-1.5万/月,重庆-渝北区,民营公司,5-7年经验,6,招2人,五险一金 餐饮补贴 专业培训 项目奖金 特殊岗位补贴 带薪年假 周末双休 讲师费 零食下午茶 定期体检,50-150人
130,前端开发,Web前端开发,Web前端开发工程师,重庆迭今网络科技有限公司,0.8-1万/月,重庆-渝中区,民营公司,2年经验,5,招2人,五险一金 餐饮补贴 交通补贴 绩效奖金 年终奖金 专业培训 股票期权,
131,前端开发,Web前端开发,大数据前端开发工程师,重庆酷贝科技发展有限公司,0.8-1万/月,重庆-渝北区,民营公司,3-4年经验,5,招3人,五险一金 员工旅游 定期体检 年终奖金 绩效奖金,50-150人
132,前端开发,Web前端开发,前端开发工程师,重庆念荣科技有限公司,0.8-1万/月,重庆-渝中区,民营公司,2年经验,6,招5人,五险一金 绩效奖金 年终奖金 定期体检 员工旅游 周末双休 节日福利 带薪年假,50-150人
133,前端开发,Web前端开发,web前端,重庆软维科技有限公司,1-1.4万/月,重庆,民营公司,2年经验,5,招5人,五险一金 年终奖金 定期体检,150-500人
134,前端开发,Web前端开发,Web前端开发工程师,重庆博阿图网络有限公司,1-1.5万/月,重庆-南岸区,民营公司,5-7年经验,6,招1人,五险一金 年终奖金 交通补贴 通讯补贴 餐饮补贴,
135,前端开发,Web前端开发,前端开发工程师,重庆荜蓝网络科技有限公司,0.8-1万/月,重庆-南岸区,民营公司,3-4年经验,6,招2人,,少于50人
136,前端开发,Web前端开发,岗位编号DZ-001-前端开发工程师,重庆精耕企业管理咨询有限公司,6-8千/月,重庆,民营公司,3-4年经验,6,招3人,五险一金 绩效奖金 专业培训,50-150人
137,前端开发,Web前端开发,前端开发工程师,重庆华晟讯科技有限公司,0.6-1.2万/月,重庆-渝北区,民营公司,3-4年经验,6,招1人,五险一金 弹性工作 定期体检 专业培训 年终奖金 绩效奖金 周末双休 带薪年假,50-150人
138,前端开发,Web前端开发,资深前端开发工程师,中通服软件科技有限公司,1.5-2万/月,重庆-渝中区,合资,5-7年经验,6,招若干人,餐饮补贴,500-1000人
139,前端开发,Web前端开发,微信小程序开发工程师,重庆蕴明科技股份有限公司,6-8千/月,重庆-九龙坡区,民营公司,3-4年经验,5,招2人,上五休二 公司购买保险 入职提供体检 年终奖金 专业培训,150-500人
140,前端开发,Web前端开发,Web前端开发工程师,深圳极联信息技术股份有限公司,1-1.2万/月,重庆-渝北区,民营公司,3-4年经验,5,招若干人,周末双休 五险一金 全勤奖 定期体检 补充公积金 补充医疗保险 专业培训,500-1000人
141,前端开发,Web前端开发,Web前端开发工程师,重庆雅乐视信息技术有限公司,0.4-1.5万/月,重庆-渝北区,民营公司,2年经验,5,招5人,五险 周末双休 带薪年假 年底双薪,少于50人
142,前端开发,Web前端开发,前端开发工程师,益模（重庆）智能制造研究院有限公司,0.7-1.2万/月,重庆-沙坪坝区,民营公司,3-4年经验,6,招1人,带薪年假 五险一金 绩效奖金 节日福利 7.25hX5天,50-150人
143,前端开发,Web前端开发,Web前端开发工程师,重庆指讯科技股份有限公司,0.6-1万/月,重庆-渝北区,民营公司,2年经验,5,招3人,交通补贴 餐饮补贴 通讯补贴 绩效奖金 年终奖金,少于50人
144,前端开发,Web前端开发,前端工程师（征信产品）,重庆数宜信信用管理有限公司,1-1.5万/月,重庆-渝北区,民营公司,3-4年经验,6,招1人,五险一金 绩效奖金,50-150人
145,前端开发,Web前端开发,Web前端开发工程师,重庆傲雄在线信息技术有限公司,0.9-1.6万/月,重庆-渝北区,民营公司,2年经验,5,招2人,餐饮补贴 年终奖金 周末双休 五险一金,150-500人
146,前端开发,Web前端开发,Web开发工程师,重庆恢恢信息技术有限公司,0.8-1.2万/月,重庆-渝北区,民营公司,3-4年经验,5,招2人,餐饮补贴 绩效奖金 年终奖金 五险,50-150人
147,前端开发,Web前端开发,WEB前端工程师,成都逸朗云科技有限公司,1-1.5万/月,重庆-渝北区,民营公司,3-4年经验,5,招若干人,,少于50人
148,前端开发,Web前端开发,Web前端开发工程师,北京佳杰云星数据科技有限公司,0.8-1万/月,重庆-渝中区,民营公司,3-4年经验,6,招5人,,50-150人
149,前端开发,Web前端开发,高级软件工程师,同方股份大数据产业本部,0.7-1.5万/月,重庆-渝北区,国企,8-9年经验,6,招5人,五险一金 周末双休 节日福利 带薪年假 交通补贴 补充医疗保险 餐饮补贴 定期体检 通话补贴 专业培训,150-500人
150,前端开发,Web前端开发,中级前端开发工程师,上海全晓信息技术有限公司,1-1.5万/月,重庆-江北区,民营公司,3-4年经验,5,招2人,,150-500人
151,前端开发,Web前端开发,前端开发工程师,重庆天智慧启科技有限公司,0.8-1.2万/月,重庆-江北区,民营公司,3-4年经验,6,招若干人,五险一金 交通补贴 通讯补贴 年终奖金 定期体检 员工旅游 餐饮补贴,50-150人
152,前端开发,Web前端开发,Web前端开发工程师,重庆探鹿科技有限公司,7-8.5千/月,重庆-南岸区,民营公司,3-4年经验,5,招1人,,少于50人
153,前端开发,Web前端开发,前端开发工程师+双休+五险一金+餐补,云南缤果科技有限公司,0.6-1万/月,重庆-渝北区,合资,1年经验,6,招若干人,五险一金 员工旅游 餐饮补贴 绩效奖金 年终奖金 弹性工作 定期体检,50-150人
154,前端开发,Web前端开发,Web前端开发工程师,重庆纸飞机科技有限公司,0.9-1.1万/月,重庆-渝北区,民营公司,3-4年经验,5,招4人,绩效奖金 弹性工作 五险,少于50人
155,前端开发,Web前端开发,Java前端开发工程师,重庆奇梦达科技有限公司,6-8千/月,重庆-渝北区,民营公司,3-4年经验,6,招1人,,少于50人
156,前端开发,Web前端开发,前端开发,贵州趣益科技有限责任公司,4-6千/月,重庆-渝北区,民营公司,无需经验,5,招4人,五险一金 交通补贴 补充医疗保险 餐饮补贴 绩效奖金 年终奖金 通讯补贴 补充公积金 定期体检 员工旅游,少于50人
157,前端开发,Web前端开发,前端开发工程师,中投国信（北京）科技发展有限公司,1-1.5万/月,重庆,民营公司,3-4年经验,6,招1人,,150-500人
158,前端开发,Web前端开发,前端开发工程师,重庆普天永惠大数据科技有限公司,0.9-1.3万/月,重庆-渝北区,国企,3-4年经验,5,招10人,,50-150人
159,前端开发,Web前端开发,前端开发工程师,重庆创信智能科技有限公司,0.7-1.5万/月,重庆-沙坪坝区,民营公司,2年经验,5,招2人,缴纳五险 节日红包 绩效奖金 带薪年假 周末双休,少于50人
160,前端开发,Web前端开发,Web前端开发工程师,重庆睿力诚科技有限公司,0.8-1.2万/月,重庆-渝北区,民营公司,2年经验,6,招1人,五险一金 餐饮补贴 交通补贴 绩效奖金 年终奖金 股票期权 意外商业险 周末双休 年底双薪 带薪年假,少于50人
161,前端开发,Web前端开发,Web前端开发工程师,中冶赛迪重庆信息技术有限公司,10-15万/年,重庆,国企,3-4年经验,6,招1人,五险一金 免费班车 专业培训 餐饮补贴 定期体检 员工旅游,500-1000人
162,前端开发,Web前端开发,前端开发工程师,重庆万紫科技有限公司,1-1.5万/月,重庆-南岸区,民营公司,3-4年经验,5,招3人,周末双休 带薪年假 五险 绩效奖金 年度旅游 定期体检 提供住宿,50-150人
163,前端开发,Web前端开发,高级前端开发工程师,上海才扬软件科技有限公司,0.7-1.2万/月,异地招聘,民营公司,3-4年经验,6,招若干人,五险一金 弹性工作 餐饮补贴 员工旅游 绩效奖金 年终奖金,150-500人
164,前端开发,Web前端开发,Web前端开发工程师,重庆诺怀软件有限公司,0.8-1.2万/月,重庆,民营公司,2年经验,6,招1人,五险一金 出国机会 餐饮补贴 年终奖金 绩效奖金,50-150人
165,前端开发,Web前端开发,前端开发组长,重庆嘟旗信科科技集团有限公司,1-1.5万/月,重庆-渝中区,民营公司,5-7年经验,5,招1人,,少于50人
166,前端开发,Web前端开发,Web前端工程师,空间视创（重庆）科技股份有限公司,0.7-1万/月,重庆-渝北区,民营公司,3-4年经验,6,招1人,五险一金 周末双休 其他补贴 餐饮补贴 年终奖金 生日礼金 结婚生子喜金,50-150人
167,前端开发,Web前端开发,Web前端开发工程师,重庆创由科技有限公司,1-1.5万/月,重庆-渝北区,民营公司,3-4年经验,5,招1人,五险一金 员工旅游 定期体检 年终奖金 交通补贴 餐饮补贴 通讯补贴 周末双休,50-150人
168,前端开发,Web前端开发,前端开发主管,重庆深能信息技术有限公司,1-1.5万/月,重庆-渝北区,民营公司,3-4年经验,6,招1人,社保五险 交通补贴 餐饮补贴 通讯补贴 生日礼物 定期体检,少于50人
169,前端开发,Web前端开发,VUE、js前端,重庆金窝窝网络科技有限公司,0.8-1.2万/月,重庆-渝中区,民营公司,3-4年经验,6,招1人,五险一金 员工旅游 专业培训 绩效奖金 年终奖金 定期体检 餐饮补贴,150-500人
170,前端开发,Web前端开发,web前端,重庆涂邦之家科技有限责任公司,0.6-1万/月,重庆-大渡口区,民营公司,2年经验,5,招1人,,150-500人
171,前端开发,Web前端开发,Web前端开发工程师,恒拓开源信息科技股份有限公司广州分公司,1-1.5万/月,重庆-江北区,上市公司,3-4年经验,5,招1人,五险一金 补充医疗保险 专业培训 交通补贴,500-1000人
172,前端开发,Web前端开发,前端开发工程师,成都信达智胜科技有限公司,1-1.5万/月,重庆-渝北区,民营公司,3-4年经验,5,招5人,年终奖金 绩效奖金 专业培训 节日福利 五险一金 定期体检,少于50人
173,前端开发,Web前端开发,Web前端开发工程师,重庆宇物科技有限公司,0.5-1万/月,重庆-江北区,民营公司,2年经验,,招若干人,绩效奖金 餐饮补贴 社保 每月团建 周末双休,少于50人
174,前端开发,Web前端开发,软件测试实习生（双休）,重庆嘉锦科技有限公司,3-4.5千/月,重庆-九龙坡区,民营公司,无需经验,5,招4人,五险一金 交通补贴 餐饮补贴 专业培训 弹性工作,50-150人
175,前端开发,Web前端开发,技术经理,北京弘毅知行科技有限公司,1-1.5万/月,重庆-渝北区,民营公司,3-4年经验,5,招1人,,150-500人
176,前端开发,Web前端开发,前端开发工程师（重庆）,广州南方测绘科技股份有限公司广州分公司,0.7-1.5万/月,重庆,民营公司,在校生/应届生,6,招1人,,
177,前端开发,Web前端开发,web前端开发工程师,北京极客通慧科技有限公司,0.8-1万/月,异地招聘,民营公司,在校生/应届生,5,招5人,五险一金 补充医疗保险 交通补贴 餐饮补贴 年终奖金 绩效奖金 弹性工作 定期体检 出国机会 员工旅游,50-150人
178,前端开发,Web前端开发,Web前端开发工程师实习生,上海新致软件股份有限公司,150元/天,异地招聘,合资,在校生/应届生,6,招10人,,1000-5000人
179,前端开发,Web前端开发,高级前端工程师,重庆云康智联科技有限公司,1.5千以下/月,重庆-沙坪坝区,民营公司,2年经验,6,招1人,五险一金 专业培训 弹性工作 定期体检 年终奖金 绩效奖金,
180,前端开发,Web前端开发,前端开发工程师-渝北区,软通动力信息技术（集团）股份有限公司,1.5-2万/月,重庆-渝北区,民营公司,3-4年经验,5,招10人,五险一金 免费班车 定期体检 员工旅游 餐饮补贴 专业培训,10000人以上
181,前端开发,Web前端开发,前端开发工程师,深圳千域时代科技有限公司,1.5-2万/月,重庆-南岸区,民营公司,5-7年经验,5,招8人,,少于50人
182,前端开发,Web前端开发,React（Remote）,普华永道信息技术（上海）有限公司,1.5-2.5万/月,异地招聘,外资（欧美）,3-4年经验,6,招20人,五险一金 补充医疗保险 通讯补贴 弹性工作 出国机会,500-1000人
183,前端开发,Web前端开发,Web前端开发工程师,重庆广睿达科技有限公司,0.8-1.5万/月,重庆-渝北区,民营公司,5-7年经验,6,招1人,五险一金 绩效奖金 年终奖金 定期体检 团建经费 生日礼金 节假日礼金,50-150人
184,前端开发,Web前端开发,前端开发实习,重庆敏昀科技有限公司,6-8千/月,重庆-渝中区,民营公司,无需经验,5,招2人,交通补贴 五险一金 绩效奖金 年终奖金 弹性工作 定期体检 员工旅游 餐饮补贴 周末双休 包吃,
185,前端开发,Web前端开发,中级前端工程师,重庆摇橹船科技有限公司,1-1.5万/月,重庆-渝北区,合资,3-4年经验,6,招3人,,50-150人
186,前端开发,Web前端开发,前端架构师,北京居家科技有限公司,1.4-2万/月,重庆-渝北区,民营公司,5-7年经验,6,招1人,五险 绩效奖金 年终奖金,50-150人
187,前端开发,Web前端开发,JAVA+前端全栈开发工程师,北京居家科技有限公司,0.6-1.5万/月,重庆-渝北区,民营公司,3-4年经验,5,招6人,五险 专业培训 绩效奖金 年终奖金 周末双休,50-150人
188,前端开发,Web前端开发,前端flutter开发工程师,深圳麦亚信科技股份有限公司,1-1.5万/月,重庆-渝北区,上市公司,3-4年经验,5,招4人,五险一金 员工旅游 生日礼物 司龄补贴 过节礼物 年度体检 伯乐奖 级别福利,500-1000人
189,前端开发,Web前端开发,中高级前端开发工程师,深圳麦亚信科技股份有限公司,0.9-1.4万/月,重庆-渝北区,上市公司,3-4年经验,5,招4人,五险一金 员工旅游 生日礼物 司龄补贴 过节礼物 年度体检 伯乐奖 级别福利,500-1000人
190,前端开发,Web前端开发,Web前端开发工程师,北京享控智能科技有限公司,0.8-1万/月,重庆-渝北区,民营公司,2年经验,6,招1人,,50-150人
191,前端开发,Web前端开发,中级前端工程师,重庆电政信息科技有限公司,0.8-1万/月,重庆-渝北区,民营公司,3-4年经验,5,招2人,五险一金 绩效奖金 周末双休 员工宿舍 弹性工作 全勤奖 节假日福利 交通补贴 餐饮补贴 半年调薪机会,50-150人
192,前端开发,Web前端开发,资深web前端开发工程师,重庆扬升信息技术有限公司,1.2-1.5万/月,重庆-渝北区,民营公司,5-7年经验,6,招3人,通讯补贴 交通补贴 周末双休 绩效奖金 节日福利 年终奖金 五险 专业培训,50-150人
193,前端开发,Web前端开发,前端开发工程师,重庆首厚智能科技研究院有限公司,0.8-1.2万/月,重庆-渝北区,民营公司,2年经验,6,招2人,专业培训 餐饮补贴 通讯补贴 绩效奖金 年终奖金 五险,50-150人
194,前端开发,Web前端开发,Web前端开发工程师,重庆旦凡科技有限公司,0.7-1.2万/月,重庆-渝北区,民营公司,3-4年经验,5,招4人,五险一金 弹性工作 绩效奖金 带薪年假 节日福利,少于50人
195,前端开发,Web前端开发,中级前端开发工程师,重庆市通信产业服务有限公司中冉信息分公司,0.6-1.2万/月,重庆,国企,3-4年经验,6,招2人,五险一金 定期体检 交通补贴 通讯补贴 餐饮补贴 专业培训,150-500人
196,前端开发,Web前端开发,Web前端开发工程师,重庆黑晶科技有限公司,0.4-1万/月,重庆-渝中区,民营公司,3-4年经验,5,招若干人,五险 周末双休 带薪年假 绩效奖金 项目奖金 突出贡献奖 年终奖金,50-150人
197,前端开发,Web前端开发,前端开发工程师,亚信在线BIU,0.9-1万/月,重庆-渝北区,合资,3-4年经验,6,招2人,五险一金 弹性工作 周末双休 生日福利,10000人以上
198,前端开发,Web前端开发,Web前端开发工程师,湖北蜂云软件有限公司,6-8千/月,重庆-渝北区,民营公司,2年经验,5,招若干人,餐饮补贴 专业培训 绩效奖金 弹性工作,50-150人
199,前端开发,Web前端开发,Web前端开发工程师,重庆南地科技开发有限公司,0.8-1.8万/月,重庆-渝北区,民营公司,3-4年经验,5,招3人,五险一金 绩效奖金 年终奖金 生日礼品 过节礼品 劳保用品 员工旅游 餐饮补贴 交通补贴,50-150人
200,前端开发,Web前端开发,Web前端开发工程师(VUE),上海臻鼎健康科技有限公司,1-1.5万/月,重庆-渝北区,民营公司,3-4年经验,6,招1人,五险一金 专业培训 定期体检 年终奖金 绩效奖金,50-150人
201,前端开发,Web前端开发,Web前端开发工程师(重庆）,上海臻鼎健康科技有限公司,1-1.5万/月,重庆-渝北区,民营公司,5-7年经验,6,招1人,五险一金 弹性工作 员工旅游 出国机会 绩效奖金 年终奖金 定期体检,50-150人
202,前端开发,Web前端开发,Web前端开发工程师(重庆）,上海臻鼎健康科技有限公司,1-1.5万/月,重庆-渝北区,民营公司,3-4年经验,6,招1人,五险一金 弹性工作 员工旅游 出国机会 绩效奖金 年终奖金 定期体检,50-150人
203,前端开发,Web前端开发,Web前端开发工程师,重庆青竹数智科技有限公司,0.8-1.2万/月,重庆-九龙坡区,民营公司,3-4年经验,5,招1人,五险一金 节日福利,少于50人
204,前端开发,Web前端开发,前端开发工程师,深圳麦亚信科技股份有限公司,1.2-1.8万/月,重庆-渝中区,上市公司,5-7年经验,5,招1人,五险一金 员工旅游 生日礼物 司龄补贴 过节礼物 年度体检 伯乐奖 级别福利 周末双休 年终奖金,500-1000人
205,前端开发,Web前端开发,Web前端开发工程师,北京天健源达科技股份有限公司,6-9千/月,重庆-九龙坡区,民营公司,2年经验,5,招1人,五险一金 通讯补贴 餐饮补贴,500-1000人
206,前端开发,Web前端开发,Web前端开发工程师,北京天健源达科技股份有限公司,6-9千/月,重庆-九龙坡区,民营公司,2年经验,5,招1人,五险一金 餐饮补贴,500-1000人
207,前端开发,Web前端开发,前端开发工程师（五险一金双休朝九晚六年终奖）,深圳麦亚信科技股份有限公司,1-1.5万/月,重庆-渝中区,上市公司,3-4年经验,5,招3人,五险一金 员工旅游 生日礼物 司龄补贴 过节礼物 年度体检 伯乐奖 级别福利 年终奖金 周末双休,500-1000人
208,前端开发,Web前端开发,前端开发（珠海工行+远程面试）,北京汉克时代科技有限公司,1.1-1.8万/月,异地招聘,民营公司,3-4年经验,6,招若干人,,1000-5000人
209,前端开发,Web前端开发,前端开发工程师（混合开发、跨平台开发）,重庆千变科技有限公司,0.6-1.2万/月,重庆-渝北区,民营公司,2年经验,5,招1人,,50-150人
210,前端开发,Web前端开发,zy0053-前端工程师,中盈优创资讯科技有限公司,0.8-1.4万/月,重庆-渝北区,国企,3-4年经验,6,招6人,五险一金 补充医疗保险 餐饮补贴 通讯补贴 定期体检 绩效奖金 生日福利 节日福利,500-1000人
211,前端开发,Web前端开发,zy0046-高级前端开发工程师,中盈优创资讯科技有限公司,1.2-2万/月,重庆-渝北区,国企,2年经验,6,招5人,五险一金 补充医疗保险 餐饮补贴 通讯补贴 定期体检 绩效奖金 生日福利 节日福利,500-1000人
212,前端开发,Web前端开发,zy0042-高级前端工程师,中盈优创资讯科技有限公司,0.8-1.6万/月,重庆-渝北区,国企,3-4年经验,6,招5人,五险一金 补充医疗保险 餐饮补贴 通讯补贴 定期体检 绩效奖金 生日福利 节日福利,500-1000人
213,前端开发,Web前端开发,zy0029-Java前端开发工程师,中盈优创资讯科技有限公司,1-2万/月,重庆-渝北区,国企,3-4年经验,6,招5人,五险一金 补充医疗保险 餐饮补贴 通讯补贴 定期体检 绩效奖金 生日福利 节日福利,500-1000人
214,前端开发,Web前端开发,Web前端开发工程师,成都迈思信息技术有限公司,1-1.5万/月,重庆-江北区,民营公司,3-4年经验,5,招若干人,五险一金 弹性工作 周末双休 朝九晚六,150-500人
215,前端开发,Web前端开发,Web前端开发工程师,重庆即停科技有限公司,6-8千/月,重庆-九龙坡区,民营公司,3-4年经验,5,招2人,五险一金 周末双休 员工旅游 绩效奖金 年终奖金,50-150人
216,前端开发,Web前端开发,java/net/web/DBA/优炫数据/软件工程师,中讯志远（武汉）科技有限公司,6-8千/月,重庆-渝中区,民营公司,2年经验,5,招若干人,年终奖金 五险一金,50-150人
217,前端开发,Web前端开发,高级Web前端研发工程师,重庆比特数图科技有限公司,1-1.5万/月,重庆-南岸区,民营公司,3-4年经验,6,招1人,五险一金 餐饮补贴 定期体检 弹性工作 年终奖金 员工旅游 节假日津贴 技能津贴,50-150人
218,前端开发,Web前端开发,中级Web前端研发工程师,重庆比特数图科技有限公司,0.8-1万/月,重庆-南岸区,民营公司,2年经验,6,招5人,五险一金 年终奖金 餐饮补贴 定期体检 弹性工作 员工旅游 专业培训 节假日津贴 技能津贴,50-150人
219,前端开发,Web前端开发,前端开发工程师,江苏润和软件股份有限公司,1-2万/月,重庆-渝北区,民营公司,3-4年经验,6,招若干人,,5000-10000人
