,big_category,small_category,job_name,company_name,salary,work_area,company_type,work_year,education,recruitment_scale,welfare,company_size
0,移动开发,Android开发工程师,Android开发工程师,成都迈思信息技术有限公司,1-1.5万/月,成都-高新区,民营公司,5-7年经验,5,招若干人,五险一金 弹性工作 绩效奖金 年终奖金 交通补贴,150-500人
1,移动开发,Android开发工程师,Android BSP开发工程师,成都天软信息技术有限公司,1.2-2万/月,成都,民营公司,3-4年经验,6,招5人,五险一金 员工旅游 年终奖金 定期体检 周末双休 节日福利 专业培训,150-500人
2,移动开发,Android开发工程师,Anroid 高级工程师,深圳市智阳软件有限公司,1-1.5万/月,成都-锦江区,民营公司,2年经验,6,招2人,五险一金 员工旅游 年终奖金 股票期权,少于50人
3,移动开发,Android开发工程师,Android开发工程师,成都千行科技有限公司,1-1.5万/月,成都,民营公司,2年经验,5,招1人,五险一金 员工旅游 绩效奖金 年终奖金 股票期权 弹性工作 定期体检,50-150人
4,移动开发,Android开发工程师,Android开发工程师,四川鹏杰智联科技有限责任公司,1-1.2万/月,成都-高新区,民营公司,2年经验,5,招1人,周末双休 弹性工作 带薪年假 社保,少于50人
5,移动开发,Android开发工程师,Android开发工程师,成都法美尔科技有限公司,0.8-1.2万/月,成都,民营公司,2年经验,6,招1人,五险一金 交通补贴 绩效奖金 年终奖金 通讯补贴 餐饮补贴 员工旅游 13薪,50-150人
6,移动开发,Android开发工程师,Android开发工程师,成都心泽科技有限公司,6-8千/月,成都-武侯区,民营公司,3-4年经验,5,招2人,五险一金 交通补贴 餐饮补贴 年终奖金,50-150人
7,移动开发,Android开发工程师,Android开发工程师,中软国际科技服务有限公司,1-1.5万/月,成都-武侯区,合资,2年经验,5,招5人,周末双休 带薪年假 五险一金 餐饮补贴 年终奖金 弹性工作,10000人以上
8,移动开发,Android开发工程师,Android开发工程师,普联技术有限公司（TP-LINK),1.5-2万/月,成都-高新区,民营公司,2年经验,6,招若干人,五险一金 免费班车 年终奖金 做五休二 餐饮补贴 带薪年假 节日福利,10000人以上
9,移动开发,Android开发工程师,Android开发工程师,图丰信息（成都）有限责任公司,1-1.5万/月,成都-金牛区,外资（欧美）,5-7年经验,6,招2人,五险一金 弹性工作 年终奖金 员工旅游 餐饮补贴 股票期权 周末双休,150-500人
10,移动开发,Android开发工程师,Android高级开发工程师,成都迈瑞企业管理咨询有限公司,1.2-1.8万/月,成都-高新区,民营公司,3-4年经验,6,招3人,五险一金 专业培训 节日福利 全勤奖 绩效奖金 做五休二,50-150人
11,移动开发,Android开发工程师,Android开发工程师,深圳市沐荫教育咨询有限公司,1.5-2.5万/月,成都-武侯区,民营公司,3-4年经验,5,招1人,五险一金 餐饮补贴 交通补贴 弹性工作 补充医疗保险,50-150人
12,移动开发,Android开发工程师,安卓研发工程师,成都顺腾科技有限责任公司,1-1.5万/月,成都-锦江区,民营公司,2年经验,5,招3人,五险一金 专业培训 绩效奖金 年终奖金 下午茶 带薪旅游 周末双休 朝九晚六,50-150人
13,移动开发,Android开发工程师,Android中高级开发工程师,成都易达数安科技有限公司,1.5-2万/月,成都-高新区,民营公司,5-7年经验,6,招4人,五险一金 交通补贴 餐饮补贴 通讯补贴 年终奖金 绩效奖金 股票期权,150-500人
14,移动开发,Android开发工程师,Android开发工程师,深圳市瑞驰信息技术有限公司,1-2万/月,成都-高新区,民营公司,5-7年经验,5,招2人,五险一金 专业培训 绩效奖金 年终奖金 股票期权,150-500人
15,移动开发,Android开发工程师,android 初级开发工程师（成都乾隆）,上海乾隆高科技有限公司,0.5-1万/月,成都,外资（非欧美）,1年经验,6,招2人,周末双休 五险一金 带薪年假 员工旅游 交通补贴 餐饮补贴 专业培训 绩效奖金 年终奖金 定期体检,150-500人
16,移动开发,Android开发工程师,Android开发工程师,江苏嘉则信息技术有限公司,0.9-2.5万/月,异地招聘,民营公司,3-4年经验,6,招1人,五险一金 员工旅游 交通补贴 年终奖金 绩效奖金 专业培训 定期体检 弹性工作 节日福利,50-150人
17,移动开发,Android开发工程师,中级安卓开发工程师,成都市景鸿科技有限公司,1-1.5万/月,成都-金牛区,民营公司,3-4年经验,5,招2人,五险一金 餐饮补贴 通讯补贴 交通补贴 年终奖金 弹性工作 绩效奖金,50-150人
18,移动开发,Android开发工程师,Android开发工程师（互联网业务部）,成都格理特电子技术有限公司,1.2-1.7万/月,成都-高新区,民营公司,3-4年经验,5,招1人,五险一金 绩效奖金 年终奖金,50-150人
19,移动开发,Android开发工程师,Android开发（成都）,上海海万信息科技股份有限公司,1.1-1.5万/月,成都-高新区,民营公司,3-4年经验,6,招若干人,,1000-5000人
20,移动开发,Android开发工程师,Android开发工程师,成都恒视通科技有限公司,1-1.5万/月,成都-高新区,民营公司,3-4年经验,6,招1人,五险一金 员工旅游 餐饮补贴 年终奖金 定期体检 绩效奖金 专业培训 弹性工作 通讯补贴 交通补贴,50-150人
21,移动开发,Android开发工程师,Flutter 开发工程师,四川众鹏科技有限公司,1-1.5万/月,成都-高新区,民营公司,3-4年经验,6,招1人,五险一金 绩效奖金 年底双薪 定期体检,50-150人
22,移动开发,Android开发工程师,Android开发工程师,四川弘和集团,0.7-1.5万/月,成都-武侯区,民营公司,2年经验,6,招1人,五险一金 餐饮补贴 绩效奖金 交通补贴 股票期权 弹性工作 通讯补贴,150-500人
23,移动开发,Android开发工程师,安卓开发工程师,成都佳发安泰教育科技股份有限公司,0.6-1.2万/月,成都-武侯区,上市公司,1年经验,6,招1人,周末双休 带薪年假 五险一金 节日福利 绩效奖金 定期体检 年终奖金,500-1000人
24,移动开发,Android开发工程师,Android高级开发工程师,天维尔信息科技股份有限公司,1.5-3万/月,成都-武侯区,民营公司,5-7年经验,6,招3人,五险一金 员工旅游 通讯补贴 专业培训 绩效奖金 弹性工作 定期体检,150-500人
25,移动开发,Android开发工程师,Android系统开发工程师,成都甲乙方程科技有限公司,6-9千/月,成都-高新区,民营公司,3-4年经验,5,招2人,五险一金 绩效奖金 年终奖金 岗位长期稳定 多元化收入 工作氛围良好 办公环境舒适 股票期权,少于50人
26,移动开发,Android开发工程师,Android开发工程师,四川乾堂科技有限公司,0.8-1.5万/月,成都-高新区,民营公司,2年经验,5,招5人,六险一金 专业培训 绩效奖金 年终奖金 股票期权 弹性工作 丰富的下午茶 不间断茶歇,50-150人
27,移动开发,Android开发工程师,Android开发工程师,昆山双宇新信息科技有限公司,6-8千/月,成都,民营公司,无需经验,5,招3人,五险一金 年终奖金 绩效奖金 员工旅游 餐饮补贴 出国机会,少于50人
28,移动开发,Android开发工程师,Android中级开发工程师,成都荣为信息技术有限公司,0.8-1.5万/月,成都,民营公司,2年经验,5,招2人,周末双休 带薪年假 五险一金 绩效奖金 全勤奖 节日福利 交通补贴 加班补贴 餐饮补贴,少于50人
29,移动开发,Android开发工程师,Android开发工程师（YD）G00384,成都卫士通信息产业股份有限公司,1.5-2万/月,成都,上市公司,3-4年经验,6,招1人,五险一金 补充医疗保险 交通补贴 餐饮补贴 通讯补贴 绩效奖金 定期体检 高温假期 年终奖金,1000-5000人
30,移动开发,Android开发工程师,安卓原生开发工程师,成都明途科技有限公司,0.6-1万/月,成都-武侯区,民营公司,2年经验,6,招若干人,社保 通讯补贴 交通补贴 定期体检,150-500人
31,移动开发,Android开发工程师,Android开发工程师,成都万开科技有限公司,1-1.5万/月,成都-郫都区,民营公司,3-4年经验,6,招1人,五险 年终奖金 绩效奖金 13薪 半年调薪 周末双休 带薪节假日 团建 生日红包 晋升,50-150人
32,移动开发,Android开发工程师,游戏SDK前端工程师,天津羽仁科技有限公司,0.8-1.5万/月,成都-武侯区,民营公司,2年经验,5,招1人,五险一金 员工旅游 定期体检 年终奖金 零食下午茶 年度礼品 全勤奖,50-150人
33,移动开发,Android开发工程师,Android开发工程师,成都亿铭睿辰科技有限公司,1.2-2万/月,成都-高新区,民营公司,3-4年经验,6,招1人,五险一金 股票期权 年终奖金 绩效奖金 餐饮补贴 弹性工作,50-150人
34,移动开发,Android开发工程师,Android开发工程师,上海互盾信息科技有限公司,1-1.5万/月,成都-高新区,民营公司,3-4年经验,5,招2人,五险一金 绩效奖金 年终奖金 全勤奖 节日福利 周末双休 团队聚餐,150-500人
35,移动开发,Android开发工程师,Android开发工程师,成都帅猫科技有限公司,0.9-1.5万/月,成都-高新区,民营公司,2年经验,5,招1人,五险一金 年终奖金 节日福利 绩效奖金,少于50人
36,移动开发,Android开发工程师,Android开发工程师,成都星分翼轸智能科技有限公司,0.8-1.2万/月,成都-高新区,民营公司,2年经验,6,招3人,五险一金 弹性工作,50-150人
37,移动开发,Android开发工程师,Android开发工程师,成都麦华崃科技有限公司,2-3万/月,成都-高新区,民营公司,3-4年经验,,招2人,,少于50人
38,移动开发,Android开发工程师,Android / JAVA开发工程师,南京普惠恒丰信息科技有限公司,0.6-1.2万/月,成都,民营公司,1年经验,6,招1人,五险一金 餐饮补贴 通讯补贴 加班补贴 绩效奖金 年终奖金 周末双休,50-150人
39,移动开发,Android开发工程师,Android 开发工程师（ZX-T-017）,中科院成都信息技术股份有限公司,6-8千/月,成都,国企,1年经验,6,招若干人,餐饮补贴 周末双休 节日福利 五险一金 绩效奖金 年终奖金 专业培训,150-500人
40,移动开发,Android开发工程师,Android开发工程师,四川格锐乾图科技有限公司,0.8-1.5万/月,成都,民营公司,3-4年经验,6,招2人,五险一金 餐饮补贴 年终奖金 周末双休 带薪年假 节日福利 绩效奖金,少于50人
41,移动开发,Android开发工程师,Android开发工程师,成都长益西联软件有限公司,0.8-1.3万/月,成都-高新区,民营公司,2年经验,6,招2人,通讯补贴 带薪年假 节日福利 定期体检 年终奖金 绩效奖金 员工旅游 弹性工作 五险一金,150-500人
42,移动开发,Android开发工程师,Android 软件开发工程师,深圳市海芯威视科技有限公司,15-20万/年,成都-高新区,民营公司,3-4年经验,6,招1人,五险一金 员工旅游 专业培训 绩效奖金 年终奖金 定期体检,50-150人
43,移动开发,Android开发工程师,Android高级开发工程师,成都持波科技有限公司,1.3-1.6万/月,成都-高新区,外资（非欧美）,3-4年经验,6,招1人,,150-500人
44,移动开发,Android开发工程师,Android开发工程师（0510）,成都华鼎智胜科技有限公司,0.8-1.3万/月,成都-高新区,民营公司,2年经验,5,招2人,五险一金 餐饮补贴 绩效奖金,少于50人
45,移动开发,Android开发工程师,Android开发工程师,福建星网智慧科技有限公司,1.5-2万/月,成都,合资,1年经验,6,招2人,五险一金 员工旅游 通讯补贴 专业培训 年终奖金 股票期权 定期体检 弹性工作,500-1000人
46,移动开发,Android开发工程师,andriod开发工程师,信联科技（南京）有限公司,0.6-1.2万/月,成都-高新区,民营公司,2年经验,6,招1人,五险一金 定期体检 节日福利 员工旅游 周末双休,50-150人
47,移动开发,Android开发工程师,Android开发工程师,成都量子捷云网络技术有限公司,1-1.5万/月,成都-锦江区,民营公司,5-7年经验,6,招2人,五险一金 年终奖金 餐饮补贴 周末双休 绩效奖金 定期体检 定期团建 员工旅游,少于50人
48,移动开发,Android开发工程师,camera Tuning工程师,江苏润和软件股份有限公司,1.5-2万/月,异地招聘,民营公司,1年经验,5,招5人,五险一金 餐饮补贴 弹性工作 定期体检 周末双休,5000-10000人
49,移动开发,Android开发工程师,Android开发工程师,华通科技有限公司,1-1.5万/月,成都-锦江区,民营公司,3-4年经验,5,招5人,,500-1000人
50,移动开发,Android开发工程师,Android（外派平安科技）,深圳市睿服科技有限公司,1-1.5万/月,成都-锦江区,民营公司,3-4年经验,5,招若干人,五险一金 补充医疗保险 员工旅游 交通补贴 餐饮补贴 专业培训 绩效奖金 年终奖金 定期体检 员工体检,500-1000人
51,移动开发,Android开发工程师,Android开发工程师,江苏超正科技有限公司,2.5-3万/月,成都,民营公司,3-4年经验,6,招若干人,,150-500人
52,移动开发,Android开发工程师,高级安卓开发工程师   双休  年终奖,国广互联科技（北京）有限公司,2-2.5万/月,成都-武侯区,民营公司,3-4年经验,6,招1人,五险一金 年终奖金 绩效奖金 定期体检 弹性工作,50-150人
53,移动开发,Android开发工程师,Android开发工程师,成都熙恩网络科技有限公司,1.5-2万/月,成都-郫都区,民营公司,3-4年经验,5,招5人,五险一金 绩效奖金 年终奖金,150-500人
54,移动开发,Android开发工程师,Android开发工程师,成都达拓智通科技有限公司,0.9-1.2万/月,成都-武侯区,民营公司,1年经验,6,招1人,五险一金 补充医疗保险 员工旅游 交通补贴 年终奖金 绩效奖金 定期体检 专业培训 早九晚六 周末双休,少于50人
55,移动开发,Android开发工程师,Android 高级开发软件工程师,四川安施创科技有限公司,0.8-1.5万/月,成都-金牛区,民营公司,3-4年经验,5,招4人,五险一金 餐饮补贴 交通补贴 绩效奖金,50-150人
56,移动开发,Android开发工程师,Android开发工程师,成都智元汇信息技术股份有限公司,1.2-1.8万/月,成都-高新区,民营公司,3-4年经验,6,招1人,五险一金 年终奖金 定期体检 带薪年假 节日福利 零食下午茶,150-500人
57,移动开发,Android开发工程师,Android开发工程师,四川鱼鳞图信息技术股份有限公司,0.8-1.1万/月,成都-金牛区,民营公司,2年经验,6,招1人,五险一金 员工意外险 绩效奖金 节日福利 带薪年假 餐饮补贴 弹性工作 项目奖金,1000-5000人
58,移动开发,Android开发工程师,Android开发工程师G00356,上海数慧系统技术有限公司,0.8-1.5万/月,成都-武侯区,民营公司,无需经验,6,招3人,五险一金 交通补贴 餐饮补贴 通讯补贴 定期体检 年底双薪 餐补 带薪年假 绩效奖金 节日福利,150-500人
59,移动开发,Android开发工程师,安卓android开发工程师,成都宜联科技有限责任公司,6-8千/月,成都-高新区,民营公司,1年经验,5,招1人,五险一金 年终奖金 餐饮补贴 绩效奖金,少于50人
60,移动开发,Android开发工程师,Android开发,深圳市华云中盛科技股份有限公司,1.2-2万/月,成都,民营公司,3-4年经验,6,招若干人,,500-1000人
61,移动开发,Android开发工程师,Android开发工程师,海创基业（深圳）投资有限公司,1-1.5万/月,成都-高新区,民营公司,3-4年经验,5,招1人,五险一金,50-150人
62,移动开发,Android开发工程师,Android开发工程师,成都派沃特科技股份有限公司,0.8-1万/月,成都,民营公司,1年经验,6,招1人,五险一金 通讯补贴 定期体检 员工旅游 年终奖金 交通补贴 餐饮补贴,50-150人
63,移动开发,Android开发工程师,Android开发工程师 (MJ000469),瞬联软件科技（北京）有限公司 CIeNET Technologies,1.5-3万/月,成都-武侯区,外资（欧美）,3-4年经验,6,招10人,补充医疗保险 定期体检 七险一金 带薪年假 带薪病假 免费健身,1000-5000人
64,移动开发,Android开发工程师,Android工程师(性能优化),信必优(深圳)信息技术有限公司,1-1.5万/月,成都,外资（欧美）,2年经验,6,招1人,五险一金 带薪年假 补充医疗保险 定期体检 定期团建 节日福利,1000-5000人
65,移动开发,Android开发工程师,高级android开发工程师,中科创达软件股份有限公司,1.8-3.5万/月,异地招聘,上市公司,5-7年经验,6,招20人,五险一金 餐饮补贴 补充医疗保险 员工旅游 交通补贴 年终奖金 弹性工作,5000-10000人
66,移动开发,Android开发工程师,中高级Android开发工程师,深圳巴伦如梭网络有限公司成都分公司,1.2-2万/月,成都-高新区,民营公司,3-4年经验,6,招2人,五险一金 员工旅游 餐饮补贴 绩效奖金 年终奖金 股票期权 定期体检,150-500人
67,移动开发,Android开发工程师,Android开发工程师,成都微鑫通时代科技有限公司,6-8千/月,成都-高新区,民营公司,1年经验,5,招2人,五险一金 专业培训 定期体检 弹性工作 绩效奖金 年终奖金 交通补贴 水果零食,50-150人
68,移动开发,Android开发工程师,Android软件工程师,成都网丁科技有限公司,0.9-1.6万/月,成都-高新区,民营公司,3-4年经验,6,招2人,五险一金 年终奖金 定期体检 弹性工作,50-150人
69,移动开发,Android开发工程师,Android开发工程师,成都进兴广美网络科技有限公司,1.2-1.8万/月,成都-高新区,民营公司,3-4年经验,5,招1人,,50-150人
70,移动开发,Android开发工程师,Android开发工程师,成都巧彦科技有限公司,1.2-2万/月,成都-武侯区,民营公司,3-4年经验,6,招2人,,
71,移动开发,Android开发工程师,Android开发工程师,福建国科信息科技有限公司,1-1.5万/月,成都-高新区,民营公司,3-4年经验,5,招1人,,150-500人
72,移动开发,Android开发工程师,Android开发工程师,珠海凡泰极客科技有限责任公司,1.5-2.5万/月,异地招聘,创业公司,2年经验,6,招2人,补充医疗保险 绩效奖金 年终奖金 远程协同 在家办公 培训津贴,50-150人
73,移动开发,Android开发工程师,Android开发工程师,成都华安视讯科技有限公司,0.8-1.5万/月,成都-高新区,民营公司,2年经验,6,招1人,,50-150人
74,移动开发,Android开发工程师,安卓研发工程师(J10364),中移（杭州）信息技术有限公司,30-40万/年,成都,国企,3-4年经验,6,招1人,五险一金 交通补贴 餐饮补贴 绩效奖金 补充医疗保险 年终奖金 定期体检 通讯补贴,1000-5000人
75,移动开发,Android开发工程师,Android开发工程师,深圳市德科信息技术有限公司,1.5-2万/月,成都,民营公司,3-4年经验,5,招2人,,1000-5000人
76,移动开发,Android开发工程师,Android开发工程师,音泰思计算机技术（成都）有限公司,1-1.5万/月,成都,合资,5-7年经验,5,招1人,周末双休 五险一金 员工旅游 出国机会 餐饮补贴 年终奖金 定期体检,150-500人
77,移动开发,Android开发工程师,Android高级开发工程师,四川天正信息科技有限公司,1.5-2万/月,成都-高新区,民营公司,3-4年经验,6,招2人,五险一金 员工旅游 餐饮补贴 专业培训 绩效奖金 年终奖金 定期体检,少于50人
78,移动开发,Android开发工程师,Android APP研发工程师(004122),成都中科创达软件有限公司,1.5-2万/月,成都,上市公司,5-7年经验,,招5人,五险一金 年终奖金 弹性工作,150-500人
79,移动开发,Android开发工程师,安卓开发工程师,成都弘信科技股份有限公司,0.7-1.2万/月,成都-锦江区,民营公司,2年经验,6,招若干人,,50-150人
80,移动开发,Android开发工程师,Android开发工程师,深圳极联信息技术股份有限公司,1-1.5万/月,成都-高新区,民营公司,3-4年经验,5,招若干人,五险一金 员工旅游 定期体检 弹性工作 年终奖金 补充医疗保险 补充公积金,500-1000人
81,移动开发,Android开发工程师,Android开发工程师（成都）,成都东方盛行电子有限责任公司,0.9-1.8万/月,异地招聘,民营公司,3-4年经验,6,招2人,五险一金 餐饮补贴 交通补贴 绩效奖金 年终奖金 定期体检,50-150人
82,移动开发,Android开发工程师,Android开发工程师,四川中电启明星信息技术有限公司,0.8-1万/月,成都-武侯区,国企,2年经验,6,招1人,五险一金 补充医疗保险 交通补贴 餐饮补贴 通讯补贴 专业培训 年终奖金,1000-5000人
83,移动开发,Android开发工程师,Android 中高级开发工程师,成都纵横格子科技有限公司,0.8-1.1万/月,成都-高新区,民营公司,2年经验,5,招1人,五险一金 年终奖金 定期体检 员工旅游 弹性工作,少于50人
84,移动开发,Android开发工程师,Flutter App 开发工程师,厦门道唯思信息技术有限公司,1-1.5万/月,成都-高新区,民营公司,1年经验,6,招2人,五险一金 弹性工作 交通补贴 通讯补贴,少于50人
85,移动开发,Android开发工程师,Android开发工程师,成都联成科大信息技术有限责任公司,15-20万/年,成都-武侯区,民营公司,1年经验,6,招1人,餐饮补贴 绩效奖金 年终奖金 社保 弹性工作 专业培训 五险一金,50-150人
86,移动开发,Android开发工程师,移动应用开发-成都,天阳宏业科技股份有限公司,10-15万/年,成都-高新区,民营公司,3-4年经验,6,招5人,五险一金 专业培训 定期体检,5000-10000人
87,移动开发,Android开发工程师,Android开发工程师,成都国卫信安信息技术有限公司,0.7-1万/月,成都-高新区,民营公司,3-4年经验,6,招1人,五险一金 员工旅游 专业培训 年终奖金 朝九晚五 周末双休,50-150人
88,移动开发,Android开发工程师,Android开发工程师,亿达信息技术有限公司成都分公司,0.8-1万/月,成都-高新区,民营公司,1年经验,5,招1人,,1000-5000人
89,移动开发,Android开发工程师,前端开发助理,成都亚复玉科技有限公司,6-8千/月,成都-锦江区,民营公司,无需经验,5,招若干人,五险一金 绩效奖金 餐饮补贴 年终奖金 员工旅游 出国机会 定期体检,500-1000人
90,移动开发,Android开发工程师,Android开发工程师,四川效率源信息安全技术股份有限公司,0.9-1.2万/月,成都-高新区,民营公司,2年经验,5,招若干人,五险一金 员工旅游 定期体检 年终奖金 全勤奖 带薪年假,150-500人
91,移动开发,Android开发工程师,安卓系统人机界面开发人员 HMI,上海扶丕悌软件有限公司,,异地招聘,外资（非欧美）,3-4年经验,6,招3人,五险一金 出国机会,10000人以上
92,移动开发,Android开发工程师,Android开发工程师,前海联合网络科技有限公司,1.3-2.6万/月,成都-武侯区,民营公司,5-7年经验,6,招若干人,,500-1000人
93,移动开发,Android开发工程师,Android开发工程师,博威铭物联网科技（成都）有限公司,6-8千/月,成都,民营公司,1年经验,5,招1人,做五休二 带薪年假 周末双休 绩效奖金 交通补贴 餐饮补贴 通讯补贴,50-150人
94,移动开发,Android开发工程师,Android高级开发工程师,北京硬盒科技有限公司,1.5-2万/月,成都-高新区,民营公司,3-4年经验,6,招若干人,五险一金 做五休二 周末双休 节日福利 专业培训 年终奖金 员工旅游,150-500人
95,移动开发,Android开发工程师,Android开发工程师,成都算力网络科技有限公司,0.6-1.2万/月,成都-金牛区,民营公司,2年经验,5,招2人,绩效奖金 周末双休 节日福利 年终奖金 全勤奖 餐饮补贴 五险,150-500人
96,移动开发,Android开发工程师,Android开发工程师,掌起未来智能科技有限公司,1-1.5万/月,成都-郫都区,民营公司,5-7年经验,5,招1人,,50-150人
97,移动开发,Android开发工程师,Android工程师,深圳市通卓网络科技有限公司,2.5-3万/月,成都-高新区,外资（欧美）,3-4年经验,5,招1人,,10000人以上
98,移动开发,Android开发工程师,安卓开发工程师13-20K,四川四原科技有限公司,1.3-2万/月,成都-高新区,民营公司,5-7年经验,6,招1人,五险一金 弹性工作 周末双休 绩效奖金,50-150人
99,移动开发,Android开发工程师,Android开发工程师,成都酷亿科技有限公司,1-1.5万/月,成都-高新区,民营公司,5-7年经验,5,招2人,周末双休 绩效奖金 五险一金 补充医疗保险 定期体检 年终奖金 员工旅游,少于50人
100,移动开发,Android开发工程师,Android开发,苏州市宝阙楼电子商务有限公司,1.5-2万/月,成都-武侯区,民营公司,2年经验,5,招6人,五险一金,50-150人
101,移动开发,Android开发工程师,android工程师（成都）,北京青云科技股份有限公司,,成都,民营公司,在校生/应届生,6,招若干人,,
102,移动开发,Android开发工程师,Android开发工程师（成都）,江苏满运软件科技有限公司,1-2.5万/月,成都,民营公司,在校生/应届生,6,招若干人,,
103,移动开发,Android开发工程师,安卓开发实习生(J10210),凹凸电子（成都）有限公司,150元/天,成都,外资（欧美）,在校生/应届生,7,招若干人,周末双休 五险一金 弹性工作 定期体检,500-1000人
104,移动开发,Android开发工程师,Android开发实习,成都市飞狼科技有限公司,150元/天,成都-高新区,合资,在校生/应届生,6,招3人,,少于50人
