,big_category,small_category,job_name,company_name,salary,work_area,company_type,work_year,education,recruitment_scale,welfare,company_size
112,数据,数据分析师,数据分析师-上海闵行-05746,博彦科技上海分公司,1-1.5万/月,上海,外资（欧美）,3-4年经验,6,招5人,,500-1000人
113,数据,数据分析师,数据建模与分析工程师,上海竞动科技有限公司,1.5-2万/月,上海-浦东新区,民营公司,3-4年经验,6,招若干人,五险一金 下午茶零食,50-150人
114,数据,数据分析师,薪酬数据分析员G00109,上海易路软件有限公司,0.8-1.5万/月,上海-闵行区,民营公司,无需经验,6,招1人,大牛带队 准独角兽企业 租房补贴 餐饮补贴 交通补贴 弹性工作 带薪年假 年终奖金 定期体检,150-500人
115,数据,数据分析师,数据分析师,北明软件有限公司,1.3-2万/月,上海-浦东新区,上市公司,3-4年经验,6,招若干人,五险一金 补充医疗保险 补充公积金 餐饮补贴 定期体检 年终奖金,1000-5000人
116,数据,数据分析师,数据运营专员,上海吾创信息科技有限公司,1-1.5万/月,上海-杨浦区,民营公司,3-4年经验,6,招2人,带薪年假 五险一金 节日福利 餐饮补贴,150-500人
117,数据,数据分析师,数据运营,厦门强云网络科技有限公司,1-1.5万/月,上海-静安区,民营公司,3-4年经验,6,招若干人,五险一金 弹性工作 定期体检 带薪年假 员工旅游 节日福利 零食下午茶 健身俱乐部,150-500人
118,数据,数据分析师,数据分析师,点点橙,1-1.5万/月,上海-虹口区,民营公司,1年经验,6,招5人,五险一金 员工旅游 绩效奖金 年终奖金 弹性工作 通讯补贴 专业培训,150-500人
119,数据,数据分析师,数据分析师,上海趣门佳信息科技有限公司,2.5-3万/月,上海-静安区,民营公司,3-4年经验,6,招3人,,500-1000人
120,数据,数据分析师,数据分析师,上海倍通医药科技咨询有限公司,1.5-2万/月,上海-黄浦区,民营公司,3-4年经验,6,招1人,五险一金 弹性工作 周末双休 专业培训 绩效奖金,1000-5000人
121,数据,数据分析师,数据分析顾问,上海比孚信息科技有限公司,1-2万/月,上海-黄浦区,民营公司,2年经验,6,招1人,五险一金 员工旅游 年终奖金 弹性工作 带薪年假 试用期全薪,150-500人
122,数据,数据分析师,数据分析工程师,盟拓软件（苏州）有限公司,1.5-2万/月,上海,合资,3-4年经验,6,招1人,,500-1000人
123,数据,数据分析师,数据分析师,上海联练体育科技有限公司,1-1.5万/月,上海-闵行区,民营公司,3-4年经验,5,招若干人,弹性工作 绩效奖金 节日福利 专业培训,
124,数据,数据分析师,数据分析BI,上海时溪信息技术有限公司,1.1-1.5万/月,上海-浦东新区,民营公司,3-4年经验,5,招1人,五险一金 绩效奖金 年终奖金 通讯补贴,50-150人
125,数据,数据分析师,初级数据分析,上海韦晴软件科技有限公司,0.8-1.2万/月,上海-浦东新区,民营公司,1年经验,6,招若干人,年终奖金 绩效奖金 五险一金 员工旅游 专业培训,50-150人
126,数据,数据分析师,数据分析员,上海卫道信息技术有限公司,0.6-1万/月,上海-徐汇区,民营公司,1年经验,5,招1人,五险一金 员工旅游 通讯补贴 专业培训 绩效奖金 定期体检 节假日福利 带薪年休假 岗位晋升,150-500人
127,数据,数据分析师,数据分析师,上海润和信息技术服务有限公司,1-1.5万/月,上海-浦东新区,上市公司,1年经验,6,招2人,补充医疗保险 五险一金 免费班车 定期体检 年终奖金,1000-5000人
128,数据,数据分析师,数据分析师,上海通办信息服务有限公司,0.8-1万/月,上海-静安区,民营公司,2年经验,5,招2人,五险一金 绩效奖金 年终奖金 定期体检 弹性工作 专业培训 定期团建,150-500人
129,数据,数据分析师,数据分析助理（可实习）,上海新朋程数据科技发展有限公司,0.8-1.5万/月,上海-杨浦区,合资,1年经验,6,招1人,五险一金 员工旅游 定期体检 带薪年假 绩效奖金 年终奖金,150-500人
130,数据,数据分析师,商业数据分析师,上海画龙信息科技有限公司,1.5-2万/月,上海-徐汇区,民营公司,2年经验,7,招若干人,五险一金 餐饮补贴 弹性工作 专业培训 年终奖金 股票期权 员工旅游,50-150人
131,数据,数据分析师,ETL开发工程师,上海中畅信息科技有限公司,1-1.5万/月,上海-浦东新区,民营公司,3-4年经验,5,招1人,五险一金 补充医疗保险 员工旅游 定期体检 年终奖金 免费班车,50-150人
132,数据,数据分析师,数据分析师,上海直真君智科技有限公司,0.8-1.5万/月,异地招聘,民营公司,1年经验,6,招3人,周末双休 带薪年假 五险一金 节日福利 餐饮补贴 专业培训 通讯补贴 员工旅游 免费体检 定期体检,50-150人
133,数据,数据分析师,FineReport,上海数聚软件系统股份有限公司,10-18万/月,上海-徐汇区,民营公司,3-4年经验,6,招1人,五险一金 年终奖金 定期体检 带薪年假,150-500人
134,数据,数据分析师,LIMS Data Support,上海利唐信息科技有限公司,0.8-1万/月,上海-徐汇区,民营公司,1年经验,5,招若干人,,150-500人
135,数据,数据分析师,数据需求分析师,云从科技,1.7-2.3万/月,上海,民营公司,3-4年经验,6,招1人,五险一金 专业培训 弹性工作 定期体检 餐饮补贴 年终奖金 绩效奖金 餐补 带薪年假 节日福利,1000-5000人
136,数据,数据分析师,高级数据分析师,上海麦晗科技有限公司,2-3.5万/月,上海-浦东新区,民营公司,3-4年经验,6,招1人,五险一金 股票期权 年终奖金,50-150人
137,数据,数据分析师,数据挖掘分析工程师,苏州斐波那契信息技术有限公司,1.5-3万/月,异地招聘,民营公司,1年经验,6,招1人,,少于50人
138,数据,数据分析师,数据分析 (MJ001001),京北方信息技术股份有限公司,1.3-1.8万/月,上海-闵行区,民营公司,1年经验,6,招2人,,10000人以上
139,数据,数据分析师,数据处理,上海飞观信息科技有限公司,0.6-1.2万/月,上海-静安区,民营公司,3-4年经验,6,招3人,周末双休 弹性工作 带薪年假 五险一金 交通补贴 通讯补贴 节日福利 餐饮补贴 生日假 员工体检,150-500人
140,数据,数据分析师,数据分析工程师,上海顺如丰来技术有限公司,1.5-2.5万/月,上海-青浦区,民营公司,5-7年经验,6,招1人,发展快 空间大 前景好,
141,数据,数据分析师,数据工程师,万达信息股份有限公司,1.5-2.5万/月,上海,上市公司,2年经验,6,招若干人,五险一金 补充公积金 绩效奖金 年终奖金,1000-5000人
142,数据,数据分析师,数据分析师（交付）,上海欣兆阳信息科技有限公司,1-2万/月,上海-徐汇区,民营公司,2年经验,6,招2人,五险一金 员工旅游 股票期权 绩效奖金 年终奖金 专业培训 定期体检 弹性工作,50-150人
143,数据,数据分析师,Tableau开发,上海中科软科技有限公司,1-1.5万/月,上海-浦东新区,上市公司,3-4年经验,6,招5人,五险一金 员工旅游 餐饮补贴 年终奖金 定期体检,10000人以上
144,数据,数据分析师,数据分析,上海玺智汽车租赁有限公司,0.8-1万/月,上海-松江区,合资,1年经验,6,招2人,做五休二 五险一金 绩效奖金 餐饮补贴,150-500人
145,数据,数据分析师,Oracle数据库开发工程师(J11394),上海汉得信息技术股份有限公司,1-1.5万/月,上海,上市公司,2年经验,5,招4人,五险一金 补充医疗保险 补充公积金 定期体检 年终奖金 股票期权,10000人以上
146,数据,数据分析师,数据分析师,上海华钦信息科技股份有限公司,1.5-2.5万/月,上海-杨浦区,上市公司,3-4年经验,6,招5人,五险一金 节日福利 弹性工作 带薪年假 补充医疗保险,1000-5000人
147,数据,数据分析师,数据标注工程师,深圳市德科信息技术有限公司,0.8-1万/月,上海-徐汇区,民营公司,2年经验,5,招10人,五险一金 员工旅游 专业培训 弹性工作 年终奖金 绩效奖金,1000-5000人
148,数据,数据分析师,数据分析师,上海时勤信息科技有限公司,0.9-1.1万/月,上海-普陀区,民营公司,2年经验,6,招2人,,少于50人
149,数据,数据分析师,高级数据分析师,上海数澜实业有限公司,2-2.5万/月,上海-闵行区,民营公司,5-7年经验,6,招1人,周末双休 五险一金 弹性工作 股票期权 大牛云集 节日福利 带薪年假,少于50人
150,数据,数据分析师,资深数据分析,上海全晓信息技术有限公司,1.5-2.5万/月,上海,民营公司,3-4年经验,6,招5人,,150-500人
151,数据,数据分析师,数据仓库工程师,福建新意科技有限公司,1.5-2万/月,上海-浦东新区,民营公司,3-4年经验,6,招1人,五险一金 股票期权 周末双休 专业培训 定期体检,150-500人
152,数据,数据分析师,数据分析工程师（风控建模方向）,上海亿通国际股份有限公司,1.3-1.8万/月,上海,国企,1年经验,6,招1人,五险一金 补充医疗保险 交通补贴 餐饮补贴 通讯补贴 专业培训 年终奖金 绩效奖金 定期体检,150-500人
153,数据,数据分析师,数据分析师,上海蜜度信息技术有限公司,0.8-1.2万/月,上海-浦东新区,民营公司,2年经验,6,招1人,五险一金 补充医疗保险 通讯补贴 年终奖金 绩效奖金 周末双休 带薪年假 交通补贴,500-1000人
154,数据,数据分析师,数据分析师,上海数道信息科技有限公司,0.9-1.5万/月,上海-浦东新区,民营公司,3-4年经验,6,招若干人,五险一金 免费班车 年终奖金 定期体检 绩效奖金,少于50人
155,数据,数据分析师,数据分析专员（外包）-易视腾,大连东软思维科技发展有限公司,1-1.5万/月,上海-杨浦区,民营公司,3-4年经验,5,招2人,五险一金 补充医疗保险 补充公积金 弹性工作 年终奖金 绩效奖金 定期体检 专业培训,1000-5000人
156,数据,数据分析师,数据分析课程助教（教育行业）,上海博为峰信息技术有限公司,1-1.5万/月,上海-黄浦区,民营公司,1年经验,6,招1人,五险一金 员工旅游 交通补贴 餐饮补贴 通讯补贴 绩效奖金 年终奖金 定期体检,150-500人
157,数据,数据分析师,环保数据算法工程师,上海刀奇智能科技有限公司,1.6-2.2万/月,上海-松江区,民营公司,3-4年经验,7,招1人,弹性工作 五险一金 补充医疗保险 专业培训 通讯补贴 年终奖金 绩效奖金 员工旅游,少于50人
158,数据,数据分析师,数据统计,上海实壹信息科技有限公司,6-8千/月,上海-浦东新区,合资,2年经验,5,招1人,,150-500人
159,数据,数据分析师,BI需求顾问,数云信息技术（上海）有限公司,1.5-2万/月,上海,民营公司,3-4年经验,6,招1人,五险一金 补充医疗保险 定期体检 员工旅游,500-1000人
160,数据,数据分析师,Digital Analytics Consultant,五什五（上海）数据信息技术有限公司深圳分公司,1.8-2.3万/月,上海-静安区,民营公司,2年经验,6,招1人,,
161,数据,数据分析师,行政文员,上海帮聘网络科技有限公司,4.5-6千/月,上海-嘉定区,民营公司,2年经验,5,招1人,五险一金 餐饮补贴 交通补贴 做五休二 节日福利 加班补贴 带薪年假,150-500人
162,数据,数据分析师,技术顾问（财务建模）-上海,深圳市爱德数智科技股份有限公司,0.7-1万/月,上海-长宁区,民营公司,1年经验,6,招2人,五险一金 弹性工作 专业技术团队 补充医疗保险 绩效奖金 定期体检 员工旅游 项目奖金,500-1000人
163,数据,数据分析师,NLP 算法工程师,上海爱可生信息技术股份有限公司,3-4万/月,上海,民营公司,3-4年经验,6,招2人,五险一金 餐饮补贴 员工旅游,150-500人
164,数据,数据分析师,工业互联网实施顾问,上海涛创自动化科技有限公司,6-8千/月,上海-闵行区,民营公司,1年经验,,招2人,,少于50人
165,数据,数据分析师,数据分析服务专员,上海天臣计算机软件有限公司,5.5-8千/月,上海-静安区,民营公司,1年经验,6,招1人,五险一金 餐饮补贴 通讯补贴 定期体检 做五休二 带薪年假,50-150人
166,数据,数据分析师,大数据方向程序员,上海伟梦物联网科技有限公司,1-1.5万/月,上海-杨浦区,民营公司,2年经验,5,招若干人,五险一金 餐饮补贴,少于50人
167,数据,数据分析师,数据统计专员,上海万位数字技术有限公司,5.5-7千/月,上海-宝山区,民营公司,2年经验,5,招1人,,150-500人
168,数据,数据分析师,市场分析师,江苏科瑞恩自动化科技有限公司,1.5-2万/月,异地招聘,民营公司,3-4年经验,6,招3人,五险一金 员工旅游 年终奖金 绩效奖金 定期体检,1000-5000人
169,数据,数据分析师,大气/气象数值模型工程师,上海地听信息科技有限公司,1-1.5万/月,上海-普陀区,民营公司,1年经验,6,招1人,五险一金 绩效奖金 员工旅游 年终奖金 做五休二 节日福利 交通补贴 餐饮补贴 通讯补贴 定期体检,50-150人
170,数据,数据分析师,教学课件整理实习生,格蠹信息科技（上海）有限公司,120元/天,上海-闵行区,民营公司,无需经验,5,招3人,年终奖金,少于50人
171,数据,数据分析师,行业分析师/项目经理：医药、化工及相关行业,上海弈格思商务信息咨询有限公司,10-15万/年,上海-杨浦区,民营公司,2年经验,7,招若干人,五险一金 专业培训,少于50人
172,数据,数据分析师,安全数据分析工程师,牙木科技股份有限公司,1.5-3.5万/月,上海,民营公司,3-4年经验,6,招2人,五险一金 补充医疗保险 员工旅游 通讯补贴 年终奖金 弹性工作 定期体检,150-500人
173,数据,数据分析师,舆情分析师,天颂（上海）信息科技有限公司,6-8千/月,上海-黄浦区,民营公司,1年经验,6,招1人,五险一金 绩效奖金 专业培训,少于50人
174,数据,数据分析师,数据库工程师,福州明源动力软件有限公司,1-1.5万/月,上海-闵行区,民营公司,2年经验,6,招2人,五险一金 通讯补贴 员工旅游 补充公积金 绩效奖金 年终奖金 定期体检 补充医疗保险 下午茶,500-1000人
175,数据,数据分析师,数据测试,浙江优创信息技术有限公司,1-1.5万/月,上海-浦东新区,民营公司,5-7年经验,6,招1人,五险一金 专业培训 年终奖金 员工宿舍 餐饮补贴,500-1000人
176,数据,数据分析师,前端开发工程师,上海熠朗信息科技有限公司,1.2-1.6万/月,上海-闵行区,民营公司,2年经验,6,招2人,五险一金 员工旅游 专业培训 绩效奖金 弹性工作 年终奖金,少于50人
177,数据,数据分析师,AI训练师,上海才历网络有限公司,10-15万/年,上海-徐汇区,合资,1年经验,6,招5人,,50-150人
178,数据,数据分析师,后台运维专员,上海翼萨实业有限公司,6-8千/月,上海-浦东新区,民营公司,2年经验,5,招若干人,周末双休 弹性工作 五险一金 绩效奖金 全勤奖 餐饮补贴 带薪年假 业绩提成,50-150人
179,数据,数据分析师,AI应用工程师（Python）,上海乐言科技股份有限公司,1-1.5万/月,上海-长宁区,民营公司,无需经验,6,招若干人,公司氛围好 免费零食 五险一金 补充医疗保险 弹性工作,1000-5000人
180,数据,数据分析师,数据产品实习,银联智惠信息服务（上海）有限公司,140元/天,上海-浦东新区,合资,在校生/应届生,6,招2人,五险一金 补充公积金 交通补贴 餐饮补贴 通讯补贴 绩效奖金 定期体检 员工旅游 专业培训 年终奖金,50-150人
181,数据,数据分析师,薪酬数据分析专员,尚励信息技术（上海）有限公司,6-8千/月,上海-浦东新区,外资（欧美）,在校生/应届生,6,招5人,五险一金 专业培训 出国机会 年终奖金 弹性工作 定期体检,50-150人
182,数据,数据分析师,大数据,上海宝信软件股份有限公司,1-1.5万/月,上海,国企,在校生/应届生,6,招7人,,
183,数据,数据分析师,数据分析助理,MSI微星科技,6-8千/月,上海-普陀区,外资（非欧美）,在校生/应届生,5,招1人,五险一金 餐饮补贴 定期体检 年终奖金 带薪年假 节日福利 生日福利 弹性工作,150-500人
184,数据,数据分析师,数据分析实习生,上海意臣信息科技有限公司,4.5-6千/月,上海-徐汇区,民营公司,在校生/应届生,6,招2人,五险一金 年终奖金 员工旅游 绩效奖金 餐饮补贴 出国机会 周末双休 定期团建 项目奖金,50-150人
185,数据,数据分析师,数据分析助理,小佩网络科技（上海）有限公司,0.8-1万/月,上海-浦东新区,外资（非欧美）,在校生/应届生,5,招1人,五险一金 餐饮补贴 弹性工作 定期体检 员工旅游 交通补贴 上班带宠 零食,150-500人
186,数据,数据分析师,德资车企 数据分析实习生（会python）,薪得付信息技术（上海）有限公司,0.5-1万/月,上海-嘉定区,外资（欧美）,在校生/应届生,6,招若干人,周末双休 五险一金 带薪年假 绩效奖金 补充医疗保险 定期体检,1000-5000人
187,数据,数据分析师,Graduate Business Intelligence/Data Analyst,菲缔信息科技（上海）有限公司,1-1.5万/月,上海-静安区,外资（欧美）,在校生/应届生,6,招若干人,五险一金 员工旅游 专业培训 出国机会 绩效奖金 顶尖外资环境,1000-5000人
188,数据,数据分析师,数据分析实习生,伺动营销科技(上海)有限公司,6-8千/月,上海-静安区,外资（非欧美）,在校生/应届生,6,招1人,,50-150人
189,数据,数据分析师,市场部实习生,无锡启益医疗科技有限公司,100元/天,上海-徐汇区,民营公司,在校生/应届生,6,招5人,五险一金 通讯补贴 专业培训 绩效奖金 年终奖金 股票期权 弹性工作,少于50人
190,数据,数据分析师,初级数据分析师（舆情）,上海鹏越惊虹信息技术发展有限公司,4.5-6千/月,上海-徐汇区,民营公司,在校生/应届生,6,招1人,五险一金 通讯补贴 绩效奖金 年终奖金,50-150人
191,数据,数据分析师,数据分析师（实习）,上海吉贝克信息技术有限公司,200元/天,上海,民营公司,在校生/应届生,6,招5人,通讯补贴 办公补贴,500-1000人
192,数据,数据分析师,数据统计分析,上海中安电子信息科技有限公司,3-4.5千/月,上海-徐汇区,民营公司,在校生/应届生,6,招若干人,五险一金 员工旅游 餐饮补贴 弹性工作 年终奖金,50-150人
193,数据,数据分析师,数据处理工程师,上海嘉勉信息技术有限公司,4-8千/月,上海-虹口区,民营公司,在校生/应届生,5,招2人,五险一金 员工旅游 餐饮补贴 年终奖金 定期体检,50-150人
194,数据,数据分析师,数据处理工程师,派鼎（上海）商务咨询有限公司,6-8千/月,上海-徐汇区,民营公司,在校生/应届生,6,招2人,,少于50人
195,数据,数据分析师,数据分析/media analyst,杭州锐致商务咨询有限公司,0.8-1万/月,上海-黄浦区,民营公司,在校生/应届生,6,招4人,五险一金 商业保险 做五休二 年终奖金,1000-5000人
196,数据,数据分析师,Python数据分析实习生,嬴彻科技（上海）有限公司,150元/天,上海-杨浦区,民营公司,在校生/应届生,6,招若干人,五险一金 餐饮补贴 发展空间大,150-500人
197,数据,数据分析师,数据挖掘工程师,上海创和亿电子科技发展有限公司,0.8-1万/月,上海,合资,在校生/应届生,6,招3人,五险一金 员工旅游 餐饮补贴 弹性工作,50-150人
198,数据,数据分析师,数据分析师,兴业数字金融服务（上海）股份有限公司,2-2.5万/月,上海-浦东新区,合资,在校生/应届生,6,招若干人,,500-1000人
199,数据,数据分析师,数据分析师（校招）,优刻得科技股份有限公司,1-1.5万/月,上海,民营公司,在校生/应届生,6,招若干人,五险一金 补充医疗保险 员工旅游 专业培训 绩效奖金 年终奖金 弹性工作 定期体检,1000-5000人
200,数据,数据分析师,商业分析（上海）,江苏满运软件科技有限公司,1-2.5万/月,上海,民营公司,在校生/应届生,6,招若干人,,
201,数据,数据分析师,数据交付工程师 (MJ000341),上海图趣信息科技有限公司（Wayz.ai）,1.8-3万/月,上海-浦东新区,民营公司,在校生/应届生,6,招1人,,150-500人
202,数据,数据分析师,安全威胁分析师 （实习）,上海犇众信息技术有限公司,200元/天,上海-闵行区,民营公司,在校生/应届生,5,招若干人,,50-150人
203,数据,数据分析师,数据分析师（三方职位）,上海亿贝网络信息服务有限公司,1.5-2千/月,上海-黄浦区,外资（欧美）,2年经验,6,招5人,,500-1000人
204,数据,数据分析师,數據標註師 -人工智能/機器學習 (廣東話),苹果贸易(上海)有限公司,,上海,外资（欧美）,无需经验,6,招若干人,,500-1000人
205,数据,数据分析师,数据标注师 - 人工智能/机器学习 (普通话),苹果贸易(上海)有限公司,,上海,外资（欧美）,无需经验,6,招若干人,,500-1000人
206,数据,数据分析师,数据分析师（市场销售）Data Analyst,上海育碧电脑软件有限公司,20-35万/年,上海,外资（欧美）,3-4年经验,,招1人,五险一金 餐饮补贴 弹性工作 补充医疗保险 专业培训,500-1000人
207,数据,数据分析师,数据分析师 Data Analyst (Uplay),上海育碧电脑软件有限公司,20-35万/年,上海,外资（欧美）,3-4年经验,,招1人,五险一金 餐饮补贴 弹性工作 补充医疗保险 专业培训,500-1000人
208,数据,数据分析师,数据分析师 Data Analyst (Mobile),上海育碧电脑软件有限公司,20-35万/年,上海,外资（欧美）,3-4年经验,6,招若干人,五险一金 餐饮补贴 弹性工作 补充医疗保险 专业培训,500-1000人
209,数据,数据分析师,数据分析师,印孚瑟斯技术（中国）有限公司,1.2-2.2万/月,上海-闵行区,外资（非欧美）,3-4年经验,6,招若干人,五险一金 补充医疗保险 免费班车 餐饮补贴 年终奖金 弹性工作 专业培训 出国机会 定期体检,1000-5000人
210,数据,数据分析师,SQL数据分析工程师,上海微创软件股份有限公司,1.1-1.4万/月,上海,合资,3-4年经验,6,招1人,五险一金 补充医疗保险 免费班车 弹性工作 定期体检 绩效奖金 年终奖金 专业培训 员工旅游 节日福利,5000-10000人
211,数据,数据分析师,资深数据分析专员,上海微创软件股份有限公司,2.5-3万/月,上海,合资,5-7年经验,6,招1人,五险一金 补充医疗保险 免费班车 弹性工作 定期体检 绩效奖金 年终奖金 专业培训 员工旅游 节日福利,5000-10000人
212,数据,数据分析师,数据分析专员,上海微创软件股份有限公司,1-1.2万/月,上海,合资,1年经验,6,招1人,五险一金 补充医疗保险 免费班车 弹性工作 定期体检 绩效奖金 年终奖金 专业培训 员工旅游 节日福利,5000-10000人
213,数据,数据分析师,数据分析师,上海皇家网络科技有限公司,6-8千/月,上海-静安区,民营公司,1年经验,5,招2人,五险一金 绩效奖金 项目奖金 交通补贴,50-150人
214,数据,数据分析师,数据分析师 (W00941),上海微盟企业发展有限公司,1-2万/月,上海-宝山区,上市公司,5-7年经验,6,招2人,,5000-10000人
215,数据,数据分析师,数据分析,上海点欣科技有限公司,0.9-1.3万/月,上海-徐汇区,民营公司,2年经验,6,招4人,,50-150人
216,数据,数据分析师,资深数据分析师(J12444),上海二三四五网络科技有限公司,1.5-2.5万/月,上海-浦东新区,上市公司,3-4年经验,6,招1人,五险一金 补充医疗保险 年终奖金 定期体检 免息房贷 免息车贷 免费早餐 上市公司,500-1000人
217,数据,数据分析师,数据分析（世界***大 B2B2C 为企业）,薪得付信息技术(上海)有限公司,1-2万/月,上海-徐汇区,外资（欧美）,2年经验,6,招1人,五险一金 弹性工作 补充医疗保险 定期体检 一线平台 领导Nice,500-1000人
218,数据,数据分析师,数据分析师,薪得付信息技术(上海)有限公司,0.6-1万/月,上海-浦东新区,外资（欧美）,1年经验,6,招2人,专业培训 五险一金 定期体检 补充医疗保险 企业文化佳 领导NICE 一线平台 餐饮补贴,500-1000人
219,数据,数据分析师,项目支持专员（偏数据）,薪得付信息技术(上海)有限公司,6-8千/月,上海-浦东新区,外资（欧美）,1年经验,6,招2人,五险一金 专业培训 节日福利 绩效奖金 补充医疗保险 年终奖金 弹性工作 定期体检,500-1000人
220,数据,数据分析师,数据分析师,珍岛信息技术（上海）股份有限公司,2-2.5万/月,上海,民营公司,3-4年经验,6,招2人,专业培训 节日福利 五险一金 国内国外旅游 生日会 带薪年假 绩效奖金 通讯补贴,1000-5000人
221,数据,数据分析师,产品数据分析专员,珍岛信息技术（上海）股份有限公司,1-1.3万/月,上海,民营公司,3-4年经验,6,招1人,五险一金 做五休二 绩效奖金 年终奖金,1000-5000人
222,数据,数据分析师,数据标记员朝九晚六/五休二,旭禾泽畔集团,4-4.5千/月,上海-长宁区,民营公司,无需经验,2,招2人,五险一金 五休二,50-150人
223,数据,数据分析师,数据分析师,上海机颖智能科技有限公司,2-2.5万/月,上海-杨浦区,外资（欧美）,3-4年经验,6,招1人,五险一金 补充医疗保险 交通补贴 餐饮补贴 弹性工作 定期体检,50-150人
