,big_category,small_category,job_name,company_name,salary,work_area,company_type,work_year,education,recruitment_scale,welfare,company_size
446,数据,BI工程师,BI分析师（Power Bi方向）,上海西信信息科技股份有限公司,1.5-2.5万/月,上海,上市公司,3-4年经验,6,招1人,,150-500人
447,数据,BI工程师,数据,深圳市睿服科技有限公司,1.5千以下/月,上海-浦东新区,民营公司,2年经验,5,招若干人,,500-1000人
448,数据,BI工程师,高精地图引擎研发工程师,潍坊赢启信息科技有限公司,4-5万/月,上海-黄浦区,民营公司,3-4年经验,7,招2人,,150-500人
449,数据,BI工程师,高级BI工程师,MBP软件集团（MBP Software Group）,1.5-2.5万/月,上海-浦东新区,外资（非欧美）,5-7年经验,6,招2人,五险一金 绩效奖金 年终奖金 定期体检,150-500人
450,数据,BI工程师,BI工程师,上海意臣信息科技有限公司,0.7-1.6万/月,上海-徐汇区,民营公司,1年经验,5,招若干人,五险一金 年终奖金 员工旅游 绩效奖金 餐饮补贴 周末双休 带薪年假 专业培训 出国机会 定期团建,50-150人
451,数据,BI工程师,急招帆软报表开发,中网云智（深圳）科技有限公司,1.2-2万/月,上海-黄浦区,民营公司,2年经验,5,招2人,,50-150人
452,数据,BI工程师,BI工程师-SSAS,加绩（上海）科技服务有限公司,3-4万/月,上海-徐汇区,上市公司,8-9年经验,5,招1人,,150-500人
453,数据,BI工程师,BI运维,上海华钛信息科技有限公司,1.5-2.5万/月,异地招聘,民营公司,2年经验,5,招若干人,,50-150人
454,数据,BI工程师,帆表报表开发工程师,上海三高计算机中心股份有限公司,1-2万/月,上海-杨浦区,上市公司,1年经验,6,招若干人,五险一金 餐饮补贴 年终奖金 定期体检,150-500人
455,数据,BI工程师,BI工程师,上海安硕信息技术股份有限公司,0.8-1.5万/月,上海,上市公司,2年经验,6,招5人,,1000-5000人
456,数据,BI工程师,BI工程师,上海祁铭信息技术有限公司,1-1.5万/月,上海-浦东新区,民营公司,3-4年经验,6,招若干人,五险一金 年终奖金 弹性工作 交通补贴 餐饮补贴,少于50人
457,数据,BI工程师,BI工程师,上海柯林布瑞信息技术有限公司,1-2万/月,上海-徐汇区,民营公司,3-4年经验,5,招2人,五险一金 餐饮补贴 弹性工作 定期体检 专业培训 员工旅游 年终奖金 绩效奖金 交通补贴,150-500人
458,数据,BI工程师,报表开发工程师,广东天正计算机服务有限公司,1.2-2万/月,上海,民营公司,5-7年经验,5,招若干人,五险一金 补充医疗保险 补充公积金 员工旅游 年终奖金 专业培训 弹性工作 定期体检,50-150人
459,数据,BI工程师,BI工程师,上海启高信息科技有限公司,0.6-1.2万/月,上海,民营公司,2年经验,6,招3人,绩效奖金 年终奖金 交通补贴 餐饮补贴 五险一金,50-150人
460,数据,BI工程师,power bi（英语读写）,成都迈思信息技术有限公司,1.5-2万/月,上海-静安区,民营公司,3-4年经验,5,招若干人,五险一金 绩效奖金 年终奖金,150-500人
461,数据,BI工程师,BI工程师,上海柏维信息技术有限公司,1.5-2万/月,上海,合资,3-4年经验,6,招1人,五险一金 定期体检 带薪年假 节日福利 人才推荐奖 司龄礼物 生日礼物 季度团建,50-150人
462,数据,BI工程师,BI工程师,北京伯凯科技有限公司,1.5-3万/月,上海-浦东新区,外资（欧美）,2年经验,6,招2人,五险一金 补充医疗保险 专业培训 定期体检 弹性工作 通讯补贴 节日福利 年底双薪,10000人以上
463,数据,BI工程师,报表开发工程师(J10478),上海耸智信息科技有限公司,1-1.5万/月,上海-浦东新区,民营公司,2年经验,5,招1人,五险一金 年终奖金 弹性工作 股票期权 餐饮补贴 员工旅游,150-500人
464,数据,BI工程师,数据开发工程师,深圳市赢和信息技术有限公司,1-1.5万/月,上海-虹口区,民营公司,3-4年经验,6,招若干人,,50-150人
465,数据,BI工程师,BI工程师,上海胜蓝软件技术服务有限公司,1-1.5万/月,上海-虹口区,民营公司,2年经验,6,招若干人,五险一金 员工旅游 定期体检 年终奖金 绩效奖金,50-150人
466,数据,BI工程师,BI分析师,上海襄岳信息技术有限公司,1.2-2.4万/月,上海-闵行区,民营公司,3-4年经验,6,招5人,员工旅游 年终奖金 绩效奖金 节假日福利 五险一金,150-500人
467,数据,BI工程师,BI工程师,上海聚水潭网络科技有限公司,20-30万/年,上海-闵行区,民营公司,3-4年经验,6,招1人,,1000-5000人
468,数据,BI工程师,数据库开发工程师BI/DSA,安客诚信息服务（上海）有限公司,10-15万/年,上海-徐汇区,外资（欧美）,3-4年经验,6,招2人,周末双休 带薪年假 五险一金 绩效奖金 餐饮补贴,150-500人
469,数据,BI工程师,数据库/数据仓库/BI开发工程师,迪爱斯信息技术股份有限公司,1-2万/月,上海-徐汇区,国企,2年经验,6,招若干人,,500-1000人
470,数据,BI工程师,BI技术工程师,上海蓝灯数据科技股份有限公司,1.2-2万/月,上海,民营公司,1年经验,6,招1人,五险一金 补充医疗保险 餐饮补贴 通讯补贴 专业培训 绩效奖金 年终奖金 定期体检,50-150人
471,数据,BI工程师,BI工程师,上海时代天使医疗器械有限公司,1-2万/月,上海-杨浦区,合资,1年经验,6,招1人,五险一金 补充医疗保险 员工旅游 餐饮补贴 专业培训 绩效奖金 年终奖金 定期体检 带薪年假,1000-5000人
472,数据,BI工程师,数据开发工程师,中远海运科技股份有限公司,20-30万/年,上海-浦东新区,国企,5-7年经验,6,招1人,做五休二 五险一金 绩效奖金 交通补贴 通讯补贴 餐饮补贴 补充公积金 补充医疗保险 年终奖金 定期体检,1000-5000人
473,数据,BI工程师,PowerBI工程师,上海迈志信息科技有限公司,1.5-2万/月,上海-黄浦区,民营公司,2年经验,5,招2人,五险一金 员工旅游 绩效奖金 年终奖金 定期体检,50-150人
474,数据,BI工程师,报表开发工程师,上海海魄信息科技股份有限公司,1-2.5万/月,上海-长宁区,民营公司,1年经验,5,招1人,五险一金 弹性工作 绩效奖金 专业培训,50-150人
475,数据,BI工程师,BI实施顾问,上海智酷商务咨询有限公司,6-8千/月,上海-徐汇区,民营公司,2年经验,6,招若干人,,少于50人
476,数据,BI工程师,数据库工程师/ 数据开发工程师,上海浩霖汇信息科技有限公司,1.5-2.5万/月,上海-静安区,民营公司,5-7年经验,6,招1人,五险一金 餐饮补贴 绩效奖金 弹性工作 带薪年假 调薪机会 全额公积金 年度调薪,少于50人
477,数据,BI工程师,BI工程师,北明软件有限公司,1-2万/月,上海,上市公司,3-4年经验,5,招若干人,五险一金 补充医疗保险 补充公积金 餐饮补贴 定期体检 年终奖金,1000-5000人
478,数据,BI工程师,Power BI工程师,菲斯科（上海）软件有限公司,1-2万/月,上海-长宁区,民营公司,3-4年经验,5,招若干人,弹性工作 周末双休 五险一金 带薪年假 专业培训 高温补贴 绩效奖金 员工旅游 出国机会,50-150人
479,数据,BI工程师,Power BI工程师,上海倍通医药科技咨询有限公司,1-2万/月,上海-黄浦区,民营公司,3-4年经验,5,招1人,五险一金 弹性工作 周末双休 专业培训 绩效奖金,1000-5000人
480,数据,BI工程师,帆软报表finereport,上海绯逸信息技术有限公司,1.2-1.6万/月,上海-黄浦区,民营公司,2年经验,,招1人,,50-150人
481,数据,BI工程师,ETL开发工程师,上海幕库科技发展有限公司,1-1.5万/月,上海-浦东新区,民营公司,2年经验,6,招若干人,,少于50人
482,数据,BI工程师,BI运维工程师,盟拓软件（苏州）有限公司,1.3-1.8万/月,上海,合资,5-7年经验,6,招1人,,500-1000人
483,数据,BI工程师,数据分析BI,上海时溪信息技术有限公司,1.2-1.7万/月,上海-浦东新区,民营公司,3-4年经验,5,招1人,五险一金 绩效奖金 年终奖金 通讯补贴,50-150人
484,数据,BI工程师,BI工程师,上海坤亿信息技术有限公司,1.2-2万/月,上海-虹口区,民营公司,2年经验,6,招2人,五险一金 绩效奖金 年终奖金 专业培训,150-500人
485,数据,BI工程师,Oracle BI 工程师,百堇信息技术（上海）有限公司,1.2-1.8万/月,上海-长宁区,合资,8-9年经验,5,招2人,专业培训,50-150人
486,数据,BI工程师,BI开发工程师,广州安正软件有限公司,1.5-2万/月,上海-浦东新区,民营公司,3-4年经验,6,招1人,五险一金 专业培训 定期体检 补充公积金 弹性工作,150-500人
487,数据,BI工程师,数据工程师,上海挖数互联网科技有限公司,0.8-1.5万/月,上海-浦东新区,民营公司,1年经验,6,招若干人,,50-150人
488,数据,BI工程师,数据开发工程师,深圳市誉托科技有限公司,1-1.5万/月,上海-浦东新区,民营公司,3-4年经验,5,招若干人,五险一金 弹性工作,50-150人
489,数据,BI工程师,BI工程师,大连东软思维科技发展有限公司,1.5-2万/月,上海-长宁区,民营公司,3-4年经验,5,招1人,五险一金 补充医疗保险 补充公积金 弹性工作 年终奖金 绩效奖金 定期体检 专业培训,1000-5000人
490,数据,BI工程师,BI工程师,德昂信息技术（北京）有限公司,0.6-1万/月,上海-静安区,创业公司,1年经验,6,招1人,,50-150人
491,数据,BI工程师,数据开发工程师,北京和桥互联信息技术有限公司,1-1.5万/月,上海-浦东新区,外资（欧美）,3-4年经验,6,招若干人,五险一金 补充医疗保险 免费班车 年终奖金 弹性工作 定期体检 绩效奖金 专业培训,500-1000人
492,数据,BI工程师,报表开发工程师,上海致宇信息技术有限公司,10-15万/年,异地招聘,民营公司,2年经验,6,招3人,五险一金 绩效奖金 年终奖金 弹性工作 定期体检 员工旅游,150-500人
493,数据,BI工程师,Tableau开发,上海中科软科技有限公司,1-1.5万/月,上海-浦东新区,上市公司,3-4年经验,6,招5人,五险一金 员工旅游 餐饮补贴 年终奖金 定期体检,10000人以上
494,数据,BI工程师,资深BI分析师,上海舜中信息技术有限公司,3-4万/月,上海-长宁区,民营公司,8-9年经验,6,招3人,,50-150人
495,数据,BI工程师,Business Relationship Manager(BI Leader)-00740,萨孚凯信息系统技术（北京）有限公司上海分公司,3-3.5万/月,上海,外资（欧美）,10年以上经验,6,招1人,做五休二 周末双休 带薪年假 五险一金 节日福利 专业培训 补充医疗保险,1000-5000人
496,数据,BI工程师,Informatica ETL 大数据工程师,上海必盈特软件系统有限公司,1.5-2万/月,上海,合资,3-4年经验,6,招1人,定期体检 年终奖金 五险一金 绩效奖金 员工公寓 专业培训,50-150人
497,数据,BI工程师,数据开发工程师,上海华钦信息科技股份有限公司,1.5-2.5万/月,上海-杨浦区,上市公司,3-4年经验,6,招5人,节日福利 周末双休 弹性工作 补充医疗保险 五险一金 年终奖金,1000-5000人
498,数据,BI工程师,数据库开发工程师,上海金仕达成括信息科技有限公司,1-1.5万/月,上海-浦东新区,民营公司,1年经验,6,招若干人,员工旅游 定期体检 专业培训 补充医疗保险 餐饮补贴 年终奖金,1000-5000人
499,数据,BI工程师,数据开发工程师,郑州一迅软件科技有限公司,1.5-2万/月,上海,民营公司,1年经验,5,招4人,五险一金 年终奖金,50-150人
500,数据,BI工程师,Power BI开发工程师,上海域维信息科技有限公司,1.8-2.2万/月,上海-浦东新区,民营公司,3-4年经验,6,招若干人,五险一金 年终奖金 交通补贴 通讯补贴 免费班车,少于50人
501,数据,BI工程师,BI ETL开发工程师,广州碧软信息科技有限公司,1.5-3万/月,上海-虹口区,合资,3-4年经验,5,招5人,五险一金 补充医疗保险 员工旅游 年终奖金 绩效奖金 专业培训 定期体检,500-1000人
502,数据,BI工程师,BI开发工程师,上海口袋云网络科技有限公司,1.5-2万/月,上海-浦东新区,民营公司,3-4年经验,5,招2人,五险一金 年终奖金,50-150人
503,数据,BI工程师,Salesforce 资深开发工程师,北京腾信软创科技股份有限公司,1.5-2万/月,上海-浦东新区,上市公司,3-4年经验,6,招1人,定期体检 五险一金 员工旅游 交通补贴 餐饮补贴 专业培训,500-1000人
504,数据,BI工程师,BI工程师,上海肯数信息科技有限公司,1.5-2万/月,上海-闵行区,民营公司,3-4年经验,6,招2人,,50-150人
505,数据,BI工程师,dba(J11364),上海汉得信息技术股份有限公司,1-1.5万/月,上海-青浦区,上市公司,2年经验,5,招4人,,10000人以上
506,数据,BI工程师,BI项目经理,北京政通仁和建材有限公司,2-2.5万/月,上海-黄浦区,民营公司,3-4年经验,6,招1人,,50-150人
507,数据,BI工程师,Tableau咨询顾问,丰益（上海）信息技术有限公司,2-2.5万/月,异地招聘,外资（非欧美）,无需经验,6,招1人,五险一金 补充医疗保险 员工旅游 餐饮补贴 通讯补贴 年终奖金 绩效奖金 定期体检,500-1000人
508,数据,BI工程师,Senior BI Tech Consultant/高级BI技术咨询师,澳汰尔工程软件（上海）有限公司,30-60万/年,上海-静安区,外资（欧美）,5-7年经验,6,招1人,补充医疗保险 员工旅游 五险一金 出国机会 弹性工作 定期体检 餐饮补贴 通讯补贴 交通补贴,50-150人
509,数据,BI工程师,主数据实施顾问,上海帕科信息科技有限公司,1.5-2.5万/月,上海-徐汇区,民营公司,3-4年经验,6,招1人,五险一金 餐饮补贴 定期体检 补充医疗保险 补充公积金 员工旅游,50-150人
510,数据,BI工程师,MDM/BI BA,天津恩恩科技有限公司,2-2.5万/月,上海-徐汇区,外资（欧美）,5-7年经验,6,招1人,五险一金 餐饮补贴 弹性工作 补充医疗保险 通讯补贴,500-1000人
511,数据,BI工程师,测试工程师（偏数据）,上海吉贝克信息技术有限公司,1-1.5万/月,上海-浦东新区,民营公司,3-4年经验,6,招1人,五险一金 专业培训 通讯补贴,500-1000人
512,数据,BI工程师,协议移植工程師,杭州云合智网技术有限公司,2.5-4万/月,上海-徐汇区,民营公司,5-7年经验,6,招5人,五险一金 补充医疗保险 补充公积金 员工旅游 餐饮补贴 绩效奖金 年终奖金 股票期权 弹性工作 定期体检,50-150人
513,数据,BI工程师,数据库工程师,金锐软件技术（杭州）有限公司,1.3-1.8万/月,上海-静安区,民营公司,3-4年经验,6,招1人,五险一金 员工旅游 专业培训 餐饮补贴 交通补贴 绩效奖金 年终奖金 定期体检,
514,数据,BI工程师,Tableau技术顾问,上海腾柏信息技术有限公司,6-8千/月,上海-普陀区,民营公司,1年经验,5,招1人,五险一金 餐饮补贴,少于50人
515,数据,BI工程师,BI工程师,深圳市爱德数智科技股份有限公司,6-8千/月,上海-闵行区,民营公司,在校生/应届生,6,招5人,,500-1000人
516,数据,BI工程师,BI实施工程师,南京思后行信息技术有限公司,4-8千/月,异地招聘,民营公司,在校生/应届生,5,招若干人,,少于50人
517,数据,BI工程师,BI开发工程师/主管经理 (26),上海复深蓝软件股份有限公司,2-2.5万/月,上海-浦东新区,上市公司,5-7年经验,6,招5人,,1000-5000人
518,数据,BI工程师,BI开发工程师（26）,上海复深蓝软件股份有限公司,2-3万/月,上海-浦东新区,上市公司,5-7年经验,5,招2人,,1000-5000人
519,数据,BI工程师,BI开发工程师26,上海复深蓝软件股份有限公司,1.5-2.5万/月,上海-浦东新区,上市公司,5-7年经验,5,招3人,五险一金 专业培训 年终奖金 弹性工作 绩效奖金 交通补贴 定期体检 出国机会 员工旅游 免费班车,1000-5000人
520,数据,BI工程师,BI开发工程师（Oracle/ETL）25,上海复深蓝软件股份有限公司,1.5-2万/月,上海-浦东新区,上市公司,3-4年经验,5,招2人,,1000-5000人
521,数据,BI工程师,BI开发工程师（Oracle/ETL）保险行业20,上海复深蓝软件股份有限公司,1.5-2万/月,上海-浦东新区,上市公司,3-4年经验,6,招1人,五险一金 年终奖金 做五休二 出国机会,1000-5000人
522,数据,BI工程师,BI开发工程师（ETL/Oracle）20,上海复深蓝软件股份有限公司,1.8-2.5万/月,上海-浦东新区,上市公司,3-4年经验,5,招2人,五险一金 年终奖金 做五休二 定期体检 绩效奖金,1000-5000人
523,数据,BI工程师,BI经理,上海意臣信息科技有限公司,1.5-2万/月,上海-徐汇区,民营公司,5-7年经验,5,招若干人,五险一金 交通补贴 绩效奖金 年终奖金 专业培训 员工旅游 弹性工作 周末双休,50-150人
524,数据,BI工程师,BI报表开发/数据分析工程师,上海意臣信息科技有限公司,0.8-1.5万/月,上海-徐汇区,民营公司,1年经验,5,招若干人,五险一金 绩效奖金 年终奖金 专业培训 周末双休 员工旅游 餐饮补贴,50-150人
525,数据,BI工程师,资深BI工程师,上海意臣信息科技有限公司,1.5-2万/月,上海-徐汇区,民营公司,3-4年经验,6,招若干人,五险一金 绩效奖金 年终奖金 专业培训 周末双休 员工旅游 餐饮补贴,50-150人
526,数据,BI工程师,Power BI工程师,加绩（上海）科技服务有限公司,1.5-3万/月,上海-长宁区,上市公司,5-7年经验,6,招1人,,150-500人
527,数据,BI工程师,BI工程师（POWER BI ）,秘珀（上海）软件科技有限公司,1.5-2万/月,上海,外资（欧美）,3-4年经验,6,招1人,五险一金 员工旅游 带薪年休假 补充带薪休假 弹性工作 专业培训 项目奖金 出差补贴,50-150人
528,数据,BI工程师,BI 工程师/项目主管（POWER BI）,秘珀（上海）软件科技有限公司,1.5-2.5万/月,上海,外资（欧美）,3-4年经验,6,招1人,五险一金 员工旅游 年终奖金 周末双休 带薪年休假 补充带薪休假 项目奖金 弹性工作,50-150人
529,数据,BI工程师,BI 工程师,上海万允信息科技有限公司,1.5-2万/月,上海-长宁区,民营公司,5-7年经验,5,招5人,五险一金 员工旅游 专业培训 绩效奖金 年终奖金 定期体检 节日福利 周末双休,少于50人
530,数据,BI工程师,BI工程师,上海柏维信息技术有限公司,1.5-2万/月,上海-徐汇区,合资,3-4年经验,6,招1人,五险一金 补充医疗保险 定期体检 带薪年假 节日福利 人才推荐奖 司龄礼物 生日礼物 季度团建,50-150人
531,数据,BI工程师,BI工程师(J10477),上海耸智信息科技有限公司,1-1.5万/月,上海-浦东新区,民营公司,3-4年经验,6,招2人,周末双休 弹性工作 五险一金 餐饮补贴 绩效奖金 年终奖金,150-500人
532,数据,BI工程师,数据开发工程师,深圳市赢和信息技术有限公司,7-9千/月,上海-浦东新区,民营公司,1年经验,6,招1人,,50-150人
533,数据,BI工程师,BI分析师,上海襄岳信息技术有限公司,1.2-2.4万/月,上海-闵行区,民营公司,3-4年经验,6,招5人,员工旅游 年终奖金 绩效奖金 节假日福利 五险一金,150-500人
534,数据,BI工程师,BI工程师-06,上海复深蓝软件股份有限公司,2-2.5万/月,上海-浦东新区,上市公司,3-4年经验,5,招2人,五险一金 交通补贴 绩效奖金 年终奖金 带薪年假,1000-5000人
535,数据,BI工程师,BI开发工程师主管（03）,上海复深蓝软件股份有限公司,2-2.5万/月,上海-浦东新区,上市公司,3-4年经验,5,招若干人,做五休二 周末双休 带薪年假 五险一金 交通补贴 通讯补贴 专业培训 加班补贴 绩效奖金,1000-5000人
536,数据,BI工程师,BI项目开发工程师,上海倍通医药科技咨询有限公司,1-1.5万/月,上海-黄浦区,民营公司,3-4年经验,6,招1人,五险一金 弹性工作 周末双休 专业培训 绩效奖金,1000-5000人
537,数据,BI工程师,帆软finereport报表开发,上海绯逸信息技术有限公司,1.2-1.6万/月,上海-黄浦区,民营公司,2年经验,,招1人,,50-150人
538,数据,BI工程师,BI工程师,上海时溪信息技术有限公司,1.5-2.5万/月,上海-浦东新区,民营公司,5-7年经验,6,招1人,五险一金 免费班车,50-150人
539,数据,BI工程师,BI开发工程师,广州安正软件有限公司,1.5-2万/月,上海-浦东新区,民营公司,3-4年经验,6,招1人,五险一金 员工旅游 专业培训 绩效奖金 定期体检,150-500人
540,数据,BI工程师,BI工程师,上海迈志信息科技有限公司,1.5-2万/月,上海-黄浦区,民营公司,2年经验,5,招若干人,五险一金 员工旅游 绩效奖金 年终奖金 定期体检,50-150人
541,数据,BI工程师,oracle数据库,上海复深蓝软件股份有限公司,1.5-2.5万/月,上海-徐汇区,上市公司,5-7年经验,6,招1人,五险一金 交通补贴 绩效奖金 年终奖金 带薪年假,1000-5000人
542,数据,BI工程师,数据开发工程师,上海中科软科技有限公司,1-1.5万/月,上海-浦东新区,上市公司,2年经验,6,招4人,五险一金 员工旅游 餐饮补贴 年终奖金 定期体检,10000人以上
543,数据,BI工程师,BI工程师（08）,上海复深蓝软件股份有限公司,2-3万/月,上海-浦东新区,上市公司,5-7年经验,5,招1人,五险一金 年终奖金 绩效奖金 员工旅游 出国机会,1000-5000人
544,数据,BI工程师,BI高级商务智能数据仓库大数据工程师,上海必盈特软件系统有限公司,1.5-2万/月,上海,合资,3-4年经验,6,招1人,定期体检 年终奖金 五险一金 绩效奖金 员工公寓 专业培训,50-150人
545,数据,BI工程师,高级商务智能工程师/高级数据仓库工程师,上海必盈特软件系统有限公司,1.5-2万/月,上海,合资,3-4年经验,6,招1人,定期体检 年终奖金 五险一金 绩效奖金 员工公寓 专业培训,50-150人
546,数据,BI工程师,BI,上海华钦信息科技股份有限公司,1.5-2万/月,上海-浦东新区,上市公司,2年经验,6,招2人,五险一金 补充医疗保险 年终奖金 专业培训 定期体检 弹性工作,1000-5000人
547,数据,BI工程师,Tableau咨询顾问,丰益（上海）信息技术有限公司,2-2.5万/月,上海-浦东新区,外资（非欧美）,无需经验,6,招1人,五险一金 补充医疗保险 员工旅游 餐饮补贴 通讯补贴 年终奖金 绩效奖金 定期体检,500-1000人
548,数据,BI工程师,Data Development Engineer,高知特信息技术（上海）有限公司 Cognizant Technology Solutions,2-3万/月,上海-浦东新区,外资（欧美）,3-4年经验,6,招1人,,1000-5000人
549,数据,BI工程师,BI/ETL/Azure运维开发工程师,上海意臣信息科技有限公司,1.2-1.7万/月,上海-徐汇区,民营公司,2年经验,5,招1人,五险一金 交通补贴 绩效奖金 年终奖金 餐饮补贴 员工旅游 专业培训 出国机会 周末双休 带薪年假,50-150人
550,数据,BI工程师,微软BI工程师/SQL SERVER数据库工程师,上海意臣信息科技有限公司,1.8-3万/月,上海-徐汇区,民营公司,5-7年经验,6,招若干人,五险一金 交通补贴 绩效奖金 年终奖金 餐饮补贴 员工旅游 专业培训 出国机会 周末双休 带薪年假,50-150人
551,数据,BI工程师,BI大客户经理/BI运维项目经理,上海意臣信息科技有限公司,1.5-2万/月,上海-徐汇区,民营公司,5-7年经验,5,招若干人,五险一金 交通补贴 绩效奖金 年终奖金 专业培训 员工旅游 弹性工作 周末双休,50-150人
552,数据,BI工程师,数据实施工程师,深圳市赢和信息技术有限公司,6-9千/月,上海-虹口区,民营公司,1年经验,5,招若干人,,50-150人
553,数据,BI工程师,大数据开发工程师（03）,上海复深蓝软件股份有限公司,2-2.5万/月,上海,上市公司,5-7年经验,6,招2人,五险一金 年终奖金 绩效奖金 弹性工作 定期体检 做五休二,1000-5000人
554,数据,BI工程师,BI项目经理,北京政通仁和建材有限公司,3-4万/月,上海-黄浦区,民营公司,5-7年经验,6,招2人,,50-150人
555,数据,BI工程师,商务智能/数据仓库/大数据工程师,上海必盈特软件系统有限公司,0.8-1.2万/月,上海,合资,1年经验,6,招2人,定期体检 年终奖金 五险一金 绩效奖金 员工公寓 专业培训,50-150人
556,数据,BI工程师,BI设计师,上海口袋云网络科技有限公司,1-1.3万/月,上海-宝山区,民营公司,2年经验,5,招1人,五险一金 年终奖金,50-150人
557,数据,BI工程师,数据实习生,上海意臣信息科技有限公司,3-4.5千/月,上海-徐汇区,民营公司,在校生/应届生,6,招1人,五险一金 交通补贴 绩效奖金 年终奖金 专业培训 员工旅游 弹性工作 周末双休,50-150人
558,数据,BI工程师,BI 工程师 - Intern,秘珀（上海）软件科技有限公司,100元/天,上海,外资（欧美）,在校生/应届生,6,招若干人,五险一金 员工旅游 年终奖金 周末双休 带薪年休假 补充带薪休假 项目奖金 弹性工作,50-150人
559,数据,BI工程师,BI实习生,德昂信息技术（北京）有限公司,150元/天,上海-静安区,创业公司,在校生/应届生,6,招若干人,优异可留任,50-150人
560,数据,BI工程师,数据工程师（ETL开发/报表开发/大数据方向）-实习岗,广州安正软件有限公司,2.5-4.5千/月,异地招聘,民营公司,在校生/应届生,6,招若干人,,150-500人
561,数据,数据采集工程师,数据开发工程师（银行）,上海威士顿信息技术股份有限公司,0.9-1.1万/月,上海-浦东新区,民营公司,1年经验,6,招若干人,五险一金 补充医疗保险 员工旅游 年终奖金 专业培训 定期体检 弹性工作,150-500人
