,big_category,small_category,job_name,company_name,salary,work_area,company_type,work_year,education,recruitment_scale,welfare,company_size
212,移动开发,Android开发工程师,Android开发工程师,金锐软件技术（杭州）有限公司,1.3-1.8万/月,上海-静安区,民营公司,3-4年经验,6,招1人,五险一金 员工旅游 专业培训 餐饮补贴 交通补贴 绩效奖金 年终奖金 定期体检,
213,移动开发,Android开发工程师,Android开发工程师,上海波导信息技术有限公司,1.5-2.3万/月,上海-宝山区,民营公司,3-4年经验,5,招1人,,50-150人
214,移动开发,Android开发工程师,Android高级开发工程师,上海数果科技有限公司,2-2.5万/月,上海-青浦区,民营公司,5-7年经验,6,招1人,,50-150人
215,移动开发,Android开发工程师,资深安卓开发师,上海指阶信息科技有限公司,1.5-2.5万/月,上海-浦东新区,民营公司,3-4年经验,,招1人,五险一金 绩效奖金 弹性工作 做五休二,少于50人
216,移动开发,Android开发工程师,Android开发工程师,好叭科技（上海）有限公司,1.8-2.5万/月,上海-浦东新区,民营公司,3-4年经验,5,招1人,,少于50人
217,移动开发,Android开发工程师,Android开发工程师,上海桑万信息技术有限公司,1-1.5万/月,上海-虹口区,民营公司,3-4年经验,5,招1人,五险一金 餐饮补贴 年终奖金 节假日福利 绩效奖金,50-150人
218,移动开发,Android开发工程师,终端开发工程师,宁波比孚信息科技有限公司,2.5-3万/月,上海,合资,3-4年经验,5,招1人,五险一金 专业培训 定期体检 绩效奖金 年终奖金 弹性工作,150-500人
219,移动开发,Android开发工程师,Android开发工程师,上海沸橙信息科技有限公司,1.5-1.8万/月,上海-浦东新区,民营公司,3-4年经验,5,招1人,,50-150人
220,移动开发,Android开发工程师,安卓开发工程师,竹间智能科技（上海）有限公司,2-4万/月,上海,外资（欧美）,3-4年经验,6,招1人,餐饮补贴 年终奖金 弹性工作 六险一金,150-500人
221,移动开发,Android开发工程师,Android开发工程师,慧勒工程软件（上海）有限公司,1.2-2万/月,上海-嘉定区,民营公司,3-4年经验,6,招若干人,五险一金 绩效奖金 年终奖金 员工旅游 定期体检 交通补贴 专业培训 股票期权,50-150人
222,移动开发,Android开发工程师,安卓研发,柯莱特科技股份有限公司,1.5-2万/月,上海,上市公司,3-4年经验,5,招若干人,五险一金 专业培训,5000-10000人
223,移动开发,Android开发工程师,Android开发工程师,上海帼联信息技术有限公司,1.3-1.7万/月,上海-静安区,民营公司,3-4年经验,6,招1人,五险一金 补充医疗保险 员工旅游 节假日补贴 生日福利 绩效奖金,
224,移动开发,Android开发工程师,Android开发工程师,上海功存智能科技有限公司,1-2万/月,上海-闵行区,民营公司,1年经验,5,招若干人,五险一金 餐饮补贴 绩效奖金 年终奖金,150-500人
225,移动开发,Android开发工程师,Android开发工程师,辉立投资咨询（上海）有限公司,1-2万/月,上海-静安区,外资（非欧美）,2年经验,6,招2人,五险一金 年终奖金 绩效奖金 出国机会,500-1000人
226,移动开发,Android开发工程师,Android开发工程师,浙江上扬商业设备科技股份有限公司上海分公司,1.5-2万/月,上海-闵行区,民营公司,3-4年经验,5,招1人,餐饮补贴 五险一金,500-1000人
227,移动开发,Android开发工程师,安卓/Android 开发工程师,上海视畅信息科技有限公司,1.5-2.2万/月,上海-浦东新区,民营公司,5-7年经验,6,招2人,,50-150人
228,移动开发,Android开发工程师,高级Android开发工程师 (MJ000129),京北方信息技术股份有限公司,1.3-1.7万/月,上海-浦东新区,民营公司,3-4年经验,6,招2人,,10000人以上
229,移动开发,Android开发工程师,Android中级开发工程师,上海实壹信息科技有限公司,1.5-2万/月,上海-浦东新区,合资,3-4年经验,6,招1人,五险一金 员工旅游 绩效奖金 年终奖金 弹性工作 团队聚餐 周末双休,150-500人
230,移动开发,Android开发工程师,Android开发工程师,上海士翌信息技术有限公司,1-3万/月,上海-浦东新区,民营公司,2年经验,6,招若干人,五险一金 员工旅游 餐饮补贴 绩效奖金 年终奖金 股票期权 弹性工作 定期体检,
231,移动开发,Android开发工程师,Android开发工程师,上海寰擎信息科技有限公司,1.5-2万/月,上海,民营公司,2年经验,6,招1人,五险一金 员工旅游 绩效奖金 年终奖金 股票期权 弹性工作 定期体检,50-150人
232,移动开发,Android开发工程师,APP开发主管,上海易路软件有限公司,2.5-3.5万/月,上海-闵行区,民营公司,5-7年经验,6,招1人,大牛带队 准独角兽企业 租房补贴 餐饮补贴 交通补贴 弹性工作 带薪年假 年终奖金 定期体检,150-500人
233,移动开发,Android开发工程师,Android开发工程师,南创博新技术有限公司,1-1.5万/月,上海-徐汇区,民营公司,1年经验,5,招3人,,50-150人
234,移动开发,Android开发工程师,Android SDK开发工程师(游戏),上海云岐网络科技有限公司,1-2万/月,上海-徐汇区,合资,2年经验,5,招1人,五险一金 绩效奖金 年终奖金 弹性工作 团建 扁平化管理 团队氛围好,少于50人
235,移动开发,Android开发工程师,Android开发工程师,上海淡竹体育科技有限公司,1.5-2万/月,上海-徐汇区,民营公司,3-4年经验,6,招5人,补充医疗保险 五险一金 年终奖金 绩效奖金 股票期权 定期体检,少于50人
236,移动开发,Android开发工程师,安卓APP开发,上海才匠智能科技有限公司,6-8千/月,上海-浦东新区,民营公司,1年经验,6,招2人,做五休二 免费班车 节日福利 五险一金 带薪年假,50-150人
237,移动开发,Android开发工程师,Android开发工程师,上海宇丰电子信息科技发展有限公司,1-1.5万/月,上海-闵行区,民营公司,3-4年经验,5,招1人,五险一金 年终奖金 餐饮补贴,少于50人
238,移动开发,Android开发工程师,Android开发工程师,安杰拓信息科技（上海）有限公司,0.8-1万/月,上海-闵行区,创业公司,3-4年经验,6,招2人,周末双休 交通补贴 餐饮补贴,少于50人
239,移动开发,Android开发工程师,Tele协议开发工程师,江苏摩普科技有限公司,0.8-2万/月,上海-浦东新区,民营公司,2年经验,6,招1人,五险一金,150-500人
240,移动开发,Android开发工程师,软件开发工程师,上海复讯农业科技有限公司,7-9千/月,上海,民营公司,3-4年经验,5,招2人,,少于50人
241,移动开发,Android开发工程师,Android开发工程师,上海玺智汽车租赁有限公司,1.5-2.5万/月,上海-普陀区,合资,3-4年经验,6,招1人,做五休二 五险一金 绩效奖金 餐饮补贴,150-500人
242,移动开发,Android开发工程师,安卓端软件开发工程师,上海胜扬信息科技有限公司,1-1.5万/月,上海-徐汇区,民营公司,2年经验,6,招1人,,
243,移动开发,Android开发工程师,Android开发工程师,上海四辐信息科技有限公司,1-1.5万/月,上海-青浦区,民营公司,3-4年经验,6,招若干人,通讯补贴 节日福利 全勤奖 专业培训 包住宿 弹性工作 做六休一 五险一金,150-500人
244,移动开发,Android开发工程师,Android开发工程师,上海趣农科技有限公司,1-1.5万/月,上海-浦东新区,创业公司,1年经验,5,招若干人,五险一金,少于50人
245,移动开发,Android开发工程师,Android开发工程师,上海图丽信息技术有限公司,1-2.5万/月,上海-浦东新区,民营公司,3-4年经验,6,招5人,五险一金 餐饮补贴 定期体检 周末双休 免费班车 带薪年假 年终奖金,150-500人
246,移动开发,Android开发工程师,Android手机APP开发工程师,英立视数码电视集团,0.8-1.5万/月,上海-闵行区,外资（欧美）,2年经验,5,招1人,五险一金 绩效奖金 餐饮补贴 通讯补贴 年终奖金,150-500人
247,移动开发,Android开发工程师,Android开发工程师,上海强然数码科技有限公司,2-2.5万/月,上海,合资,3-4年经验,6,招2人,五险一金 员工旅游 通讯补贴 绩效奖金 年终奖金 做五休二,500-1000人
248,移动开发,Android开发工程师,急招Android软件开发工程师,华夏盛德科技发展（上海）有限公司,1.2-1.6万/月,上海-杨浦区,民营公司,3-4年经验,5,招1人,五险一金 员工旅游 专业培训 出国机会 定期体检 年终奖金 绩效奖金,50-150人
249,移动开发,Android开发工程师,高级安卓开发工程师,上海科勤信息技术有限公司,1.3-2.5万/月,上海-嘉定区,民营公司,3-4年经验,6,招3人,,50-150人
250,移动开发,Android开发工程师,APP开发工程师,上海恒叶健康科技发展有限公司,1-1.5万/月,上海-闵行区,民营公司,3-4年经验,6,招2人,,少于50人
251,移动开发,Android开发工程师,Android开发工程师,杭州图序信息技术有限公司,1-1.5万/月,上海-徐汇区,民营公司,3-4年经验,5,招2人,五险一金 交通补贴 餐饮补贴 绩效奖金 年终奖金,50-150人
252,移动开发,Android开发工程师,Android开发工程师,西安思华信息技术有限公司,1.5-2.5万/月,上海-浦东新区,民营公司,3-4年经验,6,招1人,五险一金 补充公积金 补充医疗保险 员工旅游 交通补贴 餐饮补贴 年终奖金 弹性工作 定期体检,150-500人
253,移动开发,Android开发工程师,移动端开发工程师（ios/Android）,上海浩方信息技术有限公司,1.8-2.3万/月,上海-虹口区,合资,3-4年经验,6,招2人,,1000-5000人
254,移动开发,Android开发工程师,Android开发工程师,上海蜂阁信息科技有限公司,1-1.7万/月,上海-静安区,民营公司,2年经验,5,招若干人,五险一金 员工旅游 餐饮补贴 绩效奖金 年终奖金 定期体检 年轻化团队,少于50人
255,移动开发,Android开发工程师,Android开发工程师,上海牧言智能科技有限公司,0.8-1万/月,上海-嘉定区,民营公司,2年经验,6,招1人,五险一金 员工旅游 交通补贴 餐饮补贴 通讯补贴 绩效奖金 年终奖金 弹性工作 定期体检,少于50人
256,移动开发,Android开发工程师,Android开发工程师-00677,萨孚凯信息系统技术（北京）有限公司上海分公司,1.5-2万/月,上海-浦东新区,外资（欧美）,3-4年经验,5,招1人,五险一金 补充医疗保险 专业培训 定期体检 餐饮补贴 年终奖金 出国机会,1000-5000人
257,移动开发,Android开发工程师,Android开发工程师,上海新网程信息技术股份有限公司,1-2万/月,上海-普陀区,民营公司,3-4年经验,6,招1人,五险一金 交通补贴 员工旅游 年终奖金 股票期权 绩效奖金 通讯补贴,50-150人
258,移动开发,Android开发工程师,Android开发工程师,深圳极联信息技术股份有限公司,1.3-1.6万/月,上海-杨浦区,民营公司,3-4年经验,6,招若干人,五险一金 员工旅游 年终奖金 绩效奖金 弹性工作 专业培训 定期体检 全勤奖,500-1000人
259,移动开发,Android开发工程师,Android开发工程师,易批生鲜信息发展股份有限公司,0.8-1.5万/月,上海,民营公司,1年经验,5,招若干人,五险一金 餐饮补贴 定期体检 交通补贴 通讯补贴 年终奖金 绩效奖金 员工旅游,50-150人
260,移动开发,Android开发工程师,Android开发工程师,合肥英泽信息科技有限公司,1.5-2万/月,上海-杨浦区,民营公司,3-4年经验,5,招5人,,150-500人
261,移动开发,Android开发工程师,Android开发工程师,上海锐至信息技术股份有限公司,1-1.5万/月,上海-徐汇区,民营公司,2年经验,5,招若干人,五险一金 员工旅游 交通补贴 年终奖金 绩效奖金 餐饮补贴 定期体检,50-150人
262,移动开发,Android开发工程师,安卓系统人机界面开发人员 HMI,上海扶丕悌软件有限公司,,上海-闵行区,外资（非欧美）,3-4年经验,6,招3人,五险一金 出国机会,10000人以上
263,移动开发,Android开发工程师,Android开发工程师（BSP）,武汉市芯知软件科技有限公司,2.5-3.5万/月,上海,民营公司,3-4年经验,5,招若干人,,150-500人
264,移动开发,Android开发工程师,Android开发工程师,上海海鼎信息工程股份有限公司,1-1.8万/月,上海-闵行区,民营公司,2年经验,6,招1人,五险一金 弹性工作 年终奖金 定期体检 餐饮补贴,500-1000人
265,移动开发,Android开发工程师,Android开发工程师,深圳市德科信息技术有限公司,1.2-1.6万/月,上海-徐汇区,民营公司,3-4年经验,6,招2人,员工旅游 专业培训 弹性工作 年终奖金 绩效奖金 五险一金,1000-5000人
266,移动开发,Android开发工程师,Android开发工程师,上海会山信息科技有限公司,1-1.5万/月,上海-闵行区,外资（非欧美）,2年经验,5,招若干人,,少于50人
267,移动开发,Android开发工程师,Android开发工程师,广州碧软信息科技有限公司,1.5-2万/月,上海,合资,3-4年经验,5,招若干人,五险一金 补充医疗保险 员工旅游 绩效奖金 年终奖金 定期体检,500-1000人
268,移动开发,Android开发工程师,Android开发工程师,北京锐志天宏科技股份有限公司,1-2万/月,上海-浦东新区,民营公司,3-4年经验,5,招3人,五险一金 员工旅游 餐饮补贴 绩效奖金 年终奖金 定期体检 带薪年假 领导好,50-150人
269,移动开发,Android开发工程师,Android开发工程师,上海鲁班软件股份有限公司,1.2-2万/月,上海-杨浦区,民营公司,1年经验,6,招若干人,五险一金 专业培训 绩效奖金 股票期权 年终奖金 定期体检,500-1000人
270,移动开发,Android开发工程师,Android开发工程师,狮控（上海）互联网科技有限公司,1.3-2万/月,上海-普陀区,民营公司,2年经验,5,招1人,五险一金 绩效奖金 年终奖金 定期体检 股票期权 专业培训,少于50人
271,移动开发,Android开发工程师,Android开发工程师,上海思岚科技有限公司,1.5-3万/月,上海-浦东新区,民营公司,2年经验,6,招1人,五险一金 补充医疗保险 补充公积金 免费班车 弹性工作 定期体检 扁平化管理 年终奖金 股票期权,50-150人
272,移动开发,Android开发工程师,Android开发工程师,秦皇岛环颖科技有限公司,1.5-2万/月,上海-浦东新区,民营公司,2年经验,6,招2人,,
273,移动开发,Android开发工程师,Android开发工程师,上海口袋云网络科技有限公司,1.5-2万/月,上海-宝山区,民营公司,2年经验,6,招若干人,五险一金 年终奖金,50-150人
274,移动开发,Android开发工程师,Android驱动工程师,深圳市中科卓软科技有限公司,2.5-3.6万/月,上海-浦东新区,民营公司,3-4年经验,6,招2人,五险一金 员工旅游 交通补贴 餐饮补贴 通讯补贴 绩效奖金,50-150人
275,移动开发,Android开发工程师,Android开发工程师,上海华钦信息科技股份有限公司,2-3万/月,上海-浦东新区,上市公司,3-4年经验,6,招3人,,1000-5000人
276,移动开发,Android开发工程师,Android开发工程师,郑州炬承信息技术有限公司,1-1.5万/月,上海-浦东新区,民营公司,3-4年经验,5,招若干人,五险一金 节日福利 生日红包,50-150人
277,移动开发,Android开发工程师,android研发工程师（中高级）,上海证申信息服务有限公司,20-30万/年,上海-静安区,国企,3-4年经验,6,招若干人,五险一金 补充医疗保险 补充公积金 专业培训 绩效奖金 年终奖金 定期体检,150-500人
278,移动开发,Android开发工程师,Android开发工程师,视若飞信息科技（上海）有限公司,2-2.5万/月,上海-杨浦区,合资,5-7年经验,6,招1人,足额交金 补充医疗保险 员工旅游 专业培训 餐饮补贴 定期体检,50-150人
279,移动开发,Android开发工程师,Android开发工程师（南宁）,广西信恒科技有限公司,0.8-1.5万/月,异地招聘,民营公司,3-4年经验,5,招2人,五险 定期体检 住房补贴 带薪年假 绩效奖金 弹性工作 周末双休,少于50人
280,移动开发,Android开发工程师,Android开发工程师,铂渊信息技术（上海）有限公司,0.9-1.5万/月,上海-杨浦区,民营公司,2年经验,5,招1人,员工旅游 年终奖金 绩效奖金 弹性工作 定期体检 五险一金 专业培训,少于50人
281,移动开发,Android开发工程师,Android测试开发工程师,蓝马智能科技（无锡）有限公司,1-2.5万/月,上海-浦东新区,民营公司,3-4年经验,6,招若干人,五险一金 餐饮补贴 绩效奖金 年终奖金 股票期权 定期体检 司龄年休假,50-150人
282,移动开发,Android开发工程师,Android性能优化工程师,上海商泰汽车信息系统有限公司,2.3-3.5万/月,上海,外资（非欧美）,5-7年经验,6,招2人,周末双休 年度旅游 带薪年假 体检 一年十四薪 补充医疗保险 补充公积金 额外福利年假 965工作制 四条地铁线,1000-5000人
283,移动开发,Android开发工程师,安卓应用工程师（上海）,深圳市紫旗科技有限公司,6-8千/月,上海,民营公司,在校生/应届生,5,招6人,,
284,移动开发,Android开发工程师,Android开发工程师（上海）,江苏满运软件科技有限公司,1-2.5万/月,上海,民营公司,在校生/应届生,6,招若干人,,
285,移动开发,Android开发工程师,Android驱动工程师实习生,上海影创信息科技有限公司,200元/天,上海-浦东新区,合资,在校生/应届生,6,招2人,,150-500人
286,移动开发,Android开发工程师,资深Android开发工程师,杭州涂鸦信息技术有限公司,2-3万/月,上海-长宁区,上市公司,在校生/应届生,6,招5人,,1000-5000人
287,移动开发,Android开发工程师,安卓app研发（校园）,上海致昕信息科技有限公司,0.5-1万/月,上海-宝山区,民营公司,在校生/应届生,6,招10人,五险一金 绩效奖金 节日福利 年终奖金 专业技术培训,50-150人
288,移动开发,Android开发工程师,Android开发实习生,上海傲义电子科技有限公司,180元/天,上海-青浦区,民营公司,在校生/应届生,6,招1人,,50-150人
289,移动开发,Android开发工程师,ID设计师,深圳传音控股股份有限公司,6-8千/月,异地招聘,外资（欧美）,在校生/应届生,6,招2人,,少于50人
290,移动开发,Android开发工程师,安卓/Android开发工程师,上海曲合网络科技有限公司,10-20万/月,上海-闵行区,民营公司,3-4年经验,5,招3人,五险一金 员工旅游 交通补贴 年终奖金 绩效奖金 定期体检 专业培训,150-500人
291,移动开发,Android开发工程师,技术经理/高级架构师,上海十年智能科技有限公司,5-7万/月,上海-黄浦区,民营公司,8-9年经验,6,招1人,,50-150人
292,移动开发,Android开发工程师,安卓应用开发,软通动力信息技术（集团）股份有限公司,1.8-3.5万/月,上海-浦东新区,民营公司,3-4年经验,6,招5人,五险一金 定期体检 弹性工作 绩效奖金 年终奖金,10000人以上
293,移动开发,Android开发工程师,Android开发工程师,上海有立信息科技有限公司,5-8千/月,上海-静安区,民营公司,2年经验,5,招若干人,五险一金 年终奖金 通讯补贴 餐饮补贴,少于50人
294,移动开发,Android开发工程师,国产化技术专家,中银金融科技（苏州）有限公司,5-8万/月,上海-浦东新区,国企,5-7年经验,6,招若干人,五险一金 通讯补贴 餐饮补贴 交通补贴 绩效奖金 定期体检 免费班车,50-150人
295,移动开发,Android开发工程师,安卓开发工程师,上海网波软件股份有限公司,1-1.5万/月,上海-杨浦区,民营公司,2年经验,6,招若干人,五险一金 交通补贴 餐饮补贴,50-150人
296,移动开发,Android开发工程师,安卓开发工程师,上海网波软件股份有限公司,1.2-1.5万/月,上海-杨浦区,民营公司,2年经验,6,招若干人,五险一金 餐饮补贴 交通补贴,50-150人
297,移动开发,Android开发工程师,Android开发工程师-25,上海复深蓝软件股份有限公司,1.7-2.5万/月,上海-浦东新区,上市公司,5-7年经验,5,招2人,,1000-5000人
298,移动开发,Android开发工程师,Android开发工程师-（20）,上海复深蓝软件股份有限公司,1.7-2.5万/月,上海-浦东新区,上市公司,3-4年经验,5,招2人,五险一金 年终奖金 做五休二 定期体检 绩效奖金,1000-5000人
299,移动开发,Android开发工程师,车载Android应用工程师-2001,南京百尔马智能技术有限公司,1.5-2万/月,上海,民营公司,3-4年经验,5,招2人,五险一金 弹性工作,50-150人
300,移动开发,Android开发工程师,Android应用开发工程师,南京百尔马智能技术有限公司,1.5-2万/月,上海,民营公司,3-4年经验,6,招2人,五险一金,50-150人
301,移动开发,Android开发工程师,Android开发工程师(咪咕驻场）,上海鸿冠信息科技股份有限公司,2-2.5万/月,上海-浦东新区,民营公司,5-7年经验,5,招若干人,五险一金 专业培训 定期体检 绩效奖金 年终奖金,150-500人
302,移动开发,Android开发工程师,Android开发工程师,上海山扶科技有限公司,2.2-2.5万/月,上海-静安区,民营公司,3-4年经验,6,招1人,五险一金 做五休二 舒适环境 股票期权,少于50人
303,移动开发,Android开发工程师,安卓开发工程师,上海山扶科技有限公司,2.2-2.5万/月,上海-静安区,民营公司,3-4年经验,6,招1人,五险一金 做五休二 舒适环境 股票期权,少于50人
304,移动开发,Android开发工程师,Android开发工程师（远程办公）,上海本原网络科技有限公司,1.5-2万/月,上海-松江区,民营公司,1年经验,6,招若干人,做五休二 周末双休 弹性工作,少于50人
305,移动开发,Android开发工程师,高级安卓开发工程师（平安项目）,深圳市宝润兴业互联网信息服务有限公司,1.5-2.2万/月,上海-浦东新区,民营公司,5-7年经验,5,招5人,五险一金,500-1000人
306,移动开发,Android开发工程师,高级Android开发工程师（平安项目）,深圳市宝润兴业互联网信息服务有限公司,1.5-2.2万/月,上海-浦东新区,民营公司,5-7年经验,5,招5人,五险一金,500-1000人
307,移动开发,Android开发工程师,高级Android开发工程师,深圳市宝润兴业互联网信息服务有限公司,1.5-2.2万/月,上海-浦东新区,民营公司,5-7年经验,5,招5人,五险一金,500-1000人
308,移动开发,Android开发工程师,Android开发工程师,上海杰之能软件科技有限公司,1.3-1.6万/月,上海-静安区,民营公司,3-4年经验,6,招若干人,五险一金 餐饮补贴,150-500人
309,移动开发,Android开发工程师,Android开发工程师,上海云逐信息技术有限公司,1.5-2万/月,上海-杨浦区,民营公司,5-7年经验,5,招2人,,50-150人
310,移动开发,Android开发工程师,BSP驱动-tp/lcd/memory/audio/sensor,南京民基悠步信息技术有限公司,1.5-3万/月,上海-浦东新区,民营公司,2年经验,5,招1人,,50-150人
311,移动开发,Android开发工程师,系统开发工程师,南京民基悠步信息技术有限公司,1-2.5万/月,上海-浦东新区,民营公司,1年经验,5,招若干人,五险一金 年终奖金 节假日礼品 年度体检 免费班车 补充医疗保险 定期体检 提供住宿,50-150人
312,移动开发,Android开发工程师,Android软件开发工程师-功耗,南京民基悠步信息技术有限公司,1-2万/月,上海,民营公司,2年经验,5,招2人,五险一金 年终奖金 节假日礼品 年度体检 免费班车 补充医疗保险 定期体检,50-150人
313,移动开发,Android开发工程师,APP开发工程师,芙索特（上海）医疗科技有限公司,1.2-1.7万/月,上海-浦东新区,民营公司,3-4年经验,6,招1人,五险一金 交通补贴 餐饮补贴 年终奖金 绩效奖金 股票期权 员工旅游 定期体检,少于50人
314,移动开发,Android开发工程师,Android中级开发工程师（会H5）,上海翔盛悦信息技术有限公司,1-1.5万/月,上海-浦东新区,民营公司,1年经验,5,招2人,绩效奖金 优秀员工奖励,少于50人
315,移动开发,Android开发工程师,Android/安卓开发工程师,上海翔盛悦信息技术有限公司,1-1.5万/月,上海-徐汇区,民营公司,2年经验,5,招3人,绩效奖金 优秀员工奖励,少于50人
316,移动开发,Android开发工程师,Android/安卓开发工程师,上海翔盛悦信息技术有限公司,1.3-1.8万/月,上海-浦东新区,民营公司,2年经验,5,招3人,绩效奖金 优秀员工奖励,少于50人
317,移动开发,Android开发工程师,安卓Android开发工程师,上海树维信息科技有限公司,1.3-2.2万/月,上海,民营公司,2年经验,6,招1人,周末双休 弹性工作 14薪 五险一金 定期体检 员工旅游,150-500人
318,移动开发,Android开发工程师,Android APP工程师,上海凯景信息技术有限公司,1.5-2万/月,上海-普陀区,民营公司,3-4年经验,6,招1人,,少于50人
319,移动开发,Android开发工程师,安卓MMI工程师（手机）,上海卓易科技股份有限公司,1-2万/月,上海-徐汇区,上市公司,1年经验,6,招5人,五险一金 弹性工作 定期体检 员工旅游 绩效奖金 年终奖金,150-500人
320,移动开发,Android开发工程师,Android开发工程师,上海卓易科技股份有限公司,1.5-2.5万/月,上海-徐汇区,上市公司,3-4年经验,6,招2人,五险一金 定期体检 绩效奖金 年终奖金 员工旅游 专业培训,150-500人
