,big_category,small_category,job_name,company_name,salary,work_area,company_type,work_year,education,recruitment_scale,welfare,company_size
2648,后端开发,软件工程师,Tableau运维工程师,广州元曜软件有限公司,1-1.5万/月,杭州-滨江区,民营公司,1年经验,6,招2人,五险一金 交通补贴 餐饮补贴 通讯补贴 出国机会 定期体检,150-500人
2649,后端开发,软件工程师,实施工程师,杭州徽华信息技术有限公司,6-8千/月,杭州-拱墅区,民营公司,1年经验,5,招若干人,,少于50人
2650,后端开发,软件工程师,数据库工程师 /  技术支持工程师/软件实施工程师,杭州三川国德物联网科技有限公司,10-15万/年,杭州,民营公司,1年经验,6,招5人,五险一金 弹性工作 员工旅游 年终奖金 餐饮补贴 通讯补贴 定期体检 股票期权,50-150人
2651,后端开发,软件工程师,软件测试工程师,杭州品茗信息技术有限公司,4.5-6千/月,杭州-西湖区,民营公司,2年经验,5,招2人,五险一金 定期体检 员工旅游 交通补贴 年终奖金 绩效奖金,50-150人
2652,后端开发,软件工程师,Web前端开发工程师,慈溪市顺通网络技术有限公司,8-12万/年,异地招聘,民营公司,1年经验,5,招5人,补充医疗保险 交通补贴 股票期权 年终奖金 绩效奖金 通讯补贴 餐饮补贴,少于50人
2653,后端开发,软件工程师,软件研发工程师,杭州华思通信技术有限公司,1-1.5万/月,杭州,民营公司,1年经验,6,招3人,,50-150人
2654,后端开发,软件工程师,软件事业部前端开发工程师,浙江爱特电子技术股份有限公司,0.7-1万/月,杭州,民营公司,1年经验,5,招3人,员工旅游 专业培训 绩效奖金 五险 餐饮补贴 通讯补贴,150-500人
2655,后端开发,软件工程师,系统实施工程师,深圳市玄羽科技有限公司,0.6-1万/月,异地招聘,民营公司,无需经验,5,招1人,五险一金 年终奖金 股票期权 员工旅游 弹性工作,50-150人
2656,后端开发,软件工程师,实施工程师,浙江慕链信息科技有限公司,5-7千/月,杭州-滨江区,民营公司,2年经验,6,招2人,五险一金 员工旅游,少于50人
2657,后端开发,软件工程师,需求分析师,江苏欣网通讯技术有限公司,1-1.5万/月,杭州-余杭区,民营公司,2年经验,6,招2人,五险一金 交通补贴 餐饮补贴 绩效奖金 年终奖金 定期体检 通讯补贴 专业培训,150-500人
2658,后端开发,软件工程师,Web前端开发工程师,杭州赫智电子科技有限公司,1.2-1.8万/月,杭州-滨江区,民营公司,1年经验,6,招2人,五险一金 绩效奖金 年终奖金 股票期权 餐饮补贴 出国机会,50-150人
2659,后端开发,软件工程师,软件实施工程师,浙江浙大中控信息技术有限公司,0.7-1.2万/月,杭州-滨江区,民营公司,2年经验,6,招2人,五险一金 员工旅游 交通补贴 餐饮补贴 年终奖金 定期体检,1000-5000人
2660,后端开发,软件工程师,实施工程师-可接受无经验,杭州多测师软件技术有限公司,0.8-1万/月,杭州-余杭区,民营公司,无需经验,5,招3人,五险一金 员工旅游 专业培训 弹性工作 定期体检 补充医疗保险 年终奖金 绩效奖金,少于50人
2661,后端开发,软件工程师,实施工程师-可接受无经验,杭州爱软测信息技术有限公司,0.8-1万/月,杭州-余杭区,外资（非欧美）,无需经验,5,招3人,,50-150人
2662,后端开发,软件工程师,MES软件产品经理,杭州物源科技有限公司,1.6-2.5万/月,杭州-拱墅区,民营公司,5-7年经验,5,招2人,五险一金 员工旅游 年终奖金 绩效奖金 股票期权 专业培训 定期体检 交通补贴 餐饮补贴 通讯补贴,50-150人
2663,后端开发,软件工程师,IT FREELANCER(自由职业者),中山华定科技有限公司,1.7-3.5万/月,异地招聘,外资（欧美）,3-4年经验,,招若干人,,50-150人
2664,后端开发,软件工程师,前端开发工程师,智慧职安环保科技有限公司,0.5-1万/月,杭州-江干区,民营公司,1年经验,6,招2人,五险一金 员工旅游 定期体检 专业培训 年终奖金 周末双休,少于50人
2665,后端开发,软件工程师,软件实施工程师,杭州点博人力资源管理有限公司,1-2万/月,异地招聘,民营公司,2年经验,6,招5人,专业培训 员工旅游 定期团建 五险一金 弹性工作 绩效奖金,50-150人
2666,后端开发,软件工程师,需求分析师,远光软件股份有限公司,1.5-2万/月,杭州-西湖区,上市公司,3-4年经验,6,招1人,定期体检 年终奖金 绩效奖金 股票期权 三餐免费 员工宿舍 五险一金 专业培训 补充医疗保险,1000-5000人
2667,后端开发,软件工程师,软件测试工程师（3年工作经验）,上海睿民互联网科技有限公司,0.8-1.3万/月,杭州-拱墅区,民营公司,3-4年经验,6,招2人,五险一金 补充医疗保险 定期体检 晋升空间 补贴,500-1000人
2668,后端开发,软件工程师,软件测试,紫光云数科技有限公司,0.8-1.1万/月,杭州-滨江区,国企,1年经验,6,招5人,带薪年假 绩效奖金 节日福利 加班补贴 五险一金 交通补贴 餐饮补贴 通讯补贴 股票期权,1000-5000人
2669,后端开发,软件工程师,自动化控制工程师/技术员,杭州威立雅科技有限公司,0.6-1.5万/月,杭州-萧山区,民营公司,1年经验,5,招8人,员工旅游 通讯补贴 专业培训 绩效奖金 弹性工作 餐饮补贴 年终奖金 五险一金,50-150人
2670,后端开发,软件工程师,ERP实施工程师,杭州盛格软控机电有限公司,4.5-6千/月,杭州-滨江区,民营公司,2年经验,5,招5人,,50-150人
2671,后端开发,软件工程师,实施工程师,杭州慧胜科技有限公司,0.6-1万/月,杭州-滨江区,民营公司,3-4年经验,5,招2人,,50-150人
2672,后端开发,软件工程师,Web前端开发工程师,杭州鲁尔物联科技有限公司,0.8-1.5万/月,杭州-余杭区,创业公司,3-4年经验,6,招3人,绩效奖金 年终奖金 弹性工作 五险 生日福利,150-500人
2673,后端开发,软件工程师,自动驾驶仿真场景开发工程师,浙江天行健智能科技有限公司,16-40万/年,异地招聘,合资,无需经验,7,招若干人,五险一金 补充医疗保险 补充公积金 员工旅游 专业培训 绩效奖金,50-150人
2674,后端开发,软件工程师,嵌入式测试工程师（C/C++）,南京百尔马智能技术有限公司,1.5-2万/月,杭州,民营公司,2年经验,5,招1人,,50-150人
2675,后端开发,软件工程师,实施项目经理,杭州塔网科技有限公司,1-1.5万/月,杭州-余杭区,民营公司,5-7年经验,6,招2人,,50-150人
2676,后端开发,软件工程师,前端开发工程师（SAAS+BI）,浙江远东工业开发有限公司,1.5-2万/月,杭州-萧山区,外资（非欧美）,3-4年经验,6,招1人,员工旅游 年终奖金 绩效奖金 周末双休 节日福利 五险一金 带薪年假 生日福利,50-150人
2677,后端开发,软件工程师,Web前端开发工程师,杭州翘歌网络科技有限公司,1-1.5万/月,杭州-余杭区,民营公司,1年经验,6,招1人,弹性工作 包住宿 绩效奖金 专业培训 节日福利 包吃,50-150人
2678,后端开发,软件工程师,商务经理,浙江万企动力科技有限公司,1-1.8万/月,杭州-江干区,民营公司,3-4年经验,6,招2人,年终奖金 绩效奖金 周末双休 五险一金,50-150人
2679,后端开发,软件工程师,软件实施工程师,江苏金智教育信息股份有限公司,0.8-1万/月,异地招聘,民营公司,3-4年经验,5,招2人,五险一金 补充医疗保险 免费班车 交通补贴 餐饮补贴 通讯补贴 专业培训 绩效奖金 年终奖金 弹性工作,1000-5000人
2680,后端开发,软件工程师,Web前端开发工程师,浙江壹企通科技发展有限公司,1.2-1.8万/月,杭州-余杭区,民营公司,3-4年经验,5,招若干人,交通补贴 餐饮补贴 五险 住房补贴,50-150人
2681,后端开发,软件工程师,中级前端开发工程师,杭州欧塬建筑设计有限公司,1-2万/月,杭州-下城区,民营公司,3-4年经验,6,招1人,五险一金 补充医疗保险 员工旅游 餐饮补贴 弹性工作 定期体检 绩效奖金,50-150人
2682,后端开发,软件工程师,实施工程师（重庆）,杭州孚立计算机软件有限公司,5-7千/月,异地招聘,民营公司,2年经验,5,招2人,,50-150人
2683,后端开发,软件工程师,软件实施工程师,浙江元翼科技有限公司,0.8-1万/月,杭州-西湖区,民营公司,1年经验,5,招2人,五险一金 生日福利 高温补贴 定期团建,少于50人
2684,后端开发,软件工程师,高级web开发工程师,新翔维创科技股份有限公司,1.2-2万/月,杭州,民营公司,5-7年经验,6,招2人,五险一金 餐饮补贴 通讯补贴 年终奖金 定期体检 专业培训 周末双休 法定节假,50-150人
2685,后端开发,软件工程师,实施工程师,大连信雅达软件有限公司,0.7-1.2万/月,杭州-滨江区,,2年经验,5,招1人,,150-500人
2686,后端开发,软件工程师,实施工程师,江苏宝和数据股份有限公司,6-8千/月,杭州,民营公司,1年经验,6,招1人,周末双休 五险一金 员工旅游 专业培训 年终奖金 弹性工作 定期体检 补充医疗保险 交通补贴,50-150人
2687,后端开发,软件工程师,实施工程师,四川中电启明星信息技术有限公司,0.8-1万/月,杭州-西湖区,国企,3-4年经验,6,招1人,五险一金 补充医疗保险 交通补贴 餐饮补贴 通讯补贴 专业培训 年终奖金,1000-5000人
2688,后端开发,软件工程师,量化策略研究员,天鸽互动控股有限公司,1-1.5万/月,杭州,外资（非欧美）,1年经验,6,招若干人,周末双休 五险一金 绩效奖金 节日福利 专业培训 餐饮补贴,500-1000人
2689,后端开发,软件工程师,实施工程师,杭州清普信息技术有限公司,5-7千/月,杭州-余杭区,民营公司,1年经验,5,招2人,,50-150人
2690,后端开发,软件工程师,前端工程师/Web前段/软件工程师,上海联积供应链管理有限公司杭州分公司,0.8-1.8万/月,杭州-江干区,民营公司,3-4年经验,5,招若干人,五险一金 员工旅游 餐饮补贴 绩效奖金 年终奖金 股票期权 弹性工作,50-150人
2691,后端开发,软件工程师,前端开发工程师,杭州立方控股股份有限公司,1-2万/月,杭州-西湖区,上市公司,3-4年经验,6,招2人,五险一金 员工旅游 绩效奖金 年终奖金,1000-5000人
2692,后端开发,软件工程师,云产品客户经理,浙江明源地产管理咨询有限公司,4.5-6千/月,杭州-西湖区,民营公司,1年经验,6,招若干人,五险一金 绩效奖金 专业培训 定期体检 员工旅游,50-150人
2693,后端开发,软件工程师,前端开发工程师,江苏人加信息科技有限公司,1.8-2.3万/月,杭州-滨江区,民营公司,3-4年经验,6,招1人,五险 专业培训 节日福利,150-500人
2694,后端开发,软件工程师,软件技术支持工程师,杭州展之信息技术有限公司,0.6-1万/月,杭州,民营公司,3-4年经验,5,招2人,餐饮补贴 年终奖金 股票期权 绩效奖金,少于50人
2695,后端开发,软件工程师,前端开发工程师,南京日冲软件股份有限公司,0.8-1.5万/月,杭州-滨江区,民营公司,3-4年经验,5,招3人,五险一金 绩效奖金 年终奖金 餐饮补贴,150-500人
2696,后端开发,软件工程师,实施工程师,金锐软件技术（杭州）有限公司,0.9-1.4万/月,杭州-滨江区,民营公司,3-4年经验,5,招1人,,
2697,后端开发,软件工程师,嵌入式硬件工程师,优控智能技术有限公司,20-30万/年,杭州-富阳区,民营公司,1年经验,5,招2人,通讯补贴 餐饮补贴 交通补贴 五险一金,少于50人
2698,后端开发,软件工程师,Web前端开发工程师,杭州沪马智能科技有限公司,6-8千/月,杭州-余杭区,民营公司,1年经验,6,招1人,员工旅游 社保 节日福利 带薪年假 周末双休,少于50人
2699,后端开发,软件工程师,客户成功经理-杭州,杭州有赞科技有限公司,0.6-1万/月,杭州-西湖区,上市公司,1年经验,5,招3人,餐饮补贴 通讯补贴 节日福利 定期体检,1000-5000人
2700,后端开发,软件工程师,大四实习生,上海银硕软件技术有限公司,4.5-6千/月,异地招聘,民营公司,在校生/应届生,6,招10人,五险一金 员工旅游 餐饮补贴 通讯补贴 年终奖金 绩效奖金 定期体检,50-150人
2701,后端开发,软件工程师,开发工程师,乐麦信息技术（杭州）有限公司,0.8-1.5万/月,杭州,合资,在校生/应届生,6,招30人,,
2702,后端开发,软件工程师,软件开发工程师（工作地点：西安）（杭州）,富士通（西安）系统工程有限公司,6-8千/月,杭州,外资（非欧美）,在校生/应届生,6,招50人,,
2703,后端开发,软件工程师,2021校园招聘-软件工程师,杭州乔戈里科技有限公司,11-19万/年,杭州,民营公司,在校生/应届生,6,招6人,股票期权 年终奖金 绩效奖金 五险一金 员工旅游 周末双休 节日福利,50-150人
2704,后端开发,软件工程师,.net开发工程师（初级）,杭州承前医数科技有限公司,0.5-1.1万/月,杭州-滨江区,民营公司,在校生/应届生,5,招10人,五险一金 餐饮补贴 年终奖金 周末双休,少于50人
2705,后端开发,软件工程师,软件研发方向,中移（杭州）信息技术有限公司,1-1.5万/月,杭州,国企,在校生/应届生,7,招若干人,,
2706,后端开发,软件工程师,科学计算开发工程师（杭州）,苏州同元软控信息技术有限公司,0.8-1万/月,杭州,民营公司,在校生/应届生,6,招2人,,
2707,后端开发,软件工程师,C++开发工程师,杭州长荣通讯技术有限公司,1-2万/月,杭州,外资（欧美）,在校生/应届生,6,招5人,五险,50-150人
2708,后端开发,软件工程师,.NET 开发工程师,杭州智语网络科技有限公司,7-9千/月,杭州-西湖区,民营公司,在校生/应届生,6,招2人,做五休二 周末双休 带薪年假 加班补贴 节日福利 餐饮补贴 五险一金,50-150人
2709,后端开发,软件工程师,软件开发实习生,杭州众焱科技有限公司,2-6千/月,杭州-江干区,民营公司,在校生/应届生,5,招若干人,五险一金 全勤奖 高温补贴 节日福利,少于50人
2710,后端开发,软件工程师,海外业务软件工程师（2021届）,上海海隆信技软件有限公司杭州分公司,9-13万/年,杭州-西湖区,民营公司,在校生/应届生,6,招若干人,五险一金 员工旅游 交通补贴 餐饮补贴 专业培训 出国机会 绩效奖金 年终奖金 定期体检,
2711,后端开发,软件工程师,软件设计工程师,金华济胜软件有限公司,0.8-1万/月,异地招聘,民营公司,在校生/应届生,6,招若干人,,少于50人
2712,后端开发,软件工程师,Java开发工程师（校招，南昌）,深圳市蓝凌软件股份有限公司,7-9千/月,异地招聘,上市公司,在校生/应届生,6,招若干人,年终奖金 弹性工作 五险一金 绩效奖金 专业培训 定期体检 人才公寓 餐饮补贴,1000-5000人
2713,后端开发,软件工程师,研发工程师（C开发）,杭州思福迪信息技术有限公司,0.7-1.5万/月,杭州,民营公司,在校生/应届生,6,招6人,五险一金 弹性工作 专业培训 绩效奖金 年终奖金,50-150人
2714,后端开发,软件工程师,java 软件开发工程师,立信汇文企业服务（上海）有限公司,0.6-1.2万/月,杭州-西湖区,合资,在校生/应届生,5,招3人,五险一金 专业培训 绩效奖金,50-150人
2715,后端开发,软件工程师,gis开发工程师,浙江禹贡信息科技有限公司,0.6-1万/月,杭州-滨江区,民营公司,在校生/应届生,6,招3人,五险一金 年终奖金 交通补贴 通讯补贴 绩效奖金,50-150人
2716,后端开发,软件工程师,Java初级开发工程师,北京极客通慧科技有限公司,0.8-1万/月,异地招聘,民营公司,在校生/应届生,5,招5人,五险一金 补充医疗保险 交通补贴 餐饮补贴 年终奖金 绩效奖金 弹性工作 定期体检 出国机会 员工旅游,50-150人
2717,后端开发,软件工程师,软件工程师,北京蓝鼎世纪科技有限公司,5-8千/月,异地招聘,民营公司,在校生/应届生,6,招若干人,五险一金 餐饮补贴 年终奖金 解决住宿,少于50人
2718,后端开发,软件工程师,软件开发实习生,杭州焱雷网络科技有限公司,150元/天,杭州-余杭区,民营公司,在校生/应届生,6,招若干人,,150-500人
2719,后端开发,软件工程师,软件技术及平台研发岗（杭州）,中冶赛迪重庆信息技术有限公司,1-1.5万/月,杭州,国企,在校生/应届生,6,招若干人,,500-1000人
2720,后端开发,软件工程师,后端开发实习生,尼禄（杭州）软件有限公司,150元/天,杭州-西湖区,外资（欧美）,在校生/应届生,6,招若干人,弹性工作 茶水畅饮 周末双休,少于50人
2721,后端开发,软件工程师,C/C++开发工程师,杭州旭仁自动化有限公司,0.7-1万/月,杭州-江干区,民营公司,在校生/应届生,5,招2人,,50-150人
2722,后端开发,软件工程师,网络安全实习生,杭州极晨科技有限公司,3-5千/月,杭州-滨江区,民营公司,在校生/应届生,5,招10人,,少于50人
2723,后端开发,软件工程师,软件工程师,杭州天软科技有限公司,6-8千/月,杭州-滨江区,民营公司,在校生/应届生,5,招1人,五险一金 餐饮补贴 绩效奖金 年终奖金 节日福利 生日礼券 全勤奖 带薪年假 双休8小时 员工旅游,少于50人
2724,后端开发,软件工程师,全栈工程师（南苑地铁口）,杭州伯俊软件科技有限公司,6-8千/月,杭州-余杭区,民营公司,在校生/应届生,5,招2人,周末双休 带薪年假 五险一金 节日福利 专业培训 绩效奖金 年终奖金 定期团建,50-150人
2725,后端开发,软件工程师,逆向开发工程师（应届实习生）,杭州觉醒互娱网络科技有限公司,5-6千/月,杭州-西湖区,民营公司,在校生/应届生,5,招2人,,
2726,后端开发,软件工程师,软件开发实习生,上海占域实业有限公司,6-8千/月,杭州,合资,在校生/应届生,5,招若干人,五险一金 员工旅游 绩效奖金 年终奖金 定期体检,150-500人
2727,后端开发,软件工程师,C++开发工程师,杭州晨鹰军泰科技有限公司,0.7-1万/月,杭州-西湖区,民营公司,在校生/应届生,6,招1人,餐饮补贴 年终奖金 定期体检 五险一金 交通补贴 绩效奖金 股票期权,150-500人
2728,后端开发,软件工程师,软件工程师,杭州傲润科技有限公司,0.5-2.5万/月,杭州-江干区,民营公司,在校生/应届生,6,招3人,,50-150人
2729,后端开发,软件工程师,实施项目经理实习生-杭州,酷家乐,4-5千/月,杭州-拱墅区,民营公司,在校生/应届生,6,招10人,周末双休 弹性工作 餐饮补贴,1000-5000人
2730,后端开发,软件工程师,软件实施工程师,杭州富丰信息技术有限公司,0.5-1.5万/月,杭州-西湖区,民营公司,在校生/应届生,6,招10人,全勤奖 专业培训 绩效奖金 五险一金 员工旅游 年终奖金,少于50人
2731,后端开发,软件工程师,后端开发工程师（衢州）,东南数字经济发展研究院,1.5-2千/月,异地招聘,事业单位,无需经验,6,招6人,绩效奖金 年终奖金 五险一金 出国机会 定期体检 餐饮补贴 员工旅游 专业培训 弹性工作,50-150人
2732,后端开发,软件工程师,嵌入式软件工程师（视频业务方向）,杭州国芯科技股份有限公司,1.5千以下/月,杭州,民营公司,3-4年经验,6,招若干人,五险一金 补充医疗保险 员工旅游 专业培训 绩效奖金 年终奖金 股票期权 弹性工作 定期体检 餐饮补贴,150-500人
2733,后端开发,软件工程师,系统软件工程师/驱动工程师,聚融医疗科技（杭州）有限公司,1-2万/月,杭州-临安区,民营公司,2年经验,6,招若干人,五险一金 弹性工作 定期体检 股票期权 晋升空间 带薪年假,50-150人
2734,后端开发,软件工程师,软件工程师 （硬件控制方向）,广东欧浮瑞企业管理咨询有限公司,3-5万/月,杭州-滨江区,民营公司,3-4年经验,6,招3人,五险一金 年终奖金 定期体检 补充医疗保险 绩效奖金 交通补贴 餐饮补贴 通讯补贴 季度奖金 出国机会,50-150人
2735,后端开发,软件工程师,软件开发工程师（实习生）,杭州筑峰科技有限公司,2-4千/月,杭州-滨江区,创业公司,在校生/应届生,6,招3人,五险一金 员工旅游 年终奖金 绩效奖金 节日福利 带薪年假,少于50人
2736,后端开发,软件工程师,Java软件工程师,杭州溥博泰道科技有限公司,0.8-2万/月,杭州-滨江区,合资,2年经验,6,招若干人,,50-150人
2737,后端开发,软件工程师,ETL开发工程师,杭州驿德科技有限公司,0.8-1.5万/月,杭州-萧山区,民营公司,2年经验,6,招3人,五险一金 年终奖金,少于50人
2738,后端开发,软件工程师,UNIX C工程师（杭州）,上海思群软件有限公司,1.2-1.5万/月,杭州-上城区,民营公司,1年经验,,招8人,五险一金 绩效奖金 补充医疗保险 定期体检 餐饮补贴,50-150人
2739,后端开发,软件工程师,C++软件工程师,杭州开源电脑技术有限公司,0.8-1.5万/月,杭州-滨江区,民营公司,1年经验,6,招5人,五险一金 餐饮补贴 弹性工作 定期体检 年终奖金 绩效奖金 专业培训 交通补贴,150-500人
2740,后端开发,软件工程师,VC++软件开发工程师,浙江莱达信息技术有限公司,1-1.5万/月,杭州-西湖区,民营公司,2年经验,6,招3人,五险一金 员工旅游 餐饮补贴 定期体检 年终奖金,50-150人
2741,后端开发,软件工程师,Java高级开发工程师,杭州平航科技有限公司,1.6-2万/月,杭州-滨江区,民营公司,3-4年经验,6,招若干人,五险一金 专业培训 绩效奖金 年终奖金 定期体检,50-150人
2742,后端开发,软件工程师,.NET中级工程师,杭州云树网络科技有限公司,1.4-1.8万/月,杭州-滨江区,民营公司,5-7年经验,6,招1人,五险一金 餐饮补贴 员工旅游 周末双休,500-1000人
2743,后端开发,软件工程师,Java开发工程师,杭州思伟科技股份有限公司,0.8-1.2万/月,杭州,民营公司,2年经验,5,招1人,五险一金 员工旅游 餐饮补贴 通讯补贴 年终奖金 定期体检 股票期权,50-150人
2744,后端开发,软件工程师,.NET软件工程师,杭州平航科技有限公司,0.8-1.2万/月,杭州-滨江区,民营公司,2年经验,6,招若干人,五险一金 年终奖金 员工聚餐 绩效奖金,50-150人
2745,后端开发,软件工程师,C++ 软件开发工程师,杭州平航科技有限公司,0.8-1.5万/月,杭州-滨江区,民营公司,2年经验,6,招若干人,五险一金 年终奖金 绩效奖金,50-150人
2746,后端开发,软件工程师,Unity3D开发工程师（虚拟偶像直播方向）-朝夕光年,字节跳动,2.5-5万/月,杭州,民营公司,3-4年经验,6,招2人,股票期权 免费三餐 团队氛围好 下午茶 租房补贴 六险一金,10000人以上
2747,后端开发,软件工程师,Unity3D开发工程师（虚拟偶像直播方向）-朝夕光年,字节跳动,2.5-5万/月,杭州,民营公司,3-4年经验,6,招2人,股票期权 免费三餐 团队氛围好 下午茶 租房补贴 六险一金,10000人以上
2748,后端开发,软件工程师,Unity3D开发工程师（虚拟偶像直播方向）-朝夕光年,字节跳动,2.5-5万/月,杭州,民营公司,3-4年经验,6,招2人,股票期权 免费三餐 团队氛围好 下午茶 租房补贴 六险一金,10000人以上
2749,后端开发,软件工程师,Unity3D开发工程师（虚拟偶像直播方向）-朝夕光年,字节跳动,2.5-5万/月,杭州,民营公司,3-4年经验,6,招2人,股票期权 免费三餐 团队氛围好 下午茶 租房补贴 六险一金,10000人以上
2750,后端开发,软件工程师,Unity3D开发工程师（虚拟偶像直播方向）-朝夕光年,字节跳动,2.5-5万/月,杭州,民营公司,3-4年经验,6,招2人,股票期权 免费三餐 团队氛围好 下午茶 租房补贴 六险一金,10000人以上
2751,后端开发,软件工程师,Unity3D开发工程师（虚拟偶像直播方向）-朝夕光年,字节跳动,2.5-5万/月,杭州,民营公司,3-4年经验,6,招2人,股票期权 免费三餐 团队氛围好 下午茶 租房补贴 六险一金,10000人以上
2752,后端开发,软件工程师,C#工程师,杭州真鹏科技有限公司,1.8-2.5万/月,杭州-余杭区,民营公司,2年经验,6,招3人,五险一金 绩效奖金 年终奖金 出国机会 员工旅游,少于50人
2753,后端开发,软件工程师,C#工程师,杭州真鹏科技有限公司,1-2万/月,杭州-余杭区,民营公司,2年经验,6,招3人,五险一金 绩效奖金 年终奖金 出国机会 员工旅游,少于50人
2754,后端开发,软件工程师,C++软件开发工程师,杭州维科软件工程有限责任公司,0.8-1.5万/月,杭州-余杭区,合资,大专,5,招2人,五险一金 员工宿舍 周末双休 法定节假日 带薪年假 培训补助 出国工作机会 员工旅游 绩效奖金 年度体检,50-150人
2755,后端开发,软件工程师,C#/.NET软件开发工程师,杭州维科软件工程有限责任公司,0.8-1.5万/月,杭州-余杭区,合资,无需经验,5,招5人,五险一金 员工宿舍 周末双休 法定节假日 带薪年假 培训补助 出国工作机会 员工旅游 绩效奖金 年度体检,50-150人
2756,后端开发,软件工程师,资深音频算法工程师,字节跳动,3-5万/月,杭州,民营公司,3-4年经验,6,招5人,下午茶 健身瑜伽 五险一金 团队氛围好 晋升空间大 带薪休假 扁平管理 大牛带队 餐补 免费三餐,10000人以上
