,big_category,small_category,job_name,company_name,salary,work_area,company_type,work_year,education,recruitment_scale,welfare,company_size
1710,后端开发,多媒体开发工程师,高级交互工程师-技术工具方向,字节跳动,3-6万/月,杭州,民营公司,3-4年经验,6,招5人,下午茶 健身瑜伽 六险一金 团队氛围好 晋升空间大 带薪休假 扁平管理 用户过亿 大牛带队 餐补,10000人以上
1711,后端开发,多媒体开发工程师,特效图像算法工程师-抖音,字节跳动,2.5-6万/月,杭州,民营公司,无需经验,6,招5人,下午茶 带薪休假 用户过亿 大牛带队 免费三餐 弹性工作 租房补贴,10000人以上
1712,后端开发,多媒体开发工程师,AR/3D应用工程师-抖音,字节跳动,2.5-6万/月,杭州,民营公司,无需经验,6,招5人,下午茶 带薪休假 用户过亿 大牛带队 免费三餐 弹性工作 租房补贴,10000人以上
1713,后端开发,多媒体开发工程师,Android音视频研发工程师,字节跳动,3-6万/月,杭州,民营公司,3-4年经验,6,招5人,弹性工作 租房补贴 扁平管理 用户过亿 大牛带队 团队氛围好,10000人以上
1714,后端开发,多媒体开发工程师,Android音视频初级研发工程师-互娱研发,字节跳动,2-4万/月,杭州,民营公司,3-4年经验,6,招5人,弹性工作 租房补贴 扁平管理 用户过亿 大牛带队 团队氛围好,10000人以上
1715,后端开发,多媒体开发工程师,iOS音视频初级研发工程师-互娱研发,字节跳动,2-4万/月,杭州,民营公司,3-4年经验,6,招5人,弹性工作 租房补贴 扁平管理 用户过亿 大牛带队 团队氛围好,10000人以上
1716,后端开发,多媒体开发工程师,iOS音视频研发工程师,字节跳动,3-6万/月,杭州,民营公司,5-7年经验,6,招5人,弹性工作 租房补贴 扁平管理 用户过亿 大牛带队 团队氛围好,10000人以上
1717,后端开发,多媒体开发工程师,Camera算法集成工程师（AI方向）,字节跳动,3-6万/月,杭州,民营公司,3-4年经验,7,招5人,六险一金 弹性工作 免费三餐 租房补贴 带薪休假 下午茶 扁平管理 健身瑜伽 用户过亿 大牛带队,10000人以上
1718,后端开发,多媒体开发工程师,高级游戏引擎工程师,字节跳动,3-6万/月,杭州,民营公司,3-4年经验,6,招5人,用户过亿 扁平管理 股票期权 弹性工作 免费三餐,10000人以上
1719,后端开发,多媒体开发工程师,3D编辑器开发工程师 — 抖音短视频,字节跳动,3-6万/月,杭州,民营公司,3-4年经验,6,招5人,用户过亿 股票期权 弹性工作 大牛带队 租房补贴,10000人以上
1720,后端开发,多媒体开发工程师,多媒体iOS平台研发工程师,字节跳动,2.5-5万/月,杭州,民营公司,3-4年经验,6,招5人,弹性工作 租房补贴 扁平管理 用户过亿 大牛带队 团队氛围好,10000人以上
1721,后端开发,多媒体开发工程师,多媒体Android平台研发工程师-互娱研发,字节跳动,2-4万/月,杭州,民营公司,3-4年经验,6,招5人,弹性工作 租房补贴 扁平管理 用户过亿 大牛带队 团队氛围好,10000人以上
1722,后端开发,多媒体开发工程师,高级图像算法研发工程师 — 视频增强方向,字节跳动,3.5-7万/月,杭州,民营公司,3-4年经验,6,招5人,六险一金 股票期权 免费三餐 租房补贴 扁平管理 用户过亿 大牛带队 团队氛围好,10000人以上
1723,后端开发,多媒体开发工程师,渲染引擎高级开发工程师,字节跳动,3-6万/月,杭州,民营公司,3-4年经验,6,招5人,六险一金 高薪期权 弹性工作 免费三餐 租房补贴 带薪休假 扁平管理 过亿用户 职业大牛 团队氛围好,10000人以上
1724,后端开发,多媒体开发工程师,VR开发工程师,杭州心景科技有限公司,10-18万/年,杭州-滨江区,民营公司,2年经验,6,招2人,五险一金 交通补贴 通讯补贴 专业培训 绩效奖金 年终奖金 员工旅游 餐饮补贴,50-150人
1725,后端开发,多媒体开发工程师,视频算法工程师（2021届校园招聘）,深圳市潮流网络技术有限公司杭州分公司,1.2-1.6万/月,杭州-西湖区,民营公司,在校生/应届生,7,招3人,五险一金 补充医疗保险 员工旅游 餐饮补贴 年终奖金 定期体检 出国机会,150-500人
1726,后端开发,GIS工程师,GIS开发工程师,杭州智诚惠通科技有限公司,0.8-1.2万/月,杭州,民营公司,1年经验,6,招1人,五险一金 餐饮补贴 定期体检 通讯补贴 交通补贴 年终奖金 员工旅游,50-150人
1727,后端开发,GIS工程师,GIS专家,城云科技（中国）有限公司,1.8-2.8万/月,杭州,外资（欧美）,8-9年经验,6,招1人,周末双休 带薪年假 五险一金 免费班车 节日福利 交通补贴 通讯补贴,150-500人
1728,后端开发,GIS工程师,GIS前端开发工程师,杭州荣膺科技有限公司,1-1.5万/月,杭州-下城区,创业公司,2年经验,5,招若干人,员工旅游 绩效奖金 弹性工作 专业培训 缴纳五险,50-150人
1729,后端开发,GIS工程师,GIS开发工程师,悉望数智科技（杭州）有限公司,1.5-2.5万/月,杭州-余杭区,民营公司,3-4年经验,6,招2人,五险一金 员工旅游 专业培训 交通补贴 餐饮补贴 年终奖金 股票期权 定期体检 孝心金,少于50人
1730,后端开发,GIS工程师,地图数据处理工程师,杭州九州方园科技有限公司,0.7-1.4万/月,杭州-萧山区,民营公司,1年经验,5,招若干人,五险一金 专业培训 出国机会 员工旅游,50-150人
1731,后端开发,GIS工程师,3D gis研发工程师,浙江科澜信息技术有限公司,0.8-1.2万/月,杭州-滨江区,民营公司,在校生/应届生,7,招2人,,150-500人
1732,后端开发,GIS工程师,GIS开发工程师,武汉佰钧成技术有限责任公司,1.5千以下/月,杭州-余杭区,民营公司,2年经验,6,招3人,五险一金 免费班车 员工旅游 专业培训 通讯补贴 出国机会 绩效奖金 定期体检,10000人以上
1733,后端开发,全栈工程师,信息化开发工程师（研发中心）,浙江浙大中控信息技术有限公司,1-2万/月,杭州-滨江区,民营公司,3-4年经验,6,招1人,五险一金 员工旅游 交通补贴 餐饮补贴 年终奖金 定期体检,1000-5000人
1734,后端开发,全栈工程师,全栈工程师,杭州未景科技有限公司,0.8-1.5万/月,杭州-西湖区,民营公司,1年经验,6,招2人,节日福利 专业培训 带薪年假 绩效奖金,少于50人
1735,后端开发,全栈工程师,Node.js开发工程师,杭州大赏网络科技有限公司,1-1.5万/月,杭州-余杭区,外资（非欧美）,3-4年经验,5,招1人,五险一金 年终奖金 弹性工作,50-150人
1736,后端开发,全栈工程师,Node.js全栈工程师-远程办公,共识基石科技（北京）有限公司,2-3万/月,异地招聘,外资（欧美）,3-4年经验,5,招6人,五险一金 补充医疗保险 年终奖金 绩效奖金 弹性工作 定期体检 员工旅游 专业培训 节日福利 远程办公,少于50人
1737,后端开发,全栈工程师,C#高级开发工程师,杭州优时软件有限公司,1.5-2.5万/月,杭州,民营公司,在校生/应届生,6,招3人,五险一金 员工旅游 餐饮补贴 年终奖金 出国机会 周末双休 带薪年假 节日福利 高温补贴,150-500人
1738,后端开发,全栈工程师,全栈工程师,杭州未景科技有限公司,0.8-1万/月,杭州-西湖区,民营公司,2年经验,6,招2人,节日福利 专业培训 带薪年假 绩效奖金,少于50人
1739,后端开发,全栈工程师,全栈工程师,杭州未景科技有限公司,0.8-1.5万/月,杭州-西湖区,民营公司,1年经验,6,招若干人,节日福利 专业培训 带薪年假 绩效奖金,少于50人
1740,后端开发,全栈工程师,Java高级开发工程师,杭州优时软件有限公司,1.5-2.5万/月,杭州,民营公司,在校生/应届生,6,招3人,五险一金 员工旅游 餐饮补贴 年终奖金 出国机会 周末双休 带薪年假 节日福利 高温补贴,150-500人
1741,后端开发,ERP技术开发,C#软件工程师,杭州开源电脑技术有限公司,0.5-1.3万/月,杭州-滨江区,民营公司,2年经验,6,招若干人,五险一金 餐饮补贴 交通补贴 年终奖金 绩效奖金 定期体检 弹性工作 专业培训,150-500人
1742,后端开发,ERP技术开发,NET软件开发,杭州优思亘信息技术有限公司,4.5-7.5千/月,杭州-江干区,民营公司,2年经验,5,招2人,,少于50人
1743,后端开发,ERP技术开发,二次开发工程师,金蝶软件（中国）有限公司杭州分公司,10-15万/年,杭州-拱墅区,上市公司,2年经验,6,招2人,五险一金 补充医疗保险 员工旅游 交通补贴 通讯补贴 专业培训 绩效奖金 年终奖金 定期体检,50-150人
1744,后端开发,ERP技术开发,.NET中级开发工程师,杭州达罗尼科技有限公司,0.8-1.5万/月,杭州-江干区,民营公司,2年经验,6,招1人,员工旅游 绩效奖金 年终奖金 五险 专业培训 股票期权,50-150人
1745,后端开发,ERP技术开发,Java开发工程师,浙江用友软件有限公司,0.8-1万/月,杭州,上市公司,3-4年经验,6,招2人,五险一金 绩效奖金 专业培训 定期体检 员工旅游,150-500人
1746,后端开发,ERP技术开发,ERP工程师,浙江中力机械股份有限公司,1-1.5万/月,杭州-下城区,民营公司,2年经验,6,招1人,五险一金 免费班车 年终奖金 专业培训 员工旅游 免费食宿,
1747,后端开发,ERP技术开发,(H)对日abap开发工程师,杭州优灿科技有限公司,1-2.5万/月,杭州-滨江区,合资,招10人,,招10人,,500-1000人
1748,后端开发,ERP技术开发,SAP FICO顾问,杭州诚品科技有限公司,0.7-1.4万/月,杭州-滨江区,民营公司,3-4年经验,6,招2人,五险一金 年终奖金 专业培训,50-150人
1749,后端开发,ERP技术开发,开发工程师,杭州优海信息系统有限公司,0.8-1.5万/月,杭州-滨江区,民营公司,3-4年经验,6,招1人,,150-500人
1750,后端开发,ERP技术开发,SAP高级顾问,武汉匠芯网络科技有限公司,2.5-3.5万/月,异地招聘,民营公司,8-9年经验,,招5人,五险一金 补充医疗保险 交通补贴 餐饮补贴 通讯补贴 专业培训 年终奖金 弹性工作,50-150人
1751,后端开发,ERP技术开发,Java开发工程师(web前端开发）,杭州比吉软件有限公司,0.6-1.5万/月,杭州-江干区,民营公司,2年经验,5,招2人,通讯补贴 餐饮补贴 年终奖金 绩效奖金 出国机会 员工旅游 交通补贴,50-150人
1752,后端开发,ERP技术开发,JAVA高级软件工程师,杭州普源软件有限公司,12-30万/年,杭州-西湖区,民营公司,5-7年经验,6,招若干人,五险一金 定期体检 员工旅游 餐饮补贴 年终奖金 绩效奖金,少于50人
1753,后端开发,ERP技术开发,.NET开发工程师,杭州选哲科技有限公司,1-1.5万/月,杭州-西湖区,民营公司,3-4年经验,6,招3人,五险一金 员工旅游 交通补贴 通讯补贴 绩效奖金 弹性工作 定期体检,50-150人
1754,后端开发,ERP技术开发,.NET高级开发工程师,杭州集控科技有限公司,1.4-2万/月,杭州-余杭区,民营公司,5-7年经验,5,招2人,五险一金 交通补贴 餐饮补贴 通讯补贴 专业培训 周末双休,少于50人
1755,后端开发,ERP技术开发,Java中级开发工程师,杭州笛佛软件有限公司,1.4-2.5万/月,杭州-西湖区,民营公司,3-4年经验,6,招5人,五险一金 补充商业险 交通补贴 餐饮补贴 年终奖金 股票期权 员工旅游 定期体检 节日生日福利 带薪年假,500-1000人
1756,后端开发,ERP技术开发,MES实施主管/经理,蒲惠智造科技有限公司,2-3.5万/月,杭州-江干区,创业公司,8-9年经验,5,招若干人,五险一金 交通补贴 绩效奖金 项目提成 外出补贴 住房补贴 全勤奖 带薪年假 弹性工作 员工旅游,150-500人
1757,后端开发,ERP技术开发,MES高级软件开发工程师,杭州塔网科技有限公司,2-2.5万/月,杭州-余杭区,民营公司,2年经验,6,招3人,五险一金 弹性工作 股票期权,50-150人
1758,后端开发,ERP技术开发,ERP系统支持工程师（原东芝信息）,玳能科技（杭州）有限公司,0.6-1.2万/月,杭州,外资（非欧美）,3-4年经验,6,招1人,五险一金 免费班车 员工旅游 专业培训 年终奖金 定期体检 节日福利 加班补贴 免费工作餐 做五休二,1000-5000人
1759,后端开发,ERP技术开发,数据库开发工程师,杭州硕德软件有限公司,0.5-1万/月,杭州,民营公司,1年经验,6,招6人,五险一金 绩效奖金 员工旅游 餐饮补贴 专业培训 弹性工作 年终奖金,少于50人
1760,后端开发,ERP技术开发,ABAP开发工程师,上海舟恩信息技术有限公司,0.8-1.1万/月,杭州,民营公司,3-4年经验,5,招1人,五险一金 员工旅游 绩效奖金 商业保险,150-500人
1761,后端开发,ERP技术开发,Siebel开发,杭州策软科技有限公司,1.5-2.6万/月,杭州-滨江区,合资,3-4年经验,5,招1人,餐饮补贴 五险一金 年终奖金 节假日福利 高温补贴 加班补贴,1000-5000人
1762,后端开发,ERP技术开发,ABAP开发工程师,杭州续创科技有限公司,1-1.5万/月,杭州-西湖区,民营公司,3-4年经验,5,招3人,,50-150人
1763,后端开发,ERP技术开发,实施工程师-杭州（企金业务线）,浙江保融科技股份有限公司,0.6-1万/月,杭州-余杭区,民营公司,3-4年经验,6,招6人,五险一金 餐饮补贴 交通补贴 通讯补贴 绩效奖金,500-1000人
1764,后端开发,ERP技术开发,ERP实施顾问,杭州晨科软件技术有限公司,0.8-2万/月,杭州-西湖区,民营公司,5-7年经验,6,招2人,五险一金 交通补贴 通讯补贴 绩效奖金 专业培训,50-150人
1765,后端开发,ERP技术开发,技术顾问(J11416),上海汉得信息技术股份有限公司,0.8-1万/月,异地招聘,上市公司,1年经验,5,招6人,五险一金 补充医疗保险 员工旅游 专业培训 年终奖金 弹性工作 餐饮补贴 定期体检,10000人以上
1766,后端开发,ERP技术开发,ERP实施工程师,上海海鼎信息工程股份有限公司,0.8-1万/月,杭州-江干区,民营公司,本科,6,招若干人,五险一金 定期体检 年终奖金 餐饮补贴 补充公积金 绩效奖金,500-1000人
1767,后端开发,ERP技术开发,客户化二次开发项目经理,北京致远互联软件股份有限公司,10-15万/年,杭州-滨江区,上市公司,2年经验,6,招1人,五险一金 补充医疗保险 交通补贴 餐饮补贴 通讯补贴 专业培训 绩效奖金 年终奖金,1000-5000人
1768,后端开发,ERP技术开发,ERP&C#开发工程师,佛山市南海天富科技有限公司,0.6-1.5万/月,杭州-滨江区,民营公司,在校生/应届生,5,招10人,员工旅游 交通补贴 绩效奖金 年终奖金 专业培训 五险,150-500人
1769,后端开发,ERP技术开发,程序员,杭州瑞阁微科技有限公司,0.5-1万/月,杭州-江干区,创业公司,在校生/应届生,5,招若干人,五险一金 员工旅游 年终奖金 绩效奖金,少于50人
1770,后端开发,ERP技术开发,开发实习生,北京致远互联软件股份有限公司,2-3千/月,杭州,上市公司,在校生/应届生,6,招3人,,
1771,后端开发,ERP技术开发,后端开发工程师（校招，广州）,深圳市蓝凌软件股份有限公司,0.8-1万/月,异地招聘,上市公司,在校生/应届生,6,招若干人,年终奖金 弹性工作 五险一金 绩效奖金 专业培训 定期体检 人才公寓 餐饮补贴,1000-5000人
1772,后端开发,ERP技术开发,Java开发工程师,杭州开源电脑技术有限公司,0.5-1.5万/月,杭州-滨江区,民营公司,2年经验,6,招若干人,五险一金 餐饮补贴 定期体检 通讯补贴 年终奖金 交通补贴,150-500人
1773,后端开发,ERP技术开发,电力相关业务abap开发人员（sap）,杭州优灿科技有限公司,1-1.5万/月,杭州,合资,招若干人,,招若干人,五险一金 年终奖金,500-1000人
1774,后端开发,ERP技术开发,对日ABAP开发工程师,杭州优灿科技有限公司,1.5-2万/月,杭州,合资,3-4年经验,5,招20人,五险一金 年终奖金,500-1000人
1775,后端开发,ERP技术开发,SAP实施顾问（SD MM FICO PP SAP）,杭州优灿科技有限公司,2-3万/月,杭州,合资,大专,5,招3人,五险一金 年终奖金,500-1000人
1776,后端开发,ERP技术开发,SAP ABAP顾问,杭州诚品科技有限公司,1-1.5万/月,杭州-滨江区,民营公司,5-7年经验,6,招2人,五险一金 餐饮补贴 通讯补贴 年终奖金,50-150人
1777,后端开发,ERP技术开发,.NET研发工程师,杭州集控科技有限公司,0.7-1.3万/月,杭州-余杭区,民营公司,3-4年经验,5,招2人,五险一金 交通补贴 餐饮补贴 通讯补贴 专业培训 周末双休,少于50人
1778,后端开发,ERP技术开发,ABAP开发工程师,上海舟恩信息技术有限公司,1-1.1万/月,杭州,民营公司,1年经验,5,招若干人,五险一金 餐饮补贴 年终奖金 带薪年假 周末双休 节日福利,150-500人
1779,后端开发,ERP技术开发,客户化开发项目经理,金蝶软件（中国）有限公司杭州分公司,1.5-3万/月,杭州-拱墅区,上市公司,8-9年经验,6,招若干人,五险一金 补充医疗保险 员工旅游 交通补贴 通讯补贴 专业培训 绩效奖金 年终奖金 定期体检,50-150人
1780,后端开发,ERP技术开发,ERP实施工程师,杭州优海信息系统有限公司,5-9千/月,杭州-滨江区,民营公司,1年经验,5,招1人,,150-500人
1781,后端开发,ERP技术开发,高级软件工程师(delphi),杭州普源软件有限公司,1.5-2万/月,杭州-西湖区,民营公司,在校生/应届生,6,招若干人,,少于50人
1782,后端开发,区块链开发,java开发工程师,武汉佰钧成技术有限责任公司,2-2.5万/月,杭州-余杭区,民营公司,3-4年经验,6,招1人,五险一金 补充医疗保险 员工旅游 定期体检 带薪年假,10000人以上
1783,后端开发,区块链开发,区块链go开发工程师-平台,恒生电子股份有限公司,1.5-2.5万/月,杭州-滨江区,民营公司,3-4年经验,6,招1人,,5000-10000人
1784,后端开发,区块链开发,架构师,杭州沃赛科技有限公司,2-4万/月,杭州-西湖区,民营公司,3-4年经验,6,招5人,五险一金 年终奖金 员工旅游,少于50人
1785,后端开发,区块链开发,区块链技术架构师/工程师,百富计算机技术（深圳）有限公司,1.5-2万/月,杭州,外资（非欧美）,3-4年经验,6,招1人,五险一金 补充医疗保险 补充公积金 员工旅游 交通补贴 餐饮补贴 通讯补贴 绩效奖金 年终奖金 定期体检,1000-5000人
1786,后端开发,区块链开发,区块链golang开发,杭州米链科技有限公司,2-3万/月,杭州-西湖区,民营公司,3-4年经验,6,招1人,年终奖金 五险一金 员工旅游,150-500人
1787,后端开发,区块链开发,区块链开发工程师,杭州羿贝科技有限公司,1.5-3万/月,杭州-西湖区,民营公司,3-4年经验,6,招1人,五险一金 餐饮补贴 通讯补贴 弹性工作 定期体检,少于50人
1788,后端开发,区块链开发,区块链底层开发师,抚州链视角互联网科技有限公司,1.2-2万/月,异地招聘,民营公司,3-4年经验,6,招1人,五险一金 员工旅游 专业培训 年终奖金 弹性工作 法定假日,50-150人
1789,后端开发,区块链开发,售前工程师（区块链),城云科技（中国）有限公司,2-2.5万/月,杭州-上城区,外资（欧美）,5-7年经验,6,招若干人,五险一金 补充医疗保险 通讯补贴 交通补贴 年终奖金 股票期权 绩效奖金 弹性工作 定期体检,150-500人
1790,后端开发,区块链开发,性能测试工程师,大连东软思维科技发展有限公司,0.8-1万/月,杭州-萧山区,民营公司,2年经验,5,招2人,五险一金 餐饮补贴 补充医疗保险 通讯补贴 年终奖金,1000-5000人
1791,后端开发,区块链开发,技术开发（杭州）,江苏荣泽信息科技股份有限公司,1.5-2万/月,杭州,民营公司,在校生/应届生,7,招5人,,
1792,后端开发,高级软件工程师,Java高级开发工程师,浙江航天信息有限公司,1-2万/月,杭州,国企,3-4年经验,6,招2人,带薪年假 五险一金 绩效奖金 节日福利 加班补贴 通讯补贴 高温补贴 专业培训,150-500人
1793,后端开发,高级软件工程师,Java资深开发工程师,杭州卓健信息科技有限公司,1.5-2.5万/月,杭州-江干区,民营公司,5-7年经验,6,招1人,五险一金 餐饮补贴 专业培训 绩效奖金 定期体检,150-500人
1794,后端开发,高级软件工程师,JAVA工程师,杭州书微信息科技有限公司,1-1.5万/月,杭州-西湖区,民营公司,2年经验,5,招2人,,50-150人
1795,后端开发,高级软件工程师,C#开发工程师,杭州微风企科技有限公司,1.2-2.4万/月,杭州-西湖区,合资,2年经验,6,招1人,五险一金 年终奖金 弹性工作 绩效奖金 节日福利 员工旅游,50-150人
1796,后端开发,高级软件工程师,Java开发经理,杭州智诚惠通科技有限公司,1.5-2.1万/月,杭州,民营公司,3-4年经验,6,招1人,五险一金 交通补贴 通讯补贴 定期体检 餐饮补贴,50-150人
1797,后端开发,高级软件工程师,UNIX C工程师（杭州）,上海思群软件有限公司,1.2-1.5万/月,杭州-上城区,民营公司,1年经验,,招8人,五险一金 绩效奖金 补充医疗保险 定期体检 餐饮补贴,50-150人
1798,后端开发,高级软件工程师,高级java开发工程师（项目经理方向）,广州帝隆科技股份有限公司,1.5-2.5万/月,杭州-滨江区,上市公司,5-7年经验,6,招1人,五险一金 绩效奖金 定期体检 员工旅游 餐饮补贴 年终奖金,150-500人
1799,后端开发,高级软件工程师,.NET研发工程师,浙江莱达信息技术有限公司,0.8-1.2万/月,杭州-西湖区,民营公司,2年经验,5,招3人,五险一金 定期体检 员工旅游 餐饮补贴 年终奖金,50-150人
1800,后端开发,高级软件工程师,后端研发工程师(.net方向),浙江凌镜智能有限公司,1-1.5万/月,杭州-滨江区,民营公司,2年经验,6,招1人,五险一金 交通补贴 餐饮补贴 绩效奖金 周末双休 员工旅游,少于50人
1801,后端开发,高级软件工程师,软件研发工程师,杭州百慧医疗设备有限公司,1-1.2万/月,杭州-江干区,民营公司,2年经验,6,招若干人,五险一金 员工旅游 餐饮补贴 年终奖金 弹性工作 定期体检 绩效奖金 专业培训 出国机会 节日福利,少于50人
1802,后端开发,高级软件工程师,Java开发主管,杭州平航科技有限公司,1.8-2.5万/月,杭州-滨江区,民营公司,3-4年经验,6,招1人,五险一金 高温补贴 带薪年假 定期体检 专业培训,50-150人
1803,后端开发,高级软件工程师,Java开发工程师,杭州点皓科技有限公司,0.8-1.3万/月,杭州-西湖区,民营公司,3-4年经验,6,招5人,员工旅游 餐饮补贴 年终奖金 定期体检 绩效奖金 五险一金,少于50人
1804,后端开发,高级软件工程师,Java开发工程师,杭州思伟科技股份有限公司,0.8-1.2万/月,杭州,民营公司,2年经验,5,招1人,五险一金 员工旅游 餐饮补贴 通讯补贴 年终奖金 定期体检 股票期权,50-150人
1805,后端开发,高级软件工程师,Java高级开发工程师,浙江飞图影像科技有限公司,1.5-2万/月,杭州-拱墅区,民营公司,3-4年经验,6,招2人,五险一金 员工旅游 弹性工作 年终奖金,50-150人
1806,后端开发,高级软件工程师,Java开发工程师,上海天好信息技术股份有限公司,1-2万/月,杭州,民营公司,3-4年经验,5,招若干人,五险一金 补充医疗保险 交通补贴 餐饮补贴 通讯补贴 专业培训 绩效奖金 定期体检,150-500人
1807,后端开发,高级软件工程师,高级Java开发工程师,浙江正元智慧科技股份有限公司,1.2-2.4万/月,杭州-余杭区,民营公司,5-7年经验,6,招5人,五险一金 免费班车 交通补贴 餐饮补贴 通讯补贴 专业培训 年终奖金 定期体检,500-1000人
1808,后端开发,高级软件工程师,Java高级开发工程师,浙江贵仁信息科技股份有限公司,1.3-1.8万/月,杭州,民营公司,3-4年经验,6,招1人,五险一金 补充公积金 员工旅游 交通补贴 餐饮补贴 通讯补贴 专业培训 股票期权 年终奖金 绩效奖金,150-500人
1809,后端开发,高级软件工程师,Java软件开发工程师,杭州维科软件工程有限责任公司,0.8-1.5万/月,杭州-余杭区,合资,无需经验,5,招2人,五险一金 员工宿舍 周末双休 法定节假日 带薪年假 培训补助 员工旅游 绩效奖金 年度体检,50-150人
1810,后端开发,高级软件工程师,高级软件工程师-资管（架构办）,恒生电子股份有限公司,2-2.5万/月,杭州-滨江区,民营公司,3-4年经验,6,招5人,五险一金 补充医疗保险 免费班车 员工旅游 交通补贴 餐饮补贴 通讯补贴 定期体检 弹性工作 年终奖金,5000-10000人
1811,后端开发,高级软件工程师,java开发工程师,中电文思海辉,1-1.5万/月,杭州,外资（欧美）,1年经验,6,招2人,,10000人以上
1812,后端开发,高级软件工程师,Java开发工程师,中电金信软件有限公司,1-1.5万/月,杭州-萧山区,国企,3-4年经验,6,招5人,,10000人以上
1813,后端开发,高级软件工程师,技术专家,苏州模流分析软件有限公司,15-20万/年,异地招聘,外资（非欧美）,5-7年经验,6,招2人,五险一金 专业培训 出国机会 绩效奖金 年终奖金 定期体检 员工旅游 餐饮补贴 生日礼金,150-500人
1814,后端开发,高级软件工程师,资深机器视觉算法软件工程师,杭州乔戈里科技有限公司,20-40万/年,杭州,民营公司,3-4年经验,6,招若干人,五险一金 员工旅游 股票期权 年终奖金 绩效奖金 定期体检 弹性工作 出差补贴 节日福利,50-150人
