,big_category,small_category,job_name,company_name,salary,work_area,company_type,work_year,education,recruitment_scale,welfare,company_size
1258,运维/技术支持,运维开发,运维开发工程师,深圳市星宫数据科技有限公司,1.5-3万/月,深圳-南山区,民营公司,3-4年经验,6,招2人,,50-150人
1259,运维/技术支持,运维开发,运维工程师,深圳市稀有科技有限责任公司,4.5-6千/月,深圳-宝安区,创业公司,无需经验,5,招2人,,少于50人
1260,运维/技术支持,运维开发,SRE 运维工程师-企业应用,字节跳动,2.5-5万/月,深圳,民营公司,3-4年经验,6,招5人,六险一金 晋升空间大 大牛带队 免费三餐 租房补贴,10000人以上
1261,运维/技术支持,运维开发,Notes运维工程师,富士康科技集团工管资讯,4-6千/月,深圳-龙华区,外资（非欧美）,无需经验,5,招若干人,五险一金 绩效奖金 年终奖金 定期体检 免费班车,10000人以上
1262,运维/技术支持,运维开发,运维服务工程师（驻场）,深圳航天信息有限公司,0.6-1万/月,深圳-坪山区,国企,无需经验,6,招1人,周末双休 带薪年假 五险一金 全勤奖 节日福利 专业培训 交通补贴 通讯补贴 高温补贴 年底双薪,500-1000人
1263,运维/技术支持,运维开发,运维工程师,神州数码系统集成服务有限公司深圳分公司,0.8-1.2万/月,深圳-福田区,民营公司,2年经验,6,招1人,五险一金 餐饮补贴 通讯补贴 定期体检 补充医疗保险 专业培训 年终奖金,10000人以上
1264,运维/技术支持,运维开发,java运维开发工程师,武汉佰钧成技术有限责任公司,1.1-1.4万/月,深圳-龙华区,民营公司,3-4年经验,6,招1人,补充医疗保险 定期体检 带薪年假 六险一金 12薪 周末双休 965,10000人以上
1265,运维/技术支持,运维开发,高级运维开发工程师（运维监控）,金蝶软件（中国）有限公司,2-4万/月,深圳,外资（非欧美）,5-7年经验,6,招若干人,带薪年假 五险一金 绩效奖金 节日福利 通讯补贴 员工旅游 定期体检 补充医疗保险 年终奖金 专业培训,5000-10000人
1266,运维/技术支持,运维开发,高级运维开发工程师,深圳织算科技有限公司,2-3.5万/月,深圳,民营公司,5-7年经验,6,招1人,,50-150人
1267,运维/技术支持,运维开发,运维开发工程师,深圳前海乐寻坊区块链科技有限公司,0.8-1.2万/月,深圳,民营公司,2年经验,5,招1人,,少于50人
1268,运维/技术支持,运维开发,运维工程师,深圳市同和信息技术有限公司,1-1.5万/月,深圳-福田区,民营公司,3-4年经验,5,招1人,,500-1000人
1269,运维/技术支持,运维开发,运维开发工程师,深圳市逆熵科技有限公司,0.8-1.2万/月,深圳-宝安区,民营公司,无需经验,6,招1人,,少于50人
1270,运维/技术支持,运维开发,系统运维工程师,深圳润君网络科技有限公司,2-4万/月,深圳-南山区,民营公司,3-4年经验,5,招2人,五险一金 弹性工作 年终奖金 带薪年假 项目奖金,少于50人
1271,运维/技术支持,运维开发,运维开发工程师,北京德智臻观科技有限公司,1-2万/月,深圳-南山区,民营公司,3-4年经验,5,招1人,,150-500人
1272,运维/技术支持,运维开发,Linux运维工程师,傲讯全通科技（深圳）有限公司,1-2万/月,深圳,外资（非欧美）,2年经验,6,招若干人,五险一金 绩效奖金 员工旅游,50-150人
1273,运维/技术支持,运维开发,DevOps工程师,深圳市本汇宝科技有限公司,1-2万/月,深圳-福田区,民营公司,3-4年经验,5,招1人,五险一金 补充公积金 餐饮补贴 弹性工作 年终奖金 员工旅游,150-500人
1274,运维/技术支持,运维开发,DevOps 运维开发工程师,深圳市至诚峰汇科技有限公司,1.5-2万/月,深圳-罗湖区,民营公司,3-4年经验,6,招1人,五险一金 餐饮补贴 专业培训 年终奖金 绩效奖金 节假日福利 周末双休,少于50人
1275,运维/技术支持,运维开发,云工程师,精诚（中国）企业管理有限公司,0.7-1.5万/月,深圳-罗湖区,外资（非欧美）,1年经验,6,招1人,五险一金 绩效奖金 定期体检 周末双休 有薪事假 通讯补贴 定期团建,150-500人
1276,运维/技术支持,运维开发,运维开发,深圳市鼎驰科技发展有限公司,1-1.5万/月,深圳-福田区,民营公司,3-4年经验,5,招3人,员工旅游 节日福利 弹性工作 六险一金 不加班 带薪年假 节日礼物,150-500人
1277,运维/技术支持,运维开发,开发运维工程师,广州元曜软件有限公司,0.8-1.5万/月,深圳,民营公司,2年经验,6,招2人,五险一金 交通补贴 餐饮补贴 通讯补贴 出国机会 定期体检,150-500人
1278,运维/技术支持,运维开发,运维开发工程师（深圳）,四川久远银海软件股份有限公司,1-1.5万/月,深圳-南山区,上市公司,2年经验,6,招3人,,1000-5000人
1279,运维/技术支持,运维开发,运维开发,西安明月华炎信息科技有限公司,0.9-1.3万/月,深圳,民营公司,1年经验,6,招2人,五险一金 定期体检 员工旅游,150-500人
1280,运维/技术支持,运维开发,数据库运维开发,上海爱可生信息技术股份有限公司,1.2-2万/月,深圳,民营公司,3-4年经验,6,招若干人,五险一金 员工旅游 定期体检 餐饮补贴,150-500人
1281,运维/技术支持,运维开发,系统运维岗,北京腾信软创科技股份有限公司,1-1.5万/月,深圳-福田区,上市公司,3-4年经验,5,招2人,,1000-5000人
1282,运维/技术支持,运维开发,高级运维开发工程师,深圳绿米联创科技有限公司,2.5-3.5万/月,深圳-南山区,民营公司,8-9年经验,6,招1人,,1000-5000人
1283,运维/技术支持,运维开发,运维开发工程师,腾云悦智科技（深圳）有限责任公司,1.5-3万/月,深圳-南山区,民营公司,5-7年经验,5,招1人,五险一金 员工旅游 专业培训 通讯补贴 绩效奖金,500-1000人
1284,运维/技术支持,运维开发,运维工程师,成都迈思信息技术有限公司,1-1.5万/月,深圳,民营公司,3-4年经验,5,招2人,五险一金 绩效奖金 年终奖金,150-500人
1285,运维/技术支持,运维开发,运维产品经理,深圳市云泽安科技有限公司,0.6-1万/月,深圳-福田区,民营公司,2年经验,5,招1人,五险一金 年终奖金 周末双休,少于50人
1286,运维/技术支持,运维开发,运维开发工程师,深圳匠人网络科技有限公司,1-1.5万/月,深圳-南山区,民营公司,2年经验,6,招1人,五险一金 绩效奖金 周末双休 餐饮补贴 定期体检 股票期权 年终奖金 交通补贴,50-150人
1287,运维/技术支持,运维开发,IT/运维工程师,深圳市昇利扬科技有限公司,0.8-1.2万/月,深圳,民营公司,3-4年经验,5,招2人,五险一金 员工旅游 绩效奖金 年终奖金 股票期权,150-500人
1288,运维/技术支持,运维开发,运维工程师,宏图瀛通（广州）人力资源有限公司,1-2.1万/月,深圳,外资（欧美）,3-4年经验,5,招1人,带薪年假 全勤奖 节日福利 专业培训 绩效奖金 免费班车 弹性工作 加班补贴 周末双休 餐饮补贴,150-500人
1289,运维/技术支持,运维开发,运维开发工程师,深圳市极限网络科技有限公司,0.8-1.5万/月,深圳,民营公司,2年经验,5,招3人,五险一金 专业培训 绩效奖金 节日福利 晋升机会,50-150人
1290,运维/技术支持,运维开发,运维工程师,成都天用唯勤科技有限公司,1.1-1.2万/月,深圳,民营公司,2年经验,5,招5人,,少于50人
1291,运维/技术支持,运维开发,运维工程师（偏开发）,深圳市拓安信计控仪表有限公司,1.4-2万/月,深圳-南山区,民营公司,5-7年经验,5,招1人,带薪年假 五险一金 餐饮补贴 丰厚年终奖 项目奖 弹性工作,500-1000人
1292,运维/技术支持,运维开发,开发运维工程师,深圳民航凯亚有限公司,0.8-1.3万/月,深圳-南山区,国企,1年经验,5,招1人,专业培训 年终奖金 周末双休 加班补贴 餐饮补贴 定期体检 运动协会 全额五险一金 探亲假享路费,150-500人
1293,运维/技术支持,运维开发,机电维护员,深圳市佳创业科技有限公司,6-8千/月,深圳-龙华区,民营公司,1年经验,5,招若干人,,150-500人
1294,运维/技术支持,运维开发,113157-应用平台运维开发工程师（深圳）,平安科技（深圳）有限公司,20-30万/年,深圳-南山区,民营公司,2年经验,6,招3人,五险一金 绩效奖金 带薪年假 定期体检 节日福利,1000-5000人
1295,运维/技术支持,运维开发,PeopleSoft 运维岗,北京护航科技股份有限公司,1-1.5万/月,深圳-南山区,民营公司,2年经验,6,招1人,五险一金 年终奖金 绩效奖金 通讯补贴 带薪年假,500-1000人
1296,运维/技术支持,运维开发,运维工程师,深圳市前海亿车科技有限公司,1-1.5万/月,深圳-南山区,民营公司,2年经验,5,招3人,五险一金 弹性工作 定期体检 专业培训 员工旅游 绩效奖金 通讯补贴 股票期权 年终奖金,150-500人
1297,运维/技术支持,运维开发,系统运维工程师,申朴信息技术（上海）股份有限公司,1.2-1.8万/月,深圳-福田区,上市公司,3-4年经验,6,招1人,五险一金 年终奖金 交通补贴 餐饮补贴 周末双休,500-1000人
1298,运维/技术支持,运维开发,高级运维主管,亚略特生物识别科技有限公司,1.5-2.5万/月,深圳-南山区,民营公司,8-9年经验,6,招若干人,绩效奖金 年终奖金 餐饮补贴 专业培训,150-500人
1299,运维/技术支持,运维开发,应用运维(21),上海复深蓝软件股份有限公司,1.2-1.8万/月,深圳-南山区,上市公司,3-4年经验,6,招若干人,做五休二 五险一金 节日福利 带薪年假 专业培训 年终奖金 交通补贴,1000-5000人
1300,运维/技术支持,运维开发,运维开发工程师,深圳巴伦如梭网络有限公司,1.5-2万/月,深圳-南山区,民营公司,3-4年经验,6,招若干人,绩效奖金 年度调薪 晋升机会,150-500人
1301,运维/技术支持,运维开发,运维开发,上海子蓝信息科技有限公司,1.2-2万/月,深圳-南山区,民营公司,1年经验,5,招若干人,五险一金 弹性工作 节日福利 包三餐,500-1000人
1302,运维/技术支持,运维开发,IDC运维工程师（上海）,上海吉贝克信息技术有限公司,1.3-2.3万/月,异地招聘,民营公司,3-4年经验,6,招4人,五险一金 员工旅游 通讯补贴 办公补贴 绩效奖金,500-1000人
1303,运维/技术支持,运维开发,产品运维,杭州博彦信息技术有限公司,1-1.5万/月,深圳-福田区,民营公司,3-4年经验,5,招1人,五险一金 定期体检,150-500人
1304,运维/技术支持,运维开发,运维开发工程师,深圳康诺思腾科技有限公司,2-3.5万/月,深圳-南山区,民营公司,5-7年经验,6,招1人,五险一金 补充公积金 年终奖金 定期体检 弹性工作,50-150人
1305,运维/技术支持,运维开发,运维工程师,深圳众投互联信息技术有限公司,1.5-2万/月,深圳-龙华区,民营公司,2年经验,5,招2人,,150-500人
1306,运维/技术支持,运维开发,运维开发工程师-深圳,北京筑龙信息技术有限责任公司,1.8-3.5万/月,深圳-福田区,民营公司,3-4年经验,6,招1人,,500-1000人
1307,运维/技术支持,运维开发,运维工程师,深圳市中悦科技有限公司,0.8-1.5万/月,深圳-龙岗区,民营公司,2年经验,6,招1人,五险一金 员工旅游 专业培训 绩效奖金 年终奖金 轻松下午茶 节日福利 定期团建,50-150人
1308,运维/技术支持,运维开发,运维工程师,深圳麦亚信科技股份有限公司,1.3-1.6万/月,深圳-福田区,上市公司,5-7年经验,5,招2人,五险一金 员工旅游 生日礼物 司龄补贴 过节礼物 年度体检 伯乐奖 级别福利,500-1000人
1309,运维/技术支持,运维开发,Devops运维开发工程师-外包,信必优(深圳)信息技术有限公司,1.8-2.5万/月,深圳-罗湖区,外资（欧美）,3-4年经验,5,招1人,五险一金 带薪年假 补充医疗保险 定期体检 节日福利 定期团建,1000-5000人
1310,运维/技术支持,运维开发,高级运维工程师,深圳市财盈通科技有限公司,1.5-2.5万/月,深圳-龙岗区,民营公司,5-7年经验,6,招1人,五险一金 年终奖金 专业培训 季度奖金 月度奖金,500-1000人
1311,运维/技术支持,运维开发,运维工程师,深圳微品致远信息科技有限公司,1.4-2万/月,深圳-南山区,民营公司,3-4年经验,5,招6人,,150-500人
1312,运维/技术支持,运维开发,运维工程师-云链,明源云,1.6-3万/月,深圳-南山区,民营公司,3-4年经验,6,招1人,五险一金 员工旅游 通讯补贴 专业培训 年终奖金 弹性工作 定期体检 下午茶,5000-10000人
1313,运维/技术支持,运维开发,运维工程师,深圳市德科信息技术有限公司,1-1.5万/月,深圳-南山区,合资,3-4年经验,5,招1人,周末双休 年终奖金 六险一金 定期体检 绩效奖金 健身房,1000-5000人
1314,运维/技术支持,运维开发,K8s高级运维工程师 (MJ000540),深圳市和讯华谷信息技术有限公司,2-4万/月,深圳-南山区,上市公司,5-7年经验,6,招1人,,500-1000人
1315,运维/技术支持,运维开发,资深运维工程师 (MJ000419),万兴科技集团股份有限公司,2.5-3.5万/月,深圳,上市公司,5-7年经验,6,招2人,五险一金 定期体检 带薪年假 全勤奖 节日福利 年终奖金,1000-5000人
1316,运维/技术支持,运维开发,SRE,深圳香港马会技术开发有限公司,2.5-3万/月,深圳-南山区,外资（非欧美）,5-7年经验,6,招1人,五险一金 补充医疗保险 员工旅游 年终奖金 定期体检 10天年假,150-500人
1317,运维/技术支持,运维开发,运维工程师,深圳市智慧盾科技有限公司,7-9千/月,深圳-南山区,民营公司,2年经验,5,招5人,五险一金 员工旅游 带薪年假 年终奖金 大型节日补贴,50-150人
1318,运维/技术支持,运维开发,PowerBuilder工程师,深圳市天方达健信科技股份有限公司,5-8千/月,深圳-罗湖区,民营公司,无需经验,6,招4人,五险一金 员工旅游 绩效奖金 年终奖金 周末双休,150-500人
1319,运维/技术支持,运维开发,网络运维工程师,招银网络科技（深圳）有限公司,2-3万/月,深圳-南山区,国企,2年经验,6,招若干人,,1000-5000人
1320,运维/技术支持,运维开发,自动化开发运维工程师,北京神州邦邦技术服务有限公司,0.7-1万/月,深圳-南山区,民营公司,2年经验,5,招4人,五险一金 专业培训 定期体检,
1321,运维/技术支持,运维开发,DBA运维(双休上沙地铁站),深圳市泓齐网络科技有限公司,1-1.5万/月,深圳-福田区,民营公司,3-4年经验,5,招1人,五险一金 带薪年假 节日福利 员工旅游,50-150人
1322,运维/技术支持,运维开发,初级云运维工程师,东软云科技有限公司,0.8-1万/月,深圳-南山区,合资,2年经验,5,招1人,五险一金 节日福利 带薪年假 定期体检 周末双休,1000-5000人
1323,运维/技术支持,运维开发,运维工程师,深圳市拓保软件有限公司,0.6-1万/月,深圳-福田区,民营公司,3-4年经验,6,招1人,五险一金 绩效奖金 弹性工作 周末双休 年终奖金,1000-5000人
1324,运维/技术支持,运维开发,桌面运维工程师,江苏人加信息科技有限公司,0.8-1.2万/月,深圳-龙岗区,民营公司,2年经验,5,招2人,专业培训 节日福利 五险一金,150-500人
1325,运维/技术支持,运维开发,运维开发工程师,广州碧软信息科技有限公司,1.5-2万/月,深圳,合资,5-7年经验,5,招2人,五险一金 员工旅游 年终奖金 绩效奖金,500-1000人
1326,运维/技术支持,运维开发,DevOps运维工程师,震兑工业智能科技有限公司,1.5-2.5万/月,深圳-宝安区,合资,3-4年经验,6,招1人,周末双休 带薪年假 五险一金 绩效奖金 节日福利 弹性工作,50-150人
1327,运维/技术支持,运维开发,运维工程师,深圳天海宸光科技有限公司,0.8-1.8万/月,深圳-南山区,民营公司,2年经验,6,招1人,五险一金 员工旅游 通讯补贴 股票期权 年终奖金 弹性工作 定期体检 超长假期 文娱活动 专业培训,50-150人
1328,运维/技术支持,运维开发,信息安全工程师,未来穿戴技术有限公司,1.4-2万/月,深圳-南山区,民营公司,3-4年经验,6,招1人,,500-1000人
1329,运维/技术支持,运维开发,Kubernetes软件工程师,印孚瑟斯技术（中国）有限公司,2-2.9万/月,深圳-南山区,外资（非欧美）,5-7年经验,5,招2人,五险一金 补充医疗保险 年终奖金,1000-5000人
1330,运维/技术支持,运维开发,网络推广专员,西安群书教育科技有限公司,6-8千/月,深圳-龙华区,民营公司,2年经验,6,招若干人,五险一金 补充医疗保险 补充公积金 免费班车 员工旅游 出国机会 餐饮补贴 交通补贴 绩效奖金 弹性工作,50-150人
1331,运维/技术支持,运维开发,技术支持工程师,卫宁健康科技集团股份有限公司,0.8-1.3万/月,深圳-南山区,上市公司,3-4年经验,6,招若干人,,1000-5000人
1332,运维/技术支持,运维开发,过程管理岗（偏运维，IT审计，项目管理）,上海舟恩信息技术有限公司,0.6-1.2万/月,深圳-南山区,民营公司,1年经验,5,招2人,五险一金 周末双休 带薪年假 人才推荐奖 商业保险,150-500人
1333,运维/技术支持,运维开发,通信基础设施管理岗（交易结算事业部）,深圳证券通信有限公司,1.6-2.3万/月,深圳,国企,2年经验,6,招1人,五险一金 绩效奖金 年终奖金 定期体检,500-1000人
1334,运维/技术支持,运维开发,淘宝运营专员,深圳市狼族网络科技有限公司,6-8千/月,深圳-龙岗区,民营公司,2年经验,5,招1人,,少于50人
1335,运维/技术支持,运维开发,.net工程师,深圳市昭行云科技有限公司,0.8-1.5万/月,深圳-南山区,民营公司,3-4年经验,5,招1人,五险一金 员工旅游 绩效奖金 年终奖金 定期体检,少于50人
1336,运维/技术支持,运维开发,交付工程师,深圳市誉托科技有限公司,1.5-2万/月,深圳-南山区,民营公司,5-7年经验,6,招若干人,五险一金 弹性工作,50-150人
1337,运维/技术支持,运维开发,SJZ306-IT开发工程师,长园深瑞继保自动化有限公司,1-2万/月,深圳-南山区,民营公司,3-4年经验,6,招4人,,1000-5000人
1338,运维/技术支持,运维开发,PHP程序员,深圳市河辰通讯技术有限公司,0.8-1万/月,深圳-南山区,民营公司,1年经验,5,招2人,五险一金 餐饮补贴 专业培训 绩效奖金 员工旅游,
1339,运维/技术支持,运维开发,系统开发工程师,深圳市中燃科技有限公司,1-1.5万/月,深圳-龙岗区,外资（非欧美）,2年经验,6,招2人,,10000人以上
1340,运维/技术支持,运维开发,软件开发工程师,深圳市欣熠建筑咨询有限公司,0.8-1.2万/月,异地招聘,外资（欧美）,2年经验,5,招2人,周末双休 带薪年假 绩效奖金 全勤奖 员工旅游 弹性工作 五险 七天带薪培训 高额业绩提成,50-150人
1341,运维/技术支持,运维开发,web前端开发实习（双休）,深圳市秉高科技有限公司,4.5-6千/月,深圳-宝安区,民营公司,在校生/应届生,5,招3人,五险一金 包住宿 带薪年假 绩效奖金 全勤奖 节日福利 员工旅游 年终奖金 周末双休,50-150人
1342,运维/技术支持,运维开发,运维工程师,蜂投网络技术（深圳）有限公司,1.5-2千/月,深圳-福田区,民营公司,3-4年经验,5,招1人,,少于50人
1343,运维/技术支持,运维开发,游戏运维SRE负责人,字节跳动,2-4万/月,深圳,民营公司,无需经验,6,招2人,下午茶 六险一金 扁平管理 免费三餐 弹性工作 租房补贴,10000人以上
1344,运维/技术支持,运维开发,SRE 运维工程师-飞书,字节跳动,2.5-5万/月,深圳,民营公司,3-4年经验,6,招5人,六险一金 晋升空间大 大牛带队 免费三餐 租房补贴,10000人以上
1345,运维/技术支持,运维开发,游戏运维工程师,字节跳动,2-4万/月,深圳,民营公司,无需经验,6,招5人,免费三餐 扁平管理 租房补贴 六险一金 弹性工作 下午茶,10000人以上
1346,运维/技术支持,运维开发,ITBP leader（华南区） — 深圳,字节跳动,2-4万/月,深圳,民营公司,5-7年经验,6,招1人,六险一金 弹性工作 大牛带队 餐补 租房补贴,10000人以上
1347,运维/技术支持,运维开发,自动化运维工程师-深圳,字节跳动,2-4万/月,深圳,民营公司,5-7年经验,6,招1人,六险一金 免费三餐 租房补贴 下午茶 扁平管理 健身瑜伽 用户过亿 大牛带队 晋升空间大,10000人以上
1348,运维/技术支持,运维开发,运维,武汉佰钧成技术有限责任公司,1-1.5万/月,深圳-龙华区,民营公司,3-4年经验,6,招5人,,10000人以上
1349,运维/技术支持,运维开发,IT网络维护,深圳市佳创业科技有限公司,0.8-1万/月,深圳-龙华区,民营公司,1年经验,5,招若干人,,150-500人
1350,运维/技术支持,运维开发,运维工程师,深圳市佳创业科技有限公司,6-8千/月,深圳-龙华区,民营公司,1年经验,5,招若干人,,150-500人
1351,运维/技术支持,运维开发,运维工程师,深圳市佳创业科技有限公司,6-8千/月,深圳-龙华区,民营公司,1年经验,5,招若干人,,150-500人
1352,运维/技术支持,运维开发,网络运维工程师,深圳市佳创业科技有限公司,6-8千/月,深圳-龙华区,民营公司,1年经验,5,招若干人,,150-500人
1353,运维/技术支持,运维开发,11411M-数据中心运维开发工程师,平安科技（深圳）有限公司,20-30万/年,深圳-南山区,民营公司,3-4年经验,6,招1人,五险一金 带薪年假 节日福利 绩效奖金 定期体检 高温补贴,1000-5000人
1354,运维/技术支持,运维开发,11415L-运维开发工程师,平安科技（深圳）有限公司,40-50万/年,深圳-南山区,民营公司,3-4年经验,6,招1人,五险一金 绩效奖金 带薪年假 定期体检 节日福利,1000-5000人
1355,运维/技术支持,运维开发,高级运维开发工程师,北京筑龙信息技术有限责任公司,2-2.5万/月,深圳-福田区,民营公司,5-7年经验,6,招1人,五险一金 员工旅游 年终奖金 专业培训 定期体检 绩效奖金,500-1000人
1356,运维/技术支持,运维开发,Devops开发运维工程师,深圳市鼎驰科技发展有限公司,1.2-1.9万/月,深圳-福田区,民营公司,5-7年经验,5,招2人,,150-500人
1357,运维/技术支持,运维开发,运维工程师（devops）,明源云,1.2-2.4万/月,深圳-南山区,民营公司,3-4年经验,6,招若干人,五险一金 通讯补贴 定期体检 员工旅游 年终奖金 补充医疗保险,5000-10000人
1358,运维/技术支持,运维开发,大数据运维开发工程师,招银网络科技（深圳）有限公司,2-4万/月,深圳-南山区,国企,2年经验,6,招若干人,,1000-5000人
1359,运维/技术支持,运维开发,数据库运维开发工程师,招银网络科技（深圳）有限公司,2-3万/月,深圳-南山区,国企,2年经验,6,招若干人,,1000-5000人
1360,运维/技术支持,运维开发,运维工程师,深圳麦亚信科技股份有限公司,1.1-1.2万/月,深圳-福田区,上市公司,3-4年经验,5,招1人,五险一金 员工旅游 生日礼物 司龄补贴 过节礼物 年度体检 伯乐奖 级别福利,500-1000人
1361,运维/技术支持,运维开发,API网关运维工程师,深圳市华云中盛科技股份有限公司,1.5-2.5万/月,异地招聘,民营公司,3-4年经验,5,招3人,五险一金 专业培训 绩效奖金 年终奖金 通讯补贴 定期体检,500-1000人
1362,运维/技术支持,运维开发,高级ceph存储运维工程师,深圳市华云中盛科技股份有限公司,2.5-3.5万/月,深圳-南山区,民营公司,5-7年经验,5,招2人,五险一金 专业培训 绩效奖金 年终奖金 通讯补贴 定期体检,500-1000人
1363,运维/技术支持,运维开发,容器开发运维工程师,深圳市华云中盛科技股份有限公司,1.5-2万/月,深圳-南山区,民营公司,3-4年经验,5,招5人,五险一金 员工旅游 交通补贴 通讯补贴 绩效奖金 年终奖金 定期体检 领导好 团队氛围好 环境好,500-1000人
1364,运维/技术支持,运维开发,网络运维工程师,江苏人加信息科技有限公司,0.8-1.2万/月,深圳,民营公司,2年经验,5,招2人,专业培训 节日福利 五险一金,150-500人
1365,运维/技术支持,运维开发,系统运维工程师,深圳市泓齐网络科技有限公司,1.4-2万/月,深圳,民营公司,3-4年经验,6,招1人,五险一金 带薪年假 节日福利 员工旅游 通讯补贴 交通补贴,50-150人
1366,运维/技术支持,运维开发,通信队列-运维工程师,腾云悦智科技（深圳）有限责任公司,1.1-2万/月,深圳-南山区,民营公司,2年经验,6,招2人,,500-1000人
1367,运维/技术支持,运维开发,运维工程师,深圳市德科信息技术有限公司,1-1.4万/月,深圳-福田区,合资,3-4年经验,5,招3人,五险一金 年终奖金 节日福利 绩效奖金,1000-5000人
1368,运维/技术支持,运维开发,openstack工程师,腾云悦智科技（深圳）有限责任公司,1-2万/月,深圳-南山区,民营公司,5-7年经验,5,招5人,五险一金 员工旅游 专业培训 通讯补贴 绩效奖金,500-1000人
1369,运维/技术支持,运维开发,11317G-资深云计算工程师（深圳）,平安科技（深圳）有限公司,20-30万/年,深圳-南山区,民营公司,5-7年经验,6,招3人,五险一金 绩效奖金 带薪年假 定期体检 节日福利,1000-5000人
