,big_category,small_category,job_name,company_name,salary,work_area,company_type,work_year,education,recruitment_scale,welfare,company_size
650,运维/技术支持,运维工程师,网络运维工程师 (MJ000354),深圳市新国都支付技术有限公司,1.2-1.5万/月,深圳-南山区,上市公司,在校生/应届生,5,招1人,五险一金 年终奖金 周末双休 节日福利,500-1000人
651,运维/技术支持,运维工程师,运维工程师,艾伯资讯（深圳）有限公司,3.5-5千/月,深圳-南山区,上市公司,在校生/应届生,5,招2人,五险一金 周末双休 法定节假日 带薪年假,150-500人
652,运维/技术支持,运维工程师,运维工程师（实习生）,盟拓软件（苏州）有限公司,3-4千/月,深圳,合资,在校生/应届生,6,招2人,,500-1000人
653,运维/技术支持,运维工程师,技术/IT支持,深圳市企微云科技集团有限公司,5-6千/月,深圳-南山区,民营公司,在校生/应届生,6,招2人,五险一金 带薪年假 周末双休 全勤奖,50-150人
654,运维/技术支持,运维工程师,运维技术人员,深圳市兆维联信科技有限公司,3-4.5千/月,深圳-福田区,民营公司,在校生/应届生,3,招1人,五险一金 年终奖金 年底双薪,少于50人
655,运维/技术支持,运维工程师,运维工程师,深圳市兆维联信科技有限公司,0.7-1万/月,深圳-福田区,民营公司,在校生/应届生,3,招2人,五险一金 年终奖金 年底双薪,少于50人
656,运维/技术支持,运维工程师,运维工程师,深圳市德科信息技术有限公司,1.3-1.5万/年,深圳-南山区,合资,3-4年经验,5,招2人,五险一金 员工旅游 年终奖金 专业培训,1000-5000人
657,运维/技术支持,自动化运维工程师,运维主管,物连家美（深圳）网络科技有限公司,1.8-2.5万/月,深圳-南山区,民营公司,5-7年经验,6,招1人,五险一金 餐饮补贴 股票期权 扁平管理 团队氛围好 周末双休,50-150人
658,运维/技术支持,自动化运维工程师,DevOps工程师,印孚瑟斯技术（中国）有限公司,3-4万/月,深圳-南山区,外资（非欧美）,10年以上经验,5,招1人,五险一金 专业培训 出国机会 年终奖金 定期体检 补充医疗保险 带薪年假 补充医疗险 朝九晚六,1000-5000人
659,运维/技术支持,自动化运维工程师,运维工程师,上海易宝软件有限公司深圳分公司,1.5-2万/月,异地招聘,民营公司,3-4年经验,6,招2人,五险一金 免费班车 员工旅游 交通补贴 餐饮补贴 绩效奖金 年终奖金 弹性工作 定期体检,5000-10000人
660,运维/技术支持,自动化运维工程师,智能设备运维工程师,深圳市丰宜科技有限公司,1.5-2万/月,深圳-福田区,外资（欧美）,5-7年经验,6,招若干人,五险一金 餐饮补贴 通讯补贴,150-500人
661,运维/技术支持,自动化运维工程师,环球自动插件工程师,深圳市福瑞达科技有限公司,0.8-1万/月,深圳-坪山区,民营公司,3-4年经验,5,招2人,带薪年假 五险一金 包住宿 节日福利 全勤奖 绩效奖金 加班补贴 住房补贴,150-500人
662,运维/技术支持,自动化运维工程师,储备工程师（校招）,广州嘉为科技有限公司,6-8千/月,异地招聘,民营公司,1年经验,6,招若干人,五险一金 餐饮补贴 通讯补贴 专业培训 定期体检,500-1000人
663,运维/技术支持,自动化运维工程师,11318Y-运维开发工程师,平安科技（深圳）有限公司,30-40万/年,深圳-南山区,民营公司,5-7年经验,6,招1人,五险一金 带薪年假 节日福利 绩效奖金 定期体检 高温补贴,1000-5000人
664,运维/技术支持,自动化运维工程师,运维自动化开发工程师,深圳市茁壮网络股份有限公司,1-1.5万/月,深圳-罗湖区,民营公司,2年经验,6,招2人,五险一金 免费班车 员工旅游 年终奖金 绩效奖金 专业培训 定期体检 免费下午茶,500-1000人
665,运维/技术支持,自动化运维工程师,自动化方案集成工程师（义乌）,深圳市正业玖坤信息技术有限公司,1-1.8万/月,异地招聘,上市公司,3-4年经验,6,招3人,五险一金 员工旅游 交通补贴 餐饮补贴 通讯补贴 专业培训 绩效奖金 年终奖金 周末双休 节日福利,50-150人
666,运维/技术支持,自动化运维工程师,云平台运维工程师,深圳市锐明技术股份有限公司,2.5-3万/月,深圳,上市公司,5-7年经验,6,招1人,五险一金 年终奖金 带薪年假 节日福利 通讯补贴 绩效奖金 员工旅游,1000-5000人
667,运维/技术支持,自动化运维工程师,高级运维工程师,青牛智胜（深圳）科技有限公司,1.5-2.2万/月,深圳-南山区,民营公司,5-7年经验,6,招1人,五险一金 餐饮补贴 年终奖金 绩效奖金 年终双薪 周末双休 员工旅游,少于50人
668,运维/技术支持,自动化运维工程师,运维工程师（devops）,明源云,1.2-2.4万/月,深圳-南山区,民营公司,3-4年经验,6,招若干人,五险一金 通讯补贴 定期体检 员工旅游 年终奖金 补充医疗保险,5000-10000人
669,运维/技术支持,自动化运维工程师,云平台运维工程师,上海裕宁信息科技有限公司,1-1.5万/月,深圳-南山区,民营公司,3-4年经验,6,招5人,五险一金 员工旅游 绩效奖金 年终奖金 交通补贴 专业培训,150-500人
670,运维/技术支持,自动化运维工程师,运维自动化开发,博彦科技（深圳）有限公司,1-1.5万/月,深圳-南山区,上市公司,3-4年经验,5,招2人,五险一金 年终奖金 定期体检 餐饮补贴 交通补贴,10000人以上
671,运维/技术支持,自动化运维工程师,自动化运维工程师,北京中亦安图科技股份有限公司,1-1.5万/月,深圳-福田区,民营公司,3-4年经验,5,招若干人,周末双休 带薪年假 五险一金 绩效奖金 节日福利 通讯补贴 加班补贴,500-1000人
672,运维/技术支持,自动化运维工程师,容器开发运维工程师,深圳市华云中盛科技股份有限公司,1.5-2万/月,深圳-南山区,民营公司,3-4年经验,5,招5人,五险一金 员工旅游 交通补贴 通讯补贴 绩效奖金 年终奖金 定期体检 领导好 团队氛围好 环境好,500-1000人
673,运维/技术支持,自动化运维工程师,AWS Cloud工程师,深圳市星光愿景科技有限公司,1-1.5万/月,深圳-南山区,创业公司,1年经验,6,招1人,,少于50人
674,运维/技术支持,自动化运维工程师,高级运维工程师,捷利港信软件（深圳）有限公司,1-1.5万/月,深圳-南山区,外资（非欧美）,3-4年经验,5,招2人,五险一金 年终奖金 股票期权 专业培训 餐饮补贴,50-150人
675,运维/技术支持,自动化运维工程师,自动控制工程师,深圳华汇世纪集团有限公司,1-1.5万/月,深圳-南山区,民营公司,2年经验,6,招1人,五险一金 补充医疗保险 节日福利 周末双休 季度团建,50-150人
676,运维/技术支持,自动化运维工程师,急招机械工程师/结构设计/自动化设备,深圳市速捷自动化设备有限公司,1-1.5万/月,深圳-龙华区,民营公司,2年经验,5,招2人,,
677,运维/技术支持,自动化运维工程师,初级web前端工程师,广州麦酷网络科技有限公司,6-8千/月,深圳-南山区,民营公司,无需经验,5,招2人,周末双休 带薪年假 五险一金 包住宿 节日福利 绩效奖金 全勤奖 做五休二 年终奖金 员工旅游,少于50人
678,运维/技术支持,自动化运维工程师,MES工程师,深圳市奋本科技有限公司,0.7-2万/月,深圳-宝安区,民营公司,3-4年经验,5,招1人,五险一金 员工旅游 交通补贴 餐饮补贴 通讯补贴 专业培训 绩效奖金 年终奖金 弹性工作,50-150人
679,运维/技术支持,自动化运维工程师,华南金证-项目实施工程师,深圳市金证科技股份有限公司,1-1.5万/月,深圳-南山区,上市公司,2年经验,5,招若干人,五险一金 员工旅游 交通补贴 通讯补贴 年终奖金 定期体检 专业培训 绩效奖金,5000-10000人
680,运维/技术支持,自动化运维工程师,急聘：SRE运维工程师,软通动力信息技术（集团）股份有限公司,2-2.5万/月,深圳-龙岗区,民营公司,3-4年经验,6,招10人,,10000人以上
681,运维/技术支持,自动化运维工程师,PLC工程师,星马自动化科技（深圳）有限公司,0.4-1万/月,深圳-光明新区,民营公司,无需经验,,招2人,免费班车 专业培训 年终奖金 绩效奖金 五险 带薪年假 返乡费,
682,运维/技术支持,自动化运维工程师,DevOps工程师,印孚瑟斯技术（中国）有限公司,3-4万/月,深圳-南山区,外资（非欧美）,10年以上经验,5,招1人,,1000-5000人
683,运维/技术支持,自动化运维工程师,DevOps JIRA engineer,印孚瑟斯技术（中国）有限公司,1.5-3.5万/月,深圳-南山区,外资（非欧美）,8-9年经验,5,招2人,五险一金 专业培训 出国机会 年终奖金 定期体检 补充医疗保险 带薪年假 补充医疗险 朝九晚六,1000-5000人
684,运维/技术支持,自动化运维工程师,自动化运维工程师,北京中亦安图科技股份有限公司,1.5-2万/月,深圳-福田区,民营公司,3-4年经验,5,招若干人,周末双休 带薪年假 五险一金 绩效奖金 节日福利 通讯补贴 加班补贴,500-1000人
685,运维/技术支持,自动化运维工程师,自动化运维交付实施工程师,广州嘉为科技有限公司,1-1.5万/月,异地招聘,民营公司,2年经验,6,招7人,五险一金 餐饮补贴 通讯补贴 年终奖金 定期体检,500-1000人
686,运维/技术支持,自动化运维工程师,MES售前工程师（义乌）,深圳市正业玖坤信息技术有限公司,1-1.8万/月,异地招聘,上市公司,3-4年经验,6,招3人,五险一金 员工旅游 交通补贴 餐饮补贴 通讯补贴 专业培训 绩效奖金 年终奖金 周末双休 节日福利,50-150人
687,运维/技术支持,系统工程师,运维高级工程师,深圳市光子跃动科技有限公司,1.5-3万/月,深圳,民营公司,3-4年经验,6,招若干人,五险一金 员工旅游 年终奖金 绩效奖金 弹性工作 专业培训,50-150人
688,运维/技术支持,系统工程师,IT业务及流程经理,枫渡酒店,1.8-3万/月,深圳-南山区,国企,5-7年经验,6,招1人,五险一金 补充医疗保险 带薪年假 餐补 周末双休,500-1000人
689,运维/技术支持,系统工程师,系统工程师,深圳一清创新科技有限公司,1.5-3万/月,深圳-南山区,民营公司,1年经验,6,招若干人,周末双休 弹性工作 带薪年假 五险一金 绩效奖金 节日福利,50-150人
690,运维/技术支持,系统工程师,安卓android 系统工程师,深圳市众云世纪科技有限公司,1-2万/月,深圳-宝安区,民营公司,2年经验,5,招3人,员工旅游 年终奖金 包住宿 出差补贴 节日福利 带薪年假 专业培训 出国机会 弹性工作,少于50人
691,运维/技术支持,系统工程师,运维工程师,深圳市德科信息技术有限公司,1-1.5万/月,深圳-南山区,合资,2年经验,6,招1人,周末双休 年终奖金 六险一金 定期体检 绩效奖金 健身房 交通补贴,1000-5000人
692,运维/技术支持,系统工程师,运维工程师,深圳易科声光科技股份有限公司,7-9千/月,深圳,民营公司,1年经验,5,招1人,五险一金 员工旅游 绩效奖金 周末双休 年终奖金 专业培训 全勤奖 节日福利 年度调薪 朝9晚6,150-500人
693,运维/技术支持,系统工程师,系统运维工程师,深圳市顶尖传诚科技有限公司,0.9-1.2万/月,深圳-南山区,民营公司,3-4年经验,5,招2人,,150-500人
694,运维/技术支持,系统工程师,桌面运维工程师,深圳市创见网络技术有限公司,4-8千/月,深圳-福田区,民营公司,1年经验,5,招若干人,周末双休 弹性工作 带薪年假 五险一金 绩效奖金 节日福利 专业培训 年终奖金 员工旅游 定期体检,少于50人
695,运维/技术支持,系统工程师,运维工程师,深圳鲲鹏天下科技有限公司,1.5-2.5万/月,深圳-南山区,民营公司,5-7年经验,6,招1人,五险一金 年终奖金 交通补贴 餐饮补贴,少于50人
696,运维/技术支持,系统工程师,主机运维工程师,广州赛意信息科技股份有限公司,0.8-1万/月,深圳-龙华区,上市公司,3-4年经验,6,招若干人,五险一金 免费班车 员工旅游 专业培训 年终奖金 定期体检 通讯补贴 股票期权 绩效奖金,1000-5000人
697,运维/技术支持,系统工程师,android framwork工程师,深圳市深智电科技有限公司,1.3-1.5万/月,深圳,民营公司,2年经验,6,招1人,员工旅游 餐饮补贴 绩效奖金 年终奖金 弹性工作,50-150人
698,运维/技术支持,系统工程师,系统维护工程师,南方电网深圳数字电网研究院有限公司,1-1.5万/月,深圳-南山区,国企,1年经验,6,招1人,五险一金 员工旅游 通讯补贴 定期体检 绩效奖金 年终奖金 专业培训 补充医疗保险 福利超好 团队专业,1000-5000人
699,运维/技术支持,系统工程师,系统工程师,普联技术有限公司（TP-LINK),1-1.5万/月,深圳,民营公司,无需经验,6,招3人,五险一金 股票期权,10000人以上
700,运维/技术支持,系统工程师,系统运维工程师,神州数码信息服务股份有限公司,1-1.5万/月,深圳-福田区,上市公司,3-4年经验,5,招若干人,,5000-10000人
701,运维/技术支持,系统工程师,Linux运维支持,武汉佰钧成技术有限责任公司,0.8-1.2万/月,深圳-南山区,民营公司,1年经验,5,招5人,五险一金 补充医疗保险 员工旅游 专业培训 绩效奖金 弹性工作 定期体检,10000人以上
702,运维/技术支持,系统工程师,系统集成工程师,深圳市紫金支点技术股份有限公司,0.6-1万/月,深圳-南山区,民营公司,无需经验,5,招2人,五险一金 餐饮补贴 定期体检 通讯补贴 绩效奖金 年终奖金,1000-5000人
703,运维/技术支持,系统工程师,Android系统工程师/软件工程师（系统层）,深圳市亿境虚拟现实技术有限公司,1.5-2.5万/月,深圳-宝安区,上市公司,3-4年经验,6,招2人,五险一金 补充医疗保险 员工旅游 专业培训 绩效奖金 年终奖金 定期体检,500-1000人
704,运维/技术支持,系统工程师,系统运维工程师,中电金信软件有限公司,1-1.5万/月,异地招聘,国企,3-4年经验,6,招1人,转正机会 轻松 愉悦,10000人以上
705,运维/技术支持,系统工程师,Android系统工程师,深圳市朗仁科技有限公司,2-3万/月,深圳-南山区,民营公司,5-7年经验,6,招1人,五险一金 员工旅游 年终奖金 节日福利 晋升空间 发展前景,500-1000人
706,运维/技术支持,系统工程师,高级系统管理员,深圳机场国际货站有限公司,0.9-1.2万/月,深圳-宝安区,合资,2年经验,6,招1人,五险一金 餐饮补贴 专业培训 年终奖金 定期体检 节日福利 带薪年假,150-500人
707,运维/技术支持,系统工程师,运维工程师,杭州悦达软件技术有限公司,0.8-1万/月,深圳-宝安区,民营公司,无需经验,5,招2人,五险一金 补充公积金 员工旅游 交通补贴 餐饮补贴 弹性工作 绩效奖金 周末双休 带薪年假 年终奖金,少于50人
708,运维/技术支持,系统工程师,运维开发(devops)工程师,傲讯全通科技（深圳）有限公司,1-2万/月,深圳,外资（非欧美）,3-4年经验,6,招若干人,五险一金 绩效奖金 员工旅游,50-150人
709,运维/技术支持,系统工程师,系统运维工程师,广州新中新工程技术有限公司,0.5-1万/月,深圳-南山区,民营公司,1年经验,5,招1人,交通补贴 带薪年假 周末双休 节日福利 餐饮补贴 通讯补贴 五险一金,150-500人
710,运维/技术支持,系统工程师,Linux运维工程师,深圳市广电信义科技有限公司,0.7-1.4万/月,深圳-南山区,国企,3-4年经验,5,招1人,五险一金 员工旅游 年终奖金 专业培训 定期体检 通讯补贴 餐饮补贴 交通补贴 节日福利 高温补贴,150-500人
711,运维/技术支持,系统工程师,服务器运维工程师,钜亿科技（深圳）有限公司,1.5-3万/月,深圳-龙华区,外资（非欧美）,5-7年经验,6,招2人,五险一金 补充医疗保险 绩效奖金 年终奖金 专业培训 定期体检,150-500人
712,运维/技术支持,系统工程师,SE--工程师,森沛科技（深圳）有限公司,0.8-2万/月,深圳,外资（非欧美）,3-4年经验,5,招1人,,50-150人
713,运维/技术支持,系统工程师,系统工程师,深圳江行联加智能科技有限公司,2-4万/月,深圳-宝安区,民营公司,3-4年经验,6,招1人,五险一金 餐饮补贴 年终奖金 弹性工作 定期体检 绩效奖金,50-150人
714,运维/技术支持,系统工程师,计算机化系统验证主管(J10070),北京三维天地科技股份有限公司深圳分公司,1-1.5万/月,异地招聘,民营公司,5-7年经验,6,招1人,五险一金 员工旅游 交通补贴 餐饮补贴 定期体检 出差补贴 节日福利,500-1000人
715,运维/技术支持,系统工程师,系统运维工程师,深圳市鼎驰科技发展有限公司,7-9千/月,深圳-福田区,民营公司,2年经验,5,招2人,员工旅游 节日福利 六险一金 不加班 带薪年假 节日礼物,150-500人
716,运维/技术支持,系统工程师,Android系统工程师,百富计算机技术（深圳）有限公司,2-3万/月,深圳-南山区,外资（非欧美）,3-4年经验,6,招1人,五险一金 补充商业保险 年底双薪 周末双休 餐饮补贴 专业培训 年终奖金 员工旅游 定期体检 有薪年假,1000-5000人
717,运维/技术支持,系统工程师,IT工程师,深圳市福瑞达科技有限公司,6-8千/月,深圳-坪山区,民营公司,5-7年经验,5,招1人,带薪年假 五险一金 包住宿 节日福利 全勤奖 绩效奖金 加班补贴 住房补贴,150-500人
718,运维/技术支持,系统工程师,系统运维工程师,深圳市易思博酷客科技有限公司,0.9-1万/月,深圳-南山区,民营公司,3-4年经验,6,招5人,五险一金 绩效奖金 弹性工作 带薪年假 节日福利 定期体检,1000-5000人
719,运维/技术支持,系统工程师,系统工程师,五象云谷有限公司,0.8-1万/月,异地招聘,合资,3-4年经验,5,招2人,五险一金 绩效奖金 年终奖金 定期体检,
720,运维/技术支持,系统工程师,运维工程师,高新现代智能系统股份有限公司,5-7千/月,深圳-南山区,民营公司,无需经验,5,招2人,五险一金 通讯补贴 绩效奖金 年终奖金 定期体检 节日福利 商业意外险,150-500人
721,运维/技术支持,系统工程师,系统运维工程师,珠海爱浦京软件股份有限公司,0.8-1.3万/月,深圳,外资（非欧美）,3-4年经验,5,招若干人,五险一金 员工旅游 年终奖金 绩效奖金 专业培训 定期体检 年度调薪,150-500人
722,运维/技术支持,系统工程师,系统工程师,深圳市瑞图生物技术有限公司,2-4万/月,深圳,民营公司,5-7年经验,6,招若干人,五险一金 员工旅游 专业培训 绩效奖金 年终奖金 餐饮补贴,150-500人
723,运维/技术支持,系统工程师,Android系统工程师,深圳市点嘀互联网络有限公司,2.5-4万/月,深圳,民营公司,3-4年经验,5,招3人,五险一金 员工旅游 年终奖金 专业培训,50-150人
724,运维/技术支持,系统工程师,系统安装部署工程师,深圳市蓝凌软件股份有限公司,1-2.2万/月,深圳-南山区,上市公司,3-4年经验,5,招若干人,通讯补贴 专业培训 年终奖金 弹性工作 高额五险一金 补贴多福利好 近地铁站 工作氛围好,1000-5000人
725,运维/技术支持,系统工程师,系统工程师,北京九桥同步软件有限公司,0.8-1万/月,深圳-宝安区,民营公司,1年经验,5,招若干人,五险一金 餐饮补贴 弹性工作 定期体检 电脑补贴 周末双休 工龄补贴 带薪年假,少于50人
726,运维/技术支持,系统工程师,高级IT工程师,深圳市联新移动医疗科技有限公司,1-1.5万/月,深圳-南山区,民营公司,5-7年经验,6,招1人,五险一金 补充医疗保险 专业培训 弹性工作 定期体检 年终奖金 股票期权,150-500人
727,运维/技术支持,系统工程师,系统运维工程师,深圳市蓝宇飞扬科技有限公司,1.5-2万/月,深圳-南山区,民营公司,5-7年经验,5,招3人,五险一金 绩效奖金 年终奖金 交通补贴 定期体检,50-150人
728,运维/技术支持,系统工程师,运维工程师,深圳市丽海弘金科技有限公司,0.8-1.3万/月,深圳-南山区,民营公司,2年经验,6,招1人,五险一金 餐饮补贴 年终奖金 定期体检 专业培训,150-500人
729,运维/技术支持,系统工程师,系统工程师,宽客（深圳）计算机技术服务有限公司,4-5万/月,深圳-宝安区,民营公司,3-4年经验,7,招2人,五险一金 年终奖金 员工旅游 绩效奖金 补充公积金 补充医疗保险,少于50人
730,运维/技术支持,系统工程师,高级系统运维工程师,相通网络技术有限公司,1-1.5万/月,深圳-福田区,民营公司,5-7年经验,5,招1人,五险一金 专业培训 年终奖金 股票期权,少于50人
731,运维/技术支持,系统工程师,系统运维工程师,深圳民航凯亚有限公司,1.5-1.9万/月,深圳-南山区,国企,5-7年经验,5,招1人,五险一金 交通补贴 餐饮补贴 通讯补贴 专业培训 年终奖金 定期体检,150-500人
732,运维/技术支持,系统工程师,浮标运行维护工程师,深圳市佳创业科技有限公司,6-8千/月,深圳-龙华区,民营公司,1年经验,5,招若干人,,150-500人
733,运维/技术支持,系统工程师,中级/高级系统工程师,深圳市华讯方舟光电技术有限公司,1.2-1.8万/月,深圳-宝安区,民营公司,2年经验,5,招若干人,五险一金 补充医疗保险 通讯补贴 定期体检 年终奖金 绩效奖金,150-500人
734,运维/技术支持,系统工程师,1131I5-系统工程师,平安科技（深圳）有限公司,2-2.5万/月,深圳-南山区,民营公司,5-7年经验,6,招1人,五险一金 绩效奖金 带薪年假 补充医疗保险 定期体检 节日福利,1000-5000人
735,运维/技术支持,系统工程师,机房运维工程师（会展中心）,深圳索信达数据技术有限公司,1-1.5万/月,深圳-福田区,外资（非欧美）,3-4年经验,5,招1人,五险一金 年终奖金 定期体检 专业培训 周末双休 做五休二 绩效奖金 全勤奖 节日福利,500-1000人
736,运维/技术支持,系统工程师,Citrix工程师,北京华夏威科软件技术有限公司,1-1.5万/月,深圳-福田区,民营公司,3-4年经验,6,招2人,五险一金 专业培训 绩效奖金 餐饮补贴,50-150人
737,运维/技术支持,系统工程师,Android系统工程师,深圳市随晨科技有限公司,1.2-2万/月,深圳-福田区,民营公司,3-4年经验,6,招3人,员工旅游 餐饮补贴 绩效奖金 周末双休 节日福利,50-150人
738,运维/技术支持,系统工程师,系统运维工程师,深圳市协卓软件有限公司,0.8-1.2万/月,深圳-宝安区,民营公司,3-4年经验,5,招3人,,150-500人
739,运维/技术支持,系统工程师,运维工程师,深圳楚星软件有限公司,0.8-1.5万/月,深圳-南山区,民营公司,3-4年经验,5,招1人,五险一金 交通补贴 年终奖金 节日福利 带薪年假 员工旅游 定期体检,少于50人
740,运维/技术支持,系统工程师,桌面运维,联想云领（成都）科技有限公司,5-7千/月,深圳-南山区,民营公司,1年经验,5,招10人,五险一金 定期体检 带薪年假 专业培训 节日福利 生日福利 下午茶 提供住宿,150-500人
741,运维/技术支持,系统工程师,安卓系统工程师,上海治熵信息科技有限公司,1-1.3万/月,深圳-南山区,民营公司,2年经验,6,招5人,年终奖金 绩效奖金 弹性工作 五险一金,少于50人
742,运维/技术支持,系统工程师,系统运维工程师,深圳市海恒智能科技有限公司,1.2-2万/月,深圳-南山区,民营公司,3-4年经验,6,招1人,交通补贴 五险一金 员工旅游 专业培训 绩效奖金 定期体检 年终奖金 餐饮补贴 加班补贴,150-500人
743,运维/技术支持,系统工程师,服务器系统工程师,深圳创新科技术有限公司,1.8-3万/月,深圳,外资（欧美）,5-7年经验,6,招若干人,五险一金 员工旅游 交通补贴 餐饮补贴 通讯补贴 绩效奖金 年终奖金 定期体检,150-500人
744,运维/技术支持,系统工程师,系统运维工程师,深圳市警视通实业有限公司,0.6-1.2万/月,深圳-龙华区,民营公司,3-4年经验,6,招3人,五险一金 员工旅游 年终奖金 绩效奖金,50-150人
745,运维/技术支持,系统工程师,IT工程师（SZJ1409）,招银云创信息技术有限公司,0.8-1.5万/月,深圳-福田区,民营公司,3-4年经验,6,招1人,补充医疗保险 五险一金 年终奖金 定期体检,500-1000人
746,运维/技术支持,系统工程师,运维主管,深圳市钱海网络技术有限公司,1-1.5万/月,深圳-南山区,民营公司,5-7年经验,6,招1人,五险一金 员工旅游 周末双休 法定节假日 员工活动 补充医疗保险 带薪年假,150-500人
747,运维/技术支持,系统工程师,Systems Engineer (DevOps),亿磐,,深圳-南山区,外资（欧美）,3-4年经验,,招若干人,专业培训 弹性工作 五险一金 补充医疗保险 上市公司 发展空间大,10000人以上
748,运维/技术支持,系统工程师,系统运维工程师（国信）,深圳市星网信通科技有限公司,1.5-1.8万/月,深圳-南山区,民营公司,2年经验,6,招1人,五险一金 交通补贴 餐饮补贴 通讯补贴 年终奖金 定期体检,150-500人
