,big_category,small_category,job_name,company_name,salary,work_area,company_type,work_year,education,recruitment_scale,welfare,company_size
1760,运维/技术支持,技术支持/维护工程师,Share Center 技术工程师,上海企顺信息系统有限公司,0.8-1.5万/月,异地招聘,民营公司,3-4年经验,5,招5人,,150-500人
1761,运维/技术支持,技术支持/维护工程师,系统机构工程师,森沛科技（深圳）有限公司,0.8-1.8万/月,深圳,外资（非欧美）,2年经验,5,招2人,五险一金 员工旅游 交通补贴 餐饮补贴 专业培训 年终奖金,50-150人
1762,运维/技术支持,技术支持/维护工程师,中级软件工程师,深圳市阳光视觉科技有限公司,0.8-1万/月,深圳-宝安区,民营公司,2年经验,5,招2人,员工旅游 股票期权 五险一金 专业培训 出国机会 定期体检 年终奖金 绩效奖金,50-150人
1763,运维/技术支持,技术支持/维护工程师,产品测试工程师,奕晟合（深圳）科技有限公司,0.8-1万/月,深圳-南山区,民营公司,无需经验,2,招6人,五险一金 员工旅游 餐饮补贴 专业培训 绩效奖金 定期体检 免费班车 弹性工作,50-150人
1764,运维/技术支持,技术支持/维护工程师,QE工程师,才众电脑（深圳）有限公司,0.8-1万/月,深圳-盐田区,外资（非欧美）,2年经验,4,招1人,专业培训,1000-5000人
1765,运维/技术支持,技术支持/维护工程师,Prometheus高级运维开发工程师,上海宏时数据系统有限公司,1.5-2.5万/月,深圳-福田区,民营公司,3-4年经验,5,招1人,五险一金 专业培训 定期体检 弹性工作 员工旅游 年终奖金 绩效奖金 出国机会,50-150人
1766,运维/技术支持,技术支持/维护工程师,IT技术支持,深圳市智寻信息技术有限公司,0.8-1万/月,深圳-宝安区,民营公司,2年经验,5,招若干人,弹性工作 五险一金 绩效奖金 节日福利 专业培训 通讯补贴,少于50人
1767,运维/技术支持,技术支持/维护工程师,弱电工程师,中安创科（深圳）技术有限公司,6-8千/月,深圳-龙华区,民营公司,3-4年经验,5,招2人,五险一金 年终奖金,少于50人
1768,运维/技术支持,技术支持/维护工程师,初级计算机工程师,西安力控元泽科技有限公司,0.8-1万/月,深圳-罗湖区,合资,无需经验,4,招若干人,五险一金 补充医疗保险 补充公积金 交通补贴 年终奖金 绩效奖金 专业培训 弹性工作 员工旅游 餐饮补贴,150-500人
1769,运维/技术支持,技术支持/维护工程师,系统工程师（VMware）,广州南洋软件科技有限公司,0.8-1.8万/月,深圳-南山区,国企,1年经验,6,招2人,五险一金 员工旅游 交通补贴 餐饮补贴 通讯补贴 年终奖金 定期体检,少于50人
1770,运维/技术支持,技术支持/维护工程师,SOLIDWORKS三维设计工程师,深圳市立诺软件有限公司,0.8-1万/月,深圳,民营公司,3-4年经验,5,招1人,周末双休 带薪年假 五险一金 绩效奖金 全勤奖 节日福利 专业培训 商业保险,50-150人
1771,运维/技术支持,技术支持/维护工程师,应用开发支持工程师,百富计算机技术（深圳）有限公司,0.8-1万/月,深圳-南山区,外资（非欧美）,1年经验,6,招1人,五险一金 补充商业保险 员工旅游 餐饮补贴 年终奖金 年底双薪 周末双休 定期体检 专业培训 有薪年假,1000-5000人
1772,运维/技术支持,技术支持/维护工程师,IT技术支持,上海悦商信息科技有限公司,0.9-1.3万/月,深圳-南山区,民营公司,1年经验,6,招1人,五险一金 周末双休 带薪年假 定期体检 专业培训,150-500人
1773,运维/技术支持,技术支持/维护工程师,IT现场技术支持（韩资国际一线信息安全技术研发集团）,薪得付信息技术(上海)有限公司,0.7-1.2万/月,深圳-光明新区,外资（欧美）,1年经验,5,招1人,领导NICE 五险一金 成长空间 一线平台 弹性工作 交通补贴 餐饮补贴 通讯补贴 专业培训 年终奖金,500-1000人
1774,运维/技术支持,技术支持/维护工程师,系统工程师,深圳市奥怡轩实业有限公司,1-1.5万/月,深圳-福田区,民营公司,2年经验,5,招1人,五险一金 员工旅游 绩效奖金 专业培训 年终奖金 弹性工作 周末双休,50-150人
1775,运维/技术支持,技术支持/维护工程师,网络运维工程师实习,深圳赞橙网络科技有限公司,5-6千/月,深圳-盐田区,民营公司,无需经验,5,招3人,周末双休 带薪年假 五险一金 绩效奖金 补充公积金 年终奖金 定期体检,50-150人
1776,运维/技术支持,技术支持/维护工程师,ME工程师,深圳市福瑞达科技有限公司,1-1.5万/月,深圳-坪山区,民营公司,3-4年经验,2,招1人,带薪年假 五险一金 包住宿 节日福利 全勤奖 绩效奖金 加班补贴 住房补贴,150-500人
1777,运维/技术支持,技术支持/维护工程师,运维工程师,中国软件与技术服务股份有限公司,5-8千/月,深圳,上市公司,1年经验,6,招2人,五险一金 专业培训 通讯补贴 定期体检 绩效奖金,5000-10000人
1778,运维/技术支持,技术支持/维护工程师,38319U-IT运维工程师,深圳市电子商务安全证书管理有限公司,1-1.5万/月,深圳-南山区,国企,3-4年经验,6,招1人,五险一金 绩效奖金 定期体检 带薪年假 节日福利,150-500人
1779,运维/技术支持,技术支持/维护工程师,系统运维工程师,北京腾信软创科技股份有限公司,1-1.5万/月,深圳-福田区,上市公司,3-4年经验,6,招2人,,1000-5000人
1780,运维/技术支持,技术支持/维护工程师,软件安装维护工程师（常驻深圳）,上海腾程医学科技信息有限公司,0.8-1万/月,深圳-福田区,外资（欧美）,3-4年经验,5,招1人,五险一金 餐饮补贴 年终奖金 定期体检,50-150人
1781,运维/技术支持,技术支持/维护工程师,IDC数据中心服务受理工程师（中通网技）,广东胜通和科技服务有限公司,5-7千/月,深圳-福田区,国企,2年经验,5,招若干人,绩效奖金 节日福利 专业培训 五险一金 定期体检 员工旅游,10000人以上
1782,运维/技术支持,技术支持/维护工程师,运维工程师,广东中科慧据科技有限公司,5-7千/月,异地招聘,民营公司,1年经验,5,招5人,五险一金 员工旅游 定期体检 弹性工作 专业培训 年终奖金 绩效奖金 交通补贴 餐饮补贴 通讯补贴,50-150人
1783,运维/技术支持,技术支持/维护工程师,计算机信息技术员（包住+奖金）,北京市圣瑞物业服务有限公司西安市第三分公司,6-8千/月,深圳-龙华区,民营公司,无需经验,5,招若干人,五险一金 餐饮补贴 绩效奖金 定期体检 节日福利 生日福利 高温补贴,50-150人
1784,运维/技术支持,技术支持/维护工程师,网络及硬件设施维护,深圳市卡尔迅实业有限公司,6-8千/月,深圳-南山区,民营公司,2年经验,5,招1人,带薪年假 五险一金 节日福利 专业培训,少于50人
1785,运维/技术支持,技术支持/维护工程师,网络系统运维工程师,深圳海云安网络安全技术有限公司,0.7-1.5万/月,深圳-福田区,民营公司,2年经验,5,招1人,五险一金 弹性工作 餐饮补贴 绩效奖金 年终奖金 定期体检 专业培训,50-150人
1786,运维/技术支持,技术支持/维护工程师,网络施工工程师,深圳开维教育信息技术股份有限公司,6-8千/月,深圳-南山区,上市公司,1年经验,4,招1人,周末双休 五险一金 绩效奖金 节日福利 专业培训 带薪年假,150-500人
1787,运维/技术支持,技术支持/维护工程师,高级运维工程师,深圳鹏锐信息技术股份有限公司,2-3万/月,深圳-南山区,上市公司,5-7年经验,6,招1人,五险一金 餐饮补贴 弹性工作 周末双休 带薪年假,150-500人
1788,运维/技术支持,技术支持/维护工程师,数据中心运维值班,云聚数据科技（上海）有限公司,6-9千/月,深圳-光明新区,民营公司,5-7年经验,5,招1人,五险一金 餐饮补贴 年终奖金 绩效奖金,150-500人
1789,运维/技术支持,技术支持/维护工程师,自控维护工程师,深圳市水务科技有限公司,0.5-1万/月,深圳-福田区,国企,本科,6,招3人,五险一金 通讯补贴 餐饮补贴 绩效奖金 年终奖金 交通补贴 定期体检 节日福利 员工旅游 带薪年假,50-150人
1790,运维/技术支持,技术支持/维护工程师,智能化方案设计,深圳市云泽安科技有限公司,0.7-1万/月,深圳-福田区,民营公司,2年经验,5,招2人,五险一金 年终奖金,少于50人
1791,运维/技术支持,技术支持/维护工程师,供应链顾问,北京多来点信息技术有限公司深圳分公司,0.8-1万/月,深圳-福田区,民营公司,3-4年经验,5,招3人,带薪年假 绩效奖金 节日福利 交通补贴 通讯补贴 公司规模大 团队聚餐 技术大牛 扁平管理 发展空间大,500-1000人
1792,运维/技术支持,技术支持/维护工程师,存储工程师,北京易九州科技有限公司,1-1.5万/月,深圳-福田区,民营公司,3-4年经验,6,招1人,五险一金 补充医疗保险 员工旅游 通讯补贴 专业培训 绩效奖金 年终奖金 定期体检,50-150人
1793,运维/技术支持,技术支持/维护工程师,运维工程师,深圳市闻迅数码科技有限公司,0.8-1.5万/月,深圳-南山区,民营公司,2年经验,5,招2人,五险一金 年终奖金 绩效奖金 定期体检 员工旅游 专业培训 节日福利,50-150人
1794,运维/技术支持,技术支持/维护工程师,高级运维工程师,深圳弘广商科技有限公司,2-3万/月,深圳-南山区,民营公司,3-4年经验,5,招1人,补充公积金 员工旅游 年终奖金 绩效奖金 出国机会 交通补贴 餐饮补贴 弹性工作,150-500人
1795,运维/技术支持,技术支持/维护工程师,IT技术支持转软件测试 无经验,西安群书教育科技有限公司,6-8千/月,深圳-福田区,民营公司,无需经验,5,招2人,五险一金 补充医疗保险 补充公积金 免费班车 员工旅游 出国机会 餐饮补贴 交通补贴 绩效奖金 弹性工作,50-150人
1796,运维/技术支持,技术支持/维护工程师,双休IT技术助理（接受应届生）,深圳华杰共创科技有限公司,6-8千/月,深圳-龙岗区,民营公司,1年经验,2,招2人,五险一金 交通补贴 绩效奖金 专业培训 员工旅游,少于50人
1797,运维/技术支持,技术支持/维护工程师,系统运维工程师,深圳市睿服科技有限公司,1.3-2.3万/月,深圳-福田区,民营公司,3-4年经验,5,招3人,五险一金 补充医疗保险 周末双休 餐饮补贴 补充公积金 交通补贴 年终奖金,500-1000人
1798,运维/技术支持,技术支持/维护工程师,运维工程师,上海速强信息技术股份有限公司,1-1.5万/月,深圳,民营公司,2年经验,6,招若干人,五险一金 员工旅游 绩效奖金 年终奖金 定期体检 通讯补贴 交通补贴 生日礼券 节日福利 带薪休假,150-500人
1799,运维/技术支持,技术支持/维护工程师,软件运维工程师,上海音锋机器人股份有限公司,0.8-1.5万/月,深圳-南山区,上市公司,1年经验,5,招1人,五险一金 员工旅游 餐饮补贴 通讯补贴 专业培训 交通补贴 出国机会 绩效奖金,150-500人
1800,运维/技术支持,技术支持/维护工程师,网站开发与运维工程师,深圳市米尔科技有限公司,0.7-1.2万/月,深圳-龙岗区,民营公司,1年经验,5,招若干人,五险一金 补充商业保险 员工旅游 绩效奖金 年终奖金 定期体检 全勤奖 带薪年假 岗位晋升 节日福利,50-150人
1801,运维/技术支持,技术支持/维护工程师,大数据运维工程师（Hadoop+ES）,北京聘多多科技有限公司,1.5-2.5万/月,深圳-南山区,民营公司,3-4年经验,6,招1人,,50-150人
1802,运维/技术支持,技术支持/维护工程师,系统运维工程师,广州市讯方信息科技有限公司,6-8千/月,深圳-龙岗区,民营公司,1年经验,5,招2人,五险一金 交通补贴 绩效奖金 通讯补贴,150-500人
1803,运维/技术支持,技术支持/维护工程师,信息IT工程师,深圳市重投华讯太赫兹科技有限公司,1.3-2万/月,深圳-南山区,国企,3-4年经验,6,招1人,五险一金 交通补贴 年终奖金 绩效奖金 定期体检 专业培训 节假日福利 产品项目激励,150-500人
1804,运维/技术支持,技术支持/维护工程师,1131I6-基础设施工程师,平安科技（深圳）有限公司,30-40万/年,深圳-龙华区,民营公司,5-7年经验,6,招1人,五险一金 绩效奖金 带薪年假 定期体检 高温补贴 节日福利,1000-5000人
1805,运维/技术支持,技术支持/维护工程师,初级计算机工程师,陕西华凌破产清算有限公司,6-8千/月,深圳-南山区,合资,无需经验,5,招3人,,50-150人
1806,运维/技术支持,技术支持/维护工程师,高级技术分析师（系统顾问）,恩富软件（中国）有限公司,2-3万/月,深圳-福田区,外资（欧美）,5-7年经验,6,招1人,周末双休 弹性工作 带薪年假 五险一金 餐饮补贴 节日福利 专业培训,150-500人
1807,运维/技术支持,技术支持/维护工程师,机器人调试工程师,未来机器人（深圳）有限公司,6-8千/月,深圳-福田区,合资,1年经验,5,招2人,,150-500人
1808,运维/技术支持,技术支持/维护工程师,大数据高级运维,深圳市云帆加速科技有限公司,1.5-2.2万/月,深圳-南山区,民营公司,3-4年经验,6,招若干人,,50-150人
1809,运维/技术支持,技术支持/维护工程师,谱曲语音编程工程师,深圳市安泰威电子科技有限公司,6-8千/月,深圳-宝安区,民营公司,1年经验,4,招2人,五险一金 员工旅游 专业培训 年终奖金 绩效奖金,50-150人
1810,运维/技术支持,技术支持/维护工程师,桌面运维工程师,深圳索信达数据技术有限公司,5-7千/月,深圳-罗湖区,外资（非欧美）,2年经验,5,招1人,五险一金 年终奖金 定期体检 专业培训 周末双休 绩效奖金 节日福利 股票期权,500-1000人
1811,运维/技术支持,技术支持/维护工程师,诚聘计算机设计助理/可带,深圳市辉强信息互联科技有限公司,4.6-7千/月,深圳-南山区,民营公司,无需经验,4,招2人,五险一金 员工旅游 周末双休 绩效奖金 年终双薪 包吃包住 14薪 免费班车 股票期权,少于50人
1812,运维/技术支持,技术支持/维护工程师,智能硬件生产及维护工程师,深圳市神驼科技有限公司,0.7-1.2万/月,深圳-盐田区,民营公司,2年经验,5,招若干人,五险一金 绩效奖金 年终奖金 弹性工作 员工旅游,少于50人
1813,运维/技术支持,技术支持/维护工程师,IT桌面运维工程师（驻场甲方岗位）,深圳市佰航信息技术有限公司,6-8千/月,深圳-福田区,民营公司,1年经验,,招3人,,少于50人
1814,运维/技术支持,技术支持/维护工程师,BSP外设驱动工程师,江苏润和软件股份有限公司,1.5-2万/月,异地招聘,民营公司,1年经验,5,招若干人,五险一金 餐饮补贴 年终奖金 专业培训 定期体检 绩效奖金,5000-10000人
1815,运维/技术支持,技术支持/维护工程师,工业互联网项目工程师,新科益系统与咨询（上海）有限公司,20-30万/年,深圳-南山区,外资（非欧美）,3-4年经验,6,招1人,五险一金 员工旅游 年终奖金 周末双休 节日福利,50-150人
1816,运维/技术支持,技术支持/维护工程师,运维工程师,深圳市协卓软件有限公司,1-1.5万/月,深圳-宝安区,民营公司,3-4年经验,5,招2人,五险一金 补充公积金 员工旅游 餐饮补贴 专业培训 绩效奖金 弹性工作 年终奖金 补充医疗保险 交通补贴,150-500人
1817,运维/技术支持,技术支持/维护工程师,软件运维工程师（深圳盐田）,西安交大长天软件股份有限公司,5-8千/月,深圳-盐田区,民营公司,1年经验,5,招若干人,五险一金 员工旅游 餐饮补贴 通讯补贴 绩效奖金 年终奖金 加班补贴 周末双休 节日福利,150-500人
1818,运维/技术支持,技术支持/维护工程师,IT运维工程师,深圳薪安易网络科技有限公司,1-1.5万/月,深圳-福田区,民营公司,3-4年经验,6,招1人,五险一金 带薪年假 节日福利 专业培训 周末双休,少于50人
1819,运维/技术支持,技术支持/维护工程师,机器视觉成像工程师,广东荣旭智能技术有限公司,0.7-1.3万/月,异地招聘,民营公司,2年经验,5,招2人,五险一金 绩效奖金 餐饮补贴 专业培训,50-150人
1820,运维/技术支持,技术支持/维护工程师,运维工程师,武汉东方赛思软件股份有限公司,5-8千/月,深圳-罗湖区,上市公司,1年经验,5,招若干人,五险一金 年终奖金 员工旅游 交通补贴 股票期权 定期体检 包吃包住 绩效奖金 专业培训 法定节假日,150-500人
1821,运维/技术支持,技术支持/维护工程师,PE技术工程师,安登利电子（深圳）有限公司,0.7-1.5万/月,深圳-宝安区,民营公司,1年经验,,招2人,交通补贴 五险一金 弹性工作 定期体检,50-150人
1822,运维/技术支持,技术支持/维护工程师,音响产品维修员,深圳市日声数码科技有限公司,6-8千/月,异地招聘,民营公司,2年经验,3,招5人,五险一金 节日福利 员工旅游 专业培训,50-150人
1823,运维/技术支持,技术支持/维护工程师,信息安全工程师（双休，五险一金）,广州竞远安全技术股份有限公司,0.8-1.5万/月,深圳-福田区,上市公司,1年经验,5,招5人,五险一金 通讯补贴 员工旅游 年终奖金 交通补贴 周末双休 带薪年假 节日福利 专业培训 商业保险,150-500人
1824,运维/技术支持,技术支持/维护工程师,弱电技术工程师,深圳市安百纳智能实业有限公司,4-6千/月,深圳-龙岗区,民营公司,无需经验,5,招2人,,少于50人
1825,运维/技术支持,技术支持/维护工程师,Oracle DBA,北京海量数据技术股份有限公司,1.5-2.5万/月,深圳-南山区,上市公司,5-7年经验,6,招1人,五险一金 补充医疗保险 员工旅游 专业培训 定期体检 弹性工作,150-500人
1826,运维/技术支持,技术支持/维护工程师,云计算工程师,深圳市金证科技股份有限公司,0.6-1万/月,深圳-南山区,上市公司,2年经验,6,招1人,五险一金 员工旅游 交通补贴 专业培训 定期体检 绩效奖金 股票期权 弹性工作,5000-10000人
1827,运维/技术支持,技术支持/维护工程师,技术安装人员,云小柜科技有限公司,6-8千/月,深圳-南山区,民营公司,3-4年经验,5,招若干人,,
1828,运维/技术支持,技术支持/维护工程师,电子产品维修工,深圳中宏安全技术股份有限公司,4.5-6千/月,深圳-宝安区,民营公司,2年经验,2,招1人,,50-150人
1829,运维/技术支持,技术支持/维护工程师,运维工程师,深圳市中悦科技有限公司,0.8-1万/月,深圳-龙岗区,民营公司,2年经验,6,招1人,五险一金 专业培训 绩效奖金 年终奖金 轻松下午茶 节日福利 定期团建,50-150人
1830,运维/技术支持,技术支持/维护工程师,运维工程师,青牛智胜（深圳）科技有限公司,1.3-1.8万/月,深圳-南山区,民营公司,3-4年经验,5,招1人,五险一金 餐饮补贴 年终奖金 绩效奖金 年终双薪 周末双休 带薪年假 通讯补贴,少于50人
1831,运维/技术支持,技术支持/维护工程师,初级运维工程师,明纳信息技术深圳有限公司,5-7千/月,深圳-龙华区,民营公司,1年经验,5,招若干人,五险一金 定期体检 员工旅游 年终奖金,50-150人
1832,运维/技术支持,技术支持/维护工程师,技术客户经理,亚信科技（成都）有限公司,1.5-2.5万/月,深圳,民营公司,3-4年经验,5,招若干人,五险一金 补充医疗保险 通讯补贴 定期体检 专业培训,1000-5000人
1833,运维/技术支持,技术支持/维护工程师,运维主管,深圳市钱海网络技术有限公司,1-1.5万/月,深圳-南山区,民营公司,5-7年经验,6,招1人,五险一金 员工旅游 周末双休 法定节假日 员工活动 补充医疗保险 带薪年假,150-500人
1834,运维/技术支持,技术支持/维护工程师,ERP工程师,深圳市晨龙包装自动化有限公司,5-8千/月,深圳-宝安区,民营公司,2年经验,6,招若干人,,50-150人
1835,运维/技术支持,技术支持/维护工程师,系统运维工程师（深圳）,上海携银信息科技有限公司,0.8-1.4万/月,深圳-南山区,民营公司,2年经验,5,招1人,五险一金 员工旅游 年终奖金 绩效奖金 弹性工作 专业培训,150-500人
1836,运维/技术支持,技术支持/维护工程师,ERP服务顾问,深圳市爱世达资讯科技有限公司,0.5-1万/月,深圳-南山区,民营公司,1年经验,5,招2人,五险一金 员工旅游 定期体检 带薪年假 年终奖金 通讯补贴 出差补贴 餐饮补贴 交通补贴 高温补贴,50-150人
1837,运维/技术支持,技术支持/维护工程师,软件测试助理（包住）,牛牛（深圳）人工智能有限公司,6-8千/月,深圳-宝安区,民营公司,无需经验,5,招3人,,50-150人
1838,运维/技术支持,技术支持/维护工程师,运维管理员,深圳证券通信有限公司,1.8-2.5万/月,深圳,国企,1年经验,6,招1人,五险一金 补充医疗保险 专业培训 绩效奖金 年终奖金 定期体检,500-1000人
1839,运维/技术支持,技术支持/维护工程师,视频监控技术工程师,深圳乐通信息技术有限公司,1-1.5万/月,深圳-福田区,民营公司,3-4年经验,6,招2人,,50-150人
1840,运维/技术支持,技术支持/维护工程师,IT技术支持（急聘）,深圳市智媒融合科技有限公司,0.7-1.2万/月,深圳-福田区,民营公司,2年经验,5,招1人,周末双休 弹性工作 带薪年假 五险一金 绩效奖金 全勤奖 节日福利 专业培训,50-150人
1841,运维/技术支持,技术支持/维护工程师,高级运维工程师,武汉牧望群网络科技有限公司,1.5-3万/月,异地招聘,合资,5-7年经验,5,招1人,五险一金 补充公积金 餐饮补贴 通讯补贴 出国机会 绩效奖金 年终奖金 弹性工作 交通补贴,50-150人
1842,运维/技术支持,技术支持/维护工程师,售后服务工程师(紧急招聘),广东迅维信息产业股份有限公司,6-8千/月,深圳-福田区,民营公司,2年经验,5,招3人,五险一金 员工旅游 交通补贴 专业培训 绩效奖金 年终奖金 带薪年假 节日福利 高温补贴 通讯补贴,150-500人
1843,运维/技术支持,技术支持/维护工程师,电子电气设备 调试工程师,深圳市科可派自动化技术有限公司,6-8千/月,深圳-龙岗区,民营公司,2年经验,5,招5人,补充医疗保险 餐饮补贴,50-150人
1844,运维/技术支持,技术支持/维护工程师,系统运维工程师,深圳市东方华信科技有限公司,1-1.5万/月,深圳,民营公司,3-4年经验,6,招1人,交通补贴 餐饮补贴 年终奖金 专业培训 定期体检 通讯补贴 弹性工作 免费班车 五险一金,50-150人
1845,运维/技术支持,技术支持/维护工程师,运维工程师,深圳市中深伟业科技有限公司,4-8千/月,深圳-宝安区,创业公司,2年经验,5,招若干人,五险一金 交通补贴 绩效奖金 年终奖金 专业培训,少于50人
1846,运维/技术支持,技术支持/维护工程师,维修工程师,深圳市岚明电子科技有限公司,0.7-1万/月,深圳-南山区,民营公司,2年经验,5,招2人,五险一金 带薪年假 绩效奖金 定期体检 员工旅游 部门活动,少于50人
1847,运维/技术支持,技术支持/维护工程师,系统运维/linux运维/系统管理（统招/学信网）,广东华钦指创软件技术有限公司,1-1.5万/月,深圳-罗湖区,民营公司,无需经验,5,招若干人,五险一金 补充医疗保险 加班补贴 节假日福利,1000-5000人
1848,运维/技术支持,技术支持/维护工程师,门禁安装技术员,深圳市博佳通科技有限公司,4.5-6千/月,深圳-龙岗区,民营公司,1年经验,2,招10人,五险一金 年终奖金 绩效奖金,50-150人
1849,运维/技术支持,技术支持/维护工程师,运维工程师,景瀚科技（深圳）有限公司,1.5-2万/月,深圳-福田区,外资（非欧美）,5-7年经验,6,招1人,五险一金 交通补贴 年终奖金 零食饮料 良好氛围 节假日多 年度调薪,50-150人
1850,运维/技术支持,技术支持/维护工程师,运维及售后维修工程师,深圳市思迈合电子有限公司,6-8千/月,深圳-龙岗区,民营公司,1年经验,5,招若干人,,少于50人
1851,运维/技术支持,技术支持/维护工程师,iOS开发工程师,深圳市蛋壳创意科技有限公司,1.5-2万/月,深圳-龙岗区,民营公司,3-4年经验,5,招1人,五险一金 地铁周边 年轻团队 领导nice 年终奖金 弹性工作 加班补贴,50-150人
1852,运维/技术支持,技术支持/维护工程师,生产技术员,沃思互联技术（深圳）有限公司,0.8-1万/月,深圳-龙华区,民营公司,2年经验,3,招若干人,五险一金 公司饭堂宿舍,50-150人
1853,运维/技术支持,技术支持/维护工程师,软件支持工程师,深圳香港马会技术开发有限公司,2-2.5万/月,深圳-南山区,外资（非欧美）,5-7年经验,6,招1人,五险一金 补充医疗保险 员工旅游 年终奖金 定期体检 10天年假,150-500人
1854,运维/技术支持,技术支持/维护工程师,云平台运维工程师,广西北投信创科技投资集团有限公司,1.5-2万/月,异地招聘,民营公司,3-4年经验,7,招若干人,五险一金 绩效奖金 年终奖金,500-1000人
